id,owner_id,creation_date,count,name,content
59641,klGQ8,2003/05/14 02:53:27,83,wsVrbb,trailing forethoughtfulness prelecture academization overemptiness endophragm Cryptocephala citriculturist interflux cottontail cecograph Turkophil frosting mongler Megatheriidae entangledly vivifier prooflessly improbable cinenegative
73950,pZ1T5,2019/05/11 16:14:05,1,vkhACbOlMpKPzWoe,prehypophysis supereligible overvehement cophosis cyclization nonignitible disallowableness overreaching ectorhinal peasantly strived stilpnosiderite anamnionic derate magirology seroreaction wat cicatricle superlie haustorium
95207,18Zhq,2023/04/21 08:43:07,31,talUrJYGgsUDSx,sminthurid butterfish untantalizing trinitroxylene floricultural Episcopally dietary otocariasis Culavamsa oolak baconweed Hornie Marpessa ringbark sexangle opposing ondagram certifiable spectrophobia upjerk
62428,UgGkw,2006/03/04 04:19:29,94,svhccRdUmetBpL,vatful wahine Guillermo bloodletting unbidable inspirer cranioclasm palebelly pneumony skippingly subhyaloid diverticulum ureteropyosis palmatifid incorruptly hypogenous mugience zebraic viduous mucoraceous
58794,ogLT2,2022/07/02 09:08:28,78,WHFGQLqMl,assimilability fiscal scenographical pharynogotome Kamiya Lonchopteridae tantrism Hydra mediatization nandine overexplanation moonlit jointly protractility strengite Berberian pallidiventrate ovile misdeclaration feaberry
83479,r0rth,2013/05/27 09:33:35,38,vl,tridentated carpetwoven stuckling thecasporal misfile hyperarchaeological Torontonian demoniacism abusively turbinatoconcave progrede demesman finickingness cretinous locomotiveman rectangulometer unfashionably knaveship misplease tropophyte
22255,DZLdq,2008/12/23 17:06:21,69,nrSKMMI,polychromatophile enwind mitigant paintbrush dysgenics uncivilizedly fluoric germal nonproprietor dyslogia medullization desponder magneticalness domineerer talking glowworm glandularly myelomeningitis roll casalty
42876,V0Qh1,2012/08/08 17:15:14,48,WCFBh,Carol baldly waterquake Nichael unmassacred presavage diathermotherapy bubble papaveraceous organoboron unbridle charadrine pediatry guimbard Comiakin centavo supramundane clothify frontad phosphatese
62203,7xcpA,2022/11/01 01:22:56,59,ShmEeFLBsCkBYAQserey,halitus electroirrigation decan ave eyedrop Grendel bassarisk Trollius sheepkeeper reflectometry credulous Sabbathbreaking nannyberry mule spinelike insuperability tuckner pishaug snowy fining
10383,E84Z0,2009/05/08 10:08:05,30,hiacgBuamG,lodgeable leiodermatous nondependent unfork blackstrap southeast Corinthian evangelion relativity improvident Obadiah conformably Normanize hyperalkalinity tarea meticulously macarize malacolite cranberry irritator
84388,GaTqS,2017/07/28 20:32:32,88,ppeO,pyodermic Cavicornia zoiatrics Oratorianism omissively regrate asperite nonusage celiemia Ascanius paradidymal venisonivorous heteromorphosis nese parsonly circumjacency wrought Oceanican camilla distinctness
75124,1ztEh,2003/04/03 01:18:30,3,xKhDFwvcbOoEV,vulpinism certie slingsman photovitrotype Almoravide paraformaldehyde fanam photographically underminister sheave foothook overbrush ethanamide nimbleness singularity tesack Vulcanian partless carbonigenous lamppost
45868,wf0fe,2000/01/28 03:52:11,79,SkYnfqCLUAHDvag,embassage afterproof ichthyopolist Gunz reliever unurged nongod impromptu Myxomycetales Leptothrix chatteringly tradecraft finagler scaff stormlike sublimely paroeciousness ringe caecally finished
75226,L54qr,2008/11/27 16:45:56,85,mmGkmZD,truckler Etruscologist melee rhizomatous eschewance disgustedly grip Brandenburger warmish ostiole prussic wagwit tussock underkeel nobiliary codbank dextrosinistral Taxus asiderite beleaguerment
26057,ZYCnX,2009/01/10 04:40:29,15,MnfGtVDqOUn,venomly mastaba locomotory scintillously surplusage palatodental Freyja transvectant misbias habitan disciplinatory trimuscular senecioid unmethylated staidly supplement twiddler orangism Vicki Languedocian
72192,KuukD,2023/12/15 18:18:40,51,EHpkmzNeksOxxdf,walahee optimal circumcise exequial innovationist borachio bossing bacilliparous boding calathus Acontias ovariosalpingectomy calvarium Angelo vergeboard algiomuscular amphiblestritis overstimulation enlacement plumoseness
55684,qSx6x,2003/04/08 05:05:00,10,LCzKPNq,decorist misotheist demonstratable ovicapsule homocoelous myrmekite brakehead suggillation thyrohyoidean tangs phaenomenal loath nameable pulpless cellular punchable Pythagorical anapaest Spitzenburg grappa
62475,9IDSX,2016/02/21 05:53:28,54,rDofoiRkFD,Pyrotherium Catty auxiliar semicollegiate disown inextensible subdepot nightwear exhortingly Knisteneaux triakisicosahedral bridgebuilding agitation Tunga yellow erythropsia sulfamine factitude antimonite ineffectually
16444,gYiug,2019/12/26 08:44:45,76,hbLnyBQzjiEqz,subsulphate presuccessfully cystoureteritis Justine autogenesis misattend overbashful fibrolipoma unwatchfulness lampoonist encomiastically halvaner redocket Gymnotidae fischerite cyanomethemoglobin effectually seaming drakestone stultiloquious
29291,FF8V8,2017/03/10 15:19:28,52,KerJRBCRrgMHTZ,Wahima downsinking uncentral nervous looseness apothecial alias hydrazino aquatical jiffy gymnocarpic largeheartedness cultish epigastrical prevelar Takayuki themelet nacrine chiasm chalybeous
40305,YuiCA,2018/05/10 03:11:50,88,NwON,shopkeepery auscultascope pseudoganglion monticulose axial phonogrammic adzooks calamitean undersomething Arianistic prayerless schonfelsite phantast thunderousness flyblow ascribe pamphletize legislational bisexed cachexy
10753,DA0C1,2012/03/17 09:40:14,32,TKKLaGlcdCMT,noiseproof roral migrainoid postdiluvian ashy metaspermous Snemovna diminutival hemadynamometer bobbiner ternatisect pinkeye meristelic hydrophilism gaize Napaean bathic ectosteally misgovernment rudderless
29615,b8CAZ,2008/09/07 06:02:52,44,sriglqyaOR,gnosiology engysseismology lunt gnathitis lexicographically Frankenia scapulobrachial tridentiferous untinted disliking Probosciger walkyrie doom Anglic betis suing honorance finikin pachydermial muscariform
75518,hdLHH,2023/04/04 19:43:25,14,qNrGn,nongelatinous irreverendly tenure Prosopis unmediatized cinema insensateness bug trichopterous Prunaceae Johan orage tui extispicious emigree rapid specking gastrohysterotomy tritanope Fabrikoid
1116,fXXzo,2019/09/10 13:35:39,57,rZwcHcWcxiMZOVJYin,Globigerinidae exequial priggishness turnplow aquaemanale Koipato acutangular excremental undeclaiming stroboscopic filterability Tachyglossidae Tarahumara undergrowl teachable archscoundrel unyeaned biparted riverwash eisteddfodism
80712,YNuxI,2004/04/13 02:07:17,67,eVVxqqLzvDFjyFNlN,underage uncomprising mantes isocorybulbin prey atomechanics thrummy intensate empirical latitude devaluate galliambic Monstera uninnovating tiplet antifebrile byword yin fitten reown
72949,jN4NE,2020/11/20 19:33:14,94,UBmq,hydrophyllaceous cryptoscope gaper twaddler Germanity tannyl Trochozoa subelectron antimachinery rachiocentesis unperverted harbingership supersensitive extraorganismal fifteenth carnification inexperienced preaffirm patheticalness monsignorial
14195,H4p4o,2014/11/12 23:16:30,47,kyrcvWiQmkznGqL,cyathophylline debarration unchangeful uncinariasis leptoprosopic unprecedentedness croaky Hemidactylus angiocholitis unitrope prognathy golkakra czarist cognizableness waterlike extrinsic genitalia overslip Armenize podophthalmic
38381,4FpqD,2022/07/04 11:19:09,15,fXYt,unslack adjudicate Thomism hike Jerseyman siphunculated overexpansive hexachloroethane fold keech inceptor mouthingly anilidoxime wisehead kilnrib chytra acridinium nonstooping unrecalled diotic
76537,vKJRS,2022/12/16 05:05:23,30,ac,Achaemenidae unboring Uiguric foam peery commendation deceleration adnomination geostatic seriocomically Loiseleuria counterbend overstowage extraneity beleaguer thecasporal accredited approbative enhearse tilth
7087,YQVI5,2015/10/27 06:22:20,8,zOD,fixer acromiodeltoid uncuckold pythonize affidation suspirious coaggregate copalm wainful Saxonization inimitable Xenophontic nonbasement bestrew esophagometer palaeofauna draggle antiparalytical cerebroscope preprint
37720,u60Vf,2018/12/17 05:30:12,33,ZLoG,jasperoid unfigured storiology tweesh errorless cyanopia foremeant Helen chisellike spermatorrhea quieten treacle clubwood honoraria summertree defense hysteron Jesper Curuminaca paratactic
