id,owner_id,creation_date,count,name,content
908,Ibp8J,2013/06/05 04:30:59,97,bqzvMLxms,airlift Combretaceae exenterate preventively Torosaurus unrebukably tridaily abruptedly premonopolize caprylin Samson boomless mola vassalless hygienization nidorous rehandling dermoidal ceramic sackless
1,QbBWh,2016/02/23 10:43:38,76,WlnFQ,professorate penetrate handless kryptol Philanthidae premium diablerie overwork copyist hedgy caprigenous place streak Ceratostomataceae vesanic unheroically Sabbatize bronchoscopic proscribable pneumatograph
975,bVmdz,2019/04/23 01:12:38,58,IWusk,formazyl underballast analogism hylogeny shedman Syrmian redecide neurochord gyratory additament supermolten huntedly schizophreniac alcoholuria oncotomy proclaiming perioophoritis protoepiphyte unwhispering lustrine
729,SuLpk,2004/07/07 16:12:25,16,lkcaxXuvM,piperine whereabout stereophotogrammetry Cracidae Baltimorean butterfat brushmaker Caesarian tovariaceous staminodium utchy resorcinism cephalothorax bombous reimportation eclectism Decian Ekronite misstatement extrazodiacal
384,aYaKI,2006/08/20 12:52:19,42,RJILnhEJxqnHUil,pseudoparaplegia misbegotten reglow spinstress seater retie isonym lepothrix fallaway pimelate lawyerism allusively remigial treebine Cerebratulus botch kinesics ribble enlink yoke
900,AJMPM,2020/02/10 19:12:11,88,utMzwKwJhFzuhzDU,caseharden instrumentally parapophysis thymotactic superinundation acryl majoration waybird Bohemianism uniformist unstaled cypressed ratableness Notkerian realizably telt acheilous worldmaking ophidiophobia microgeologist
658,ZUhJZ,2009/04/16 20:56:20,66,qBzSsDyaRtumjJh,vibracularium binnite areology lampoon Hepatica motherkin sphenotic cannulate semiprofessionalized Ceratophyta gelsemine band pleura disendower unsprinklered impletive homewardly procarpium postless defassa
963,kWM7E,2004/01/24 06:31:47,13,cWzPOYGudduk,exenterate scamble scorny undiscerning Yana dashing evangelicalism interposer wheedlesome semiacid suprarenalectomize formidableness avocet distance clapwort octavalent sow planariform bottekin gebbie
545,8vVjX,2020/05/27 19:37:06,50,VVLOSdmyOcTryLDLL,coxcomical chelonin sextans monobromination achira nontautomeric pedodontology unpremonished fimbrilla puzzlepate hemorrhodin gers topfull syntasis seminuria heartease Romish rivetless Procyoninae cataphysical
688,axbvr,2011/12/20 14:42:19,86,CBdKnLKTDwLLgO,kakarali perisarcal pomander unimpregnated silane rehumble oidiomycotic inestimably gastrolatrous systemization dividually Shunammite isatide trepan Gulanganes architective mormaor hemimellitene Lwo readaptive
986,w9WwU,2002/09/27 10:55:36,6,qeR,hankerer inflatingly igloo osmate glycosuric overlargeness Ekron alnoite colorectostomy autoplasmotherapy unsafeness badlands cuspidate perlingually Guinean trithing quadrifarious gestation silverizer sermonically
380,FXQRF,2000/09/25 17:45:24,27,xyCDHfuLcIaP,syphilize holt sassafras countersecurity Scolopendrella bobbinwork spontaneousness neonate stableward legislation readvertency anabaptize bestower nonmetric scriggle Egyptianize adipopexia teatman ambit Kikki
962,VJtjq,2020/02/17 23:01:14,92,GYMbmGUEywOmYVYz,proconsul coenenchym saccharorrhea labyrinthibranch fitched disguised adenoma pistareen nonrecuperation interdistrict anomalously froggy semivolatile orangey celliferous passifloraceous antimoralist mangrass mycelioid sanipractic
125,AO6Dp,2013/04/20 15:23:32,3,oK,landslide mausolea femorocaudal stue unionism antisepticism uniformly Pseudoscorpiones astrologic exhibitional archspy guitarfish unbenight commandingly machinoclast vaginoscopy accursedness azolitmin perichete aerobic
182,SlZBV,2018/04/27 12:59:10,42,pMRODCSfpQeH,antimachinery windwards omniscient thoughtkin extracapsular becap popeline dunny incultivation riotistic shakers archduchess irradiated proarctic llama auricula mentomeckelian ease Aglaia irresolvableness
326,oq1aM,2008/09/08 15:21:38,65,pKJpHLTbmCHKQXlcjnIT,lysidine unfarrowed bitripartite demographic virulence spearman oxyphenol riparial enfurrow Obrazil tigellate polypragmatical phytoserologic grime heresiology superingenious fireside Kermanji overhit driftland
273,bDNXc,2012/11/10 02:55:28,48,nidBKN,inferent fawning sparing casemaker velumen scalenohedron impoliticalness Waasi anabranch refugee unrhetorical untough baze halberd lymantriid unsuspectible retransfuse laking inductance unsinking
16,gzABe,2007/05/01 01:41:14,43,YMrJhIUydqg,quarrier Toufic monarchomachist underflooring Helioporidae patterning institutionality morel Microsthenes sprawlingly rotativism subpartition effortful uneuphoniously repealable brin clavier oversupply aminoaciduria prereption
994,T2qKE,2005/03/17 03:31:44,39,cHEgjY,referrible archimperial sodioaluminic affirm revealingness utch cutlass tracheloclavicular emball adenopathy aby Babbittism executrices forgottenness uninnocence Macedon hackthorn decussation catastaltic preclassified
180,3XHir,2022/03/15 11:01:12,64,MehFGbh,bankera divertisement Michel persymmetric slipshod annualist sinistromanual Taposa inductance deprecatoriness siskin daimonic attorneyship author illuminous friskiness sapropel Agalena esophagoptosis overhalf
38,VhEQF,2018/02/19 11:27:19,53,smmoVICPFxTpKtyuF,photopathic Drusedom scovel methylcholanthrene protanopic buttonholer kinkle ironice delomorphous flutina parvolin oculopalpebral owlery maltreator uncounterfeited reconfront monometallic trampage orthosubstituted springboard
780,q0TCJ,2020/04/03 05:04:45,97,SXTedJpnYR,conchitis caulicolous ventricous monodically oenanthylate unsisterliness saraf Rorippa foreshow megalesthete protopoditic submembranaceous Buccinum aquapuncture suffixment vitrite pomologist bathukolpian quinize unexplosive
966,J7WXG,2023/02/09 04:54:12,95,HlqDjKxzMYNTOhcyS,cephaloconic lostness refractive ringboned Favosites overnice previous Shinnecock Craspedota unfactored trow instruction radiosurgical bromlite Aphoruridae acetylbiuret hemelytral phanerozoic palaeoglyph puppyfish
334,rzX2F,2010/10/27 20:57:56,66,ytrLCiKLoyrSh,utriform unimacular lymphad Kalwar haptics siphonoglyphe buttony bobsleigh programmatist saccharotriose treponemiatic Trinovant peripatetically premythical unrepose hyperodontogeny prefactory phylum Stilbaceae crosstrack
751,FFNvc,2015/12/19 07:06:52,25,HnCOnunOOWPEz,listless onager pleurotomarioid anchoritess arthropodous hinderful cryptocarpous amyotrophia Cherokee therence serpentry conicalness superhighway parodist multiramified handflower nonsecrecy oversadly indart molybdenite
789,bRxop,2000/12/08 08:01:29,48,llfiizacGjToLKLU,neoplasia relationism escapeful dropwise ental vaguity unvirginlike undisbursed observational thermionics unfruity gastroscopy impishness ornithomancy promulger aspergilliform arthroendoscopy genesic Scansores gal
46,d8WfH,2023/04/10 04:05:30,39,NmwyG,ommatidium plungingly riven blennoemesis spiritualist unreliance zoophytic hypantrum ink navvy mismingle nonnavigable attached Spirobranchiata acrocephaly streel photogelatin liferentrix Calibanism misconstrue
965,lKsji,2013/02/25 21:22:12,58,YFP,marcantant underfalconer testamentation conjunctivitis stigmatist capucine monorchism camillus Tapuya laird testification unwalking pardonmonger atmiatrics tanjong pasquinader rubicelle unseason Platycarya overdoor
410,GK7MU,2022/12/19 07:18:36,46,bdrdvPKftyayRzokqsQ,venomize comical apophylactic leucocytopenia Hermit killick antimeningococcic roughener piling semirevolution diencephalic offprint phagocytable syncretical endothelium heteropycnosis daintith vituperious solidity anticipator
858,ukPil,2019/11/27 17:02:53,40,ImdiHXlHEDyD,decadally demibombard unfinancial Lantana channelwards antimachine kraut balanoid Rheum sketchbook underguardian succorful Aspidiotus speaking Zonitidae unspiritual dreamful atokal thereon cherried
600,vhGRn,2015/07/09 17:56:32,43,pVOiwAjGEvsEMNuAvG,animastical unpavilioned sarcostosis cookbook irrefragableness excandescent pteropodium significature erethistic regur lenitude suggillate niggardling arthrosteitis unreverence enthusiasm tannaic indicolite solicitous infieldsman
290,X8peb,2014/05/08 05:50:57,97,ATxDbQrRSIfIbWnkAw,planigraph Schoenocaulon overgreat featherpated Andevo uninterjected ungymnastic cricothyroidean acinose fluviolacustrine cancerate Alnitham exocline proselytization Caite centetid akerite meeting postumbilical preinstallation
89,4uXBj,2019/12/24 17:04:05,31,vMcTAGQGnCkrSFBnfj,pegbox Holectypina unagreement misdateful fearsomely argental erectable pitmirk eloignment heroism dialectologer ostracean cartelization unappropriated Coree dilamination intercurrence impaste Vacciniaceae demiplate
259,e8Ieg,2013/08/26 20:28:39,47,jmUbwjXtfACKGP,unchaste salopian sickening decentration ulemorrhagia Meleagridae becarpet eloquently counterorganization socketless vanadyl mundil lagonite semiprostrate Sceliphron ontogenist stonehead wirebar overobediently uncargoed
621,PJzKh,2009/09/14 22:11:06,84,AuGVQEVOUnrGsoI,inaccordantly Romic monkflower occasionary strig unelaborateness antienergistic weevil rethrow pharyngitis ammophilous snare calciovolborthite myocardiograph physical tortulous graptomancy blush sacculation presentor
641,cwICZ,2020/09/11 19:01:40,67,VqWYHiILB,waterphone omasitis unholiness perfectionism rebelieve Ustilago unplannedness Planorbidae photodromy whole Godwin scleromere hydrosilicon laubanite paranephritis Husky propless demiurgic adipometer chromolithic
809,2HIgs,2003/01/12 13:45:33,22,EbcFrSbh,divers platformless overattentively tripersonalism reversionally assertively iceman peucites afterblow panisc kompeni Odinism moonrise dominical stercolin undisgusted crimogenic monomolecular wordish scandalmonger
279,huk42,2005/06/24 13:35:11,36,ren,nosohemia pandrop merotomize metaleptically antatrophic hospitation Britannic eristic atonalistic taxpayer colonizability prestrain salma browbound prosopotocia degree duodrama fifteen Neoplatonic befraught
614,N9Kd6,2013/12/01 06:49:03,74,RdGd,unanxious Tagassu broadsheet hallecret enterochirurgia soaplees allopathetic meroxene symptomize cornered pentamethylenediamine superingenuity roughscuff belligerency Adenostoma slaglessness bessemer postallantoic Abrus unbustling
108,l03L1,2002/11/28 02:02:05,80,sGfufAnGK,discommodious bemuddlement tarsoptosis harrowment Spirodela prettyism endlichite terrorific alveolectomy syphilitic tetraedron pacificate unlyrical communitive interlineally isokeraunic manuscript juncagineous precisionize aphylly
720,0FNkD,2015/04/18 14:28:46,83,qfvKrxuUaOENAoFssSc,apparentness unwish Pshav browniness thionium nomographically pseudocele bungalow larvicidal login goldy Schizomycetes younghearted overlighted tabific hobbledehoyishness stonehearted deciceronize Nazariteship leadout
64,x0JnC,2010/10/02 04:47:18,71,wDZNPmswZN,hemicyclic nurhag saccharonic liquefacient soary stenosis deconcatenate enchantingly Lugnas majestically chalker wrought pontooning Wasoga extemporaneously Fijian scintillescent Zolaize unfrowning Ziphiinae
415,Sju36,2023/08/02 01:49:00,75,yJyyKUqiMzQVwDbBlYK,orectic scouting wolfachite pedregal auriscalpium postlude synangial micrometry gelogenic untaking descendentalism mutescence reacclimatization receipt knowability Russolatry hemoid roseolar tonsillectome ligne
362,yahQ9,2001/06/15 05:32:44,42,WWFn,boundedly sketching slummock gula ischury habenular fistlike katogle telecode Entelodon panchromatism interlacedly skinflintiness unpreened wrinkleproof vesiculiferous unsoled quinquedentated highboy patheticalness
430,zJF36,2001/03/27 09:50:15,29,PqMJffQYnDEjFXPnRVSa,condor semilune ported cholangioitis fox transhumanate ordines actuarially rhodymeniaceous tattooage shapometer malvasian sporter silicate Merychippus haymow obliteration Ranunculales inlagation blighty
29,Cmy7J,2016/05/20 18:57:26,7,qeVqLPYgk,macrotone unliken unfadable coeditorship chickenheartedness uninquired Bonapartean psychist meritmongering notewise simkin preaddress unbrave biblioklept kahar huggermugger orbit unformulistic noncertified gonocalyx
791,1986y,2002/05/18 23:27:27,63,EtmYQIqciSaaZYowjEY,belatedly reconsign psychobiologic congregator handpost broomwort williamsite antihistaminic Rhodobacterioideae unsymbolized gastrocele stereotomic detruncate succinite creamer propheticality noncurantist predentate grammar sompne
616,p3B9h,2022/10/03 13:41:28,6,nOfIgGowRaKBqWp,epepophysial amor tarepatch equivocatory unjoking longimanous Opisthothelae Ninevitish carbonuria stereoblastula mullar unparalleled Ismaelitic Ossetian alesan equiponderance overliver calcific threshel epituberculous
118,lB9jr,2014/09/11 11:57:06,35,d,souchet maddening gentlemanlikeness featous protestor cloyer handling rabulous lyard peristyle gio gemmate stomatoscope underworkman barrage obelion Natal superimproved nonreversion holosiphonate
551,vuYe0,2004/06/14 21:21:45,11,FkaVvlYa,orodiagnosis dorsoposteriad piragua Boulangism prehistorical somepart ravelproof protocol glasses unholily oversparingly demicuirass trailside isarioid shoebill hare Arean nonnaturality dislikelihood untentered
872,WJExf,2012/02/22 20:14:24,80,cpBrarR,satisfier goli luff noonlight honk acceptability Porphyrian elotillo draughtswomanship protractive diffinity elaidic broadsheet cryptorchidism sain largifical condylure humanitarianist latently cacostomia
53,Sxef8,2019/04/25 03:09:18,17,PAHDbtXO,drivescrew terracework Menura twicet contraflexure intercross readdition antivenefic nonelimination trypsin unabrupt antireticular nonvillager hummock satiable unexplainedness Ricardo dephlegmation Transteverine Menkar
139,aqWMF,2005/07/24 20:55:11,26,wGfCgUF,psychosynthesis profit conoid epyllion unclotted quadruped birma angiotelectasia Achaemenid craneman excitometabolic wetherhog faddiness hurdlewise anaerobe Ricinus overobsequiousness Peggy berewick dissocial
23,Dzknp,2021/08/05 07:12:08,43,dxzbAFIxq,reclean clinologic skein dermatopathophobia recordership holochroal unendurable estate unwired windbroach friendliness naphthalene antagonistically tastily irrepair flagrantly dramatize relinquish Rahanwin conspiratorially
433,fR0Qy,2004/07/01 23:46:48,39,yixFvwbGx,Ishmaelite desilver squirearchal parvenuism sinistruous swimmy neoanthropic leg afflictively hyperpulmonary laryngismus underofficer hailse subcyanide hypothetics pontil railroad supercharge misinference pedatilobed
502,QLxCu,2010/04/04 15:26:49,87,VaafkZwwhtilMXDiHBk,Thecla vacantly uneffaceably usara arrange shearwaters unsagging featherlet dawn epitomically morbillary collenchymatous superelegance ripsack Xenorhynchus microvolumetric anorthography tuxedo Nesslerize barracoon
580,bi9gD,2015/12/10 04:37:56,41,yVcppjHdLfpkyZ,chloroanemia endoparasitic wriggle kino repayable Laevigrada Claibornian Dicotylidae thyreohyal arboral fowlery termlessly adterminal Embrica ringable procatarctic bhakti typhlectasis zoophilism unretiring
657,PcZDe,2010/06/08 03:21:56,92,NCEE,virilescent papalistic forbearantly ferric vagariously unsupportedly udo grandfatherish spinning thioindigo sequaciousness ule Acutilinguae vantbrace nonjurying Actinobacillus bionomical skippery ponderosity Lawrence
797,cYahz,2008/01/11 14:28:04,40,TDlyCcvBuUrwjBzOOtV,misshapenness touristy nonconsistorial adital hist verticillated Anastasia Microtinae Santa sclerectasia nondelegate nonalienating mortiser Tracaulon capped amble laureole hypersusceptibility heritress overbook
517,f2zPa,2018/04/28 16:15:56,33,ayYizCZqvc,coprophagous justen untackled emphlysis legatine disallowance datableness upcoming koinon sahoukar electroanalysis metacoelia unexhibitableness deutencephalic preabstract athletocracy Menic vasospastic chlore bridehood
740,UvGQV,2019/06/24 12:14:11,20,kMAGeTXnvJZ,awatch exopoditic ocarina neurotropic coachmaster graphical powldoody assizer Chenopodiales lichi autoicous menstruum unexceedable palladosammine hesitatory ventiduct enterectomy Demophon kvint angry
267,p35T2,2008/07/07 10:17:30,62,dAfhEAsRABfESwIy,megrimish rebeg dermatoplast sedimetrical levitative Brachioganoidei gonochoristic volplane abortus shellshake ramule Isidoric Trentepohliaceae plait intentionalism Taranchi Turbo poesis monoverticillate captiously
569,9Tfxa,2004/01/27 18:23:08,62,LYkAPwAFduJNFLD,beguileful Obadiah Nemocera oratorize prolan recurrer seabound receptivity kartel syphilomatous Orphical gorbet chatteration Anabas ballant quieter bigoted pseudohistoric sheepishness kangarooer
243,zLalg,2017/12/02 01:09:35,1,XtFRnYmSybekjt,polypinnate unimpoisoned eleutheromorph nonesuch hakim untrekked Cisalpinism umptieth infraclavicular larmier ahankara slumgum Joan shap spald Dabih velvetry trichode prerebellion fidicinales
788,4S8LU,2021/08/01 13:03:11,59,LzidrBWVFaO,variancy centrist bluntie jitter endocrinological unrollable camara redwithe acephalia brakeman hydrogenation Spanioli numismatically Deino strangerwise coachwright nailery untruism mightnt dislegitimate
1000,NGDoX,2018/05/12 16:58:50,26,mnuZUjCp,holaspidean subpattern aureous hydro maroon shabunder muffet equidurable maffia pseudochemical masterwork toolholding bazaar parable supercommendation parous diachronic constellatory nonincreasing flexionless
233,8QHgf,2013/09/05 04:16:38,36,YlDWEZxQQkjrFTNdK,multimammate neuropsychological neural villanella disherit gingerbread amixia Myzodendraceae nonpecuniary demideity subcuticular corkiness pachynathous underthief intergential cholelithic septemviri cityfolk Goclenian succi
241,ukfwJ,2019/04/09 22:11:41,84,ebOhLkyUKECo,vetch pharyngography undisrobed ericius expostulatingly statued bedroll endoderm compulsatory dingledangle oxyneurine costumier melanoma sweepboard laryngotracheotomy acicularly hypnotoxin entomogenous extrazodiacal predisplay
549,i4irt,2014/09/21 18:48:20,4,nUrHo,uinal suburbed Clymenia subtleness unreachable Cyprinodontidae carbomethoxy swig okapi backdown thiasi paraffinize cleidocostal whose grumly sunset fay headlongly checker unpaying
354,GzPKm,2022/02/02 11:18:14,88,UKEfztiBkWUZiEnFUBjJ,unexacerbated atabeg Mandingo caulomic neurilemmitis ivorywood sophistry invalidism northlight hieromnemon Armageddonist Okapia trabacolo fastus carbohydraturia dismember Cinderella seigneurage collapsibility rhyme
122,LW5zV,2021/09/06 23:32:13,65,qcLQUCBttzfCFzyqVVx,amoebalike picrasmin prosupervision labium bending dexiotropism progressionist beweeper stichic plectopteran undercovering multiflash periodicity nataloin signman acinose prehalter sensitometer tanan patrological
438,vknVR,2005/06/01 08:14:01,25,reNEvUSdDDubdkGzRAd,hypho conceptualism glumpiness piaculum abhorrent aconite recrudency joisting unconducive iodometry rio tylotoxea creeping intubator quatral paromology carpidium unocular pantomimic unvariedly
744,92uvU,2002/03/11 13:23:23,71,yccIwEADFOhNDBTmUMm,Aulostomidae nondefinition siccimeter desmognathous cosovereignty buffoonesque specklessly tonitruant overdeliciously proarbitration satanize epitenon gonad ontologistic tricklike pubococcygeal semiautonomous almshouse Alosa hairspring
664,J27cn,2013/04/14 06:02:21,32,cpWJohqjHcnbUnFQOJy,latterly fluochloride cloot cerebriform Novanglian Lernaean unplumed Brahmin unomnipotent trifler listerellosis nash ischioneuralgia impollute reasoningly mousehound inship superelaborate untarnished santapee
754,IbV5R,2017/10/09 18:00:26,87,DqWnydDrOmeBDKKRcSci,peristeropode bluebird acoma hoppergrass barosmin tryout nippily madarotic indiscrimination slaughterously Normanization trimargarin mauler unwan alternation unemulous botryoidal confider gonfalonierate newfanglement
776,Ehqgz,2019/06/12 06:36:50,99,XpBLuyXUMH,pillage atmosphere nincompoopish scorbute gravitate salify trapezing acrosarcum unsmutty hemapophysis colloidal unbrutelike ascariasis graspless Metroxylon waspily prestrengthen oxycalcium zirconian upbid
266,piEsy,2002/10/11 04:14:03,57,a,coincorporate Brunoniaceae curability sorva washday Dactylopterus bibble reprivilege bass Gretel Purkinje quintessentiality ministerium unrelishing maremma Bomarea shrewd genipa cookhouse sig
292,SaNbo,2014/09/11 12:11:08,88,VtqCKXOfaLz,culverwort noncollapsible unravelling insidiously bullyrag churchish counterdrain clergyable Senlac quirkish unitedly antilithic tordrillite appetence mazic skeletomuscular clinkum shelfmate comatosely reimagination
289,KykbX,2010/09/07 13:06:04,13,tKfMcIQHW,sourcrout prabble clownage taxinomic gunsmithing multicylinder naupliiform protrade provinciality registration bladder tridrachm ergotize vindicatory hemoglobin latentness invalid correctible rumblingly substantialist
891,uFweA,2012/04/17 18:16:50,99,bDQyxHRtjiBaAlJs,chiseler nonassignment upaisle hallucinator Draconid sandbank Chrysomonadales unliken unbudgeableness frondlet discoid yagi churlhood forcibility konstantin unassembled dillier onychosis numericalness pedometric
260,plrL5,2011/11/08 10:23:15,84,vVFnk,theophanism chondrofetal misappropriation acnodal lieproof enrobement assign harpooner levogyre katharometer prepublication physiotherapeutic bounder unmastered brasiletto noncrucial smirker quartiparous huddlement culverkey
386,YZv5Q,2019/09/05 07:50:51,68,z,antesunrise sulphochromic cavort antimerger ambier antirabies seminasal Eteocretes echinodermatous unconfutable uncontinental waviness wellsite plummeted waste orseille ungashed haemosporid tormentful unintrenched
515,ZClub,2016/04/06 19:57:08,19,SJydzbWJthEwBqc,philosophling Navaho lambskin Echinodermata gittith airampo plugging Corineus uniserial unlevel metaperiodic bloodspilling radiophotograph zetetic overconsumption bediaper degger cosmist overlying undaring
846,7R508,2012/03/21 13:53:54,34,LyBkNfDztvLIKeHtEdd,Homalocenchrus prillion bacchic rigidist soiling addresser bedrench presidente blanchingly hydrotherapeutics craspedal semiobscurity Samanid tamein jellydom madrasah plagiotropically haptic Tass besiclometer
977,2G63l,2023/01/10 12:50:50,43,JLOAR,bombinate unnephritic disencumber damagingly Iliadize celioenterotomy chloroformize alquifou japish inelegance Hy outgarth Panjabi brickwise Aristarchian plasson formylal tortility gentilic houghite
101,HqAPW,2022/07/11 11:03:02,85,JYn,oligohemia prisonous preharmony hardishrew unfeignable unfeather free blockmaking verbenaceous photogalvanographic unseafaring relead erythrocytorrhexis outwriggle marcel cowperitis muttonhead lealty cetologist cardiectasis
830,edbLg,2013/05/06 00:06:58,98,o,entertainer Sphaeropsidaceae portway untrickable windowlight alismad devotional bellyful Ecca Cenomanian behint flaunting futuristic creatural siphonate Litorina nudish Ito doorstop uranometrical
349,9ax1l,2021/09/10 03:29:37,30,RpXxMNwZsrYQjIMp,antimycotic quartzitic disulfonic foggily mae assort unleavened pseudosessile Neanderthaloid physicobiological Saxonical substantious homotransplant proscolecine unresented Tubatulabal sectarianism tikitiki concatenator cotranspire
20,NUjop,2011/07/05 19:07:53,86,mUBJGhPOL,alloxantin Unungun capped sanctorium paraphrastical angled warree stringently parolfactory dodecahedral nonpredatory histochemical paronymize uller whelk popjoy chantress fluviolacustrine coachsmithing actinology
803,QFubn,2001/12/07 08:01:56,62,aDxjVDWWsYXXtqzik,Pogo pharmaceutic Rhynchota Naemorhedinae upas snobbishness rhizotomi edification torrentially peacocky digitinervate subramose stang repellingly topognosis chirologically dialogism cinch bishopric growthful
898,jrpYA,2004/04/27 10:44:40,33,eX,bodewash wealthless scalawaggery parietofrontal elephantlike whitefish lepidoporphyrin Hellenistically syphilous undercool antelope reobserve Bothrodendron numismatologist didynamy domesticity ofttimes preconcentration waver gaufer
741,wc8i3,2000/05/09 17:51:17,73,opyKQNaFEA,koleroga acquisitor Spartanly Fulah berrypicking tentativeness tindal electrobiological nondisintegration coble wildfowl cloddishly tetrabromid underprice reminiscently horrormonger customary Sika mentalize tetryl
677,n0zUb,2023/12/21 20:30:34,9,qufGdAQsRVRcdYQBYtaK,wulliwa undisordered widbin cockaded shelving servingman nimshi Pythia thenceforward Gallophobia Heuchera alula mythopoet shirtlike underpresence stridling polypteroid Gigartina crunchweed ethmofrontal
246,trWF3,2010/09/23 11:28:28,40,YSxVFxrUc,rhagades bough sigmoidoscopy palaeichthyic incarnational inkshed sylvestrene ironstone panentheism sardonicism clearable whinnel tintinnabulism Nabathaean illucidation Chitrali inappeasable unwhipped engore recompose
618,E3E35,2020/11/20 06:36:50,38,HkeMVgFaHcpn,method Autoharp unburdenment thiocarbonic nonsiliceous Phlebotomus auxiliatory jalouse arthrosia Theocritean induplicative instantaneously bojo Antipasch implacableness vulnerate impropriate clypeate relevation calool
106,2MRo5,2019/11/02 19:44:33,29,cxqkkRQSBewUtr,borine splunge Pakistani gallivorous dairy twinemaking officialdom pedetentous Bartramia sprose Ascidioidea tripos ductor dishouse Neoplatonist homogamous mouthpiece subpeduncular underglow balsam
767,z8IgQ,2001/04/16 02:02:58,90,epVdDXBjbPibiWQwaE,anastigmatic propaedeutic adscriptive unintermittent schoolbutter smilemaking Sahidic unprinted langued photoalgraphy producted Gorgon panmeristic bookism cowshed angel ultimacy incomeless practicability fulcrumage
489,M7Ajh,2011/08/10 14:44:44,89,HxYigygz,sensibilisin davy Norseman panthelism irenically goblet uncuth unqualification agush commot Dorcatherium cabdriver fictitiously rockfoil fanmaker tamer ganglioblast scrofulide r consanguine
164,EhI5v,2010/02/27 07:09:26,46,QyLTsqCcccYdgvwuqF,bedesman bombardon flite nonrejection thalamocrural Talmudize reorient bimucronate jeerproof spoonism repulsive ungulous nasoantral avid footlicker Ettarre twoling unperiphrased electrochronometer phleboidal
735,L0o51,2019/03/03 04:55:32,20,o,poroscope polyphylety prereverse saltee strideways goggly theatroscope Aracana Dolichopsyllidae hoplomachy sulcatocostate eident staurolite dogma roaring amarin jaudie uncreatable touchstone sophism
