id,owner_id,creation_date,count,name,content
247,Xylpi,2012/12/07 17:55:59,87,mtZMNsm,guilefulness unguiculated airedale enthrall extrastapedial warlikely ceorl antiblennorrhagic theelin ravel exosperm sulphanilic Attalid Malesherbiaceae poriform gremial smilaceous lawish osteopedion northward
979,xST5s,2019/05/01 21:45:56,87,tQxGNYEDoW,miserliness appleblossom monopersonal leatherflower solarometer uncongealed dissemblance antimere complement lituoloid beshade contributor katalyze lutein homologist oldness extinguishant presolicitation Anacreontic englut
331,tBfmD,2012/04/28 11:08:29,21,lzrQKkHgxPyCU,Chasidim overheighten goalage horngeld metreless thanatometer calycanthine tileyard subcorporation explorational succinate tietick trianglewise unfemininity tetraskelion Melungeon unprecluded protrusive butty lizard
463,vTPsk,2003/01/02 15:59:44,56,vw,ruewort independently lansknecht sprad heptastylar boulterer peek Antaios afforestment Badawi unproved sluggishly overgross entrancement motherer antalkaline nonimprovement unenchanted unsurplice sulfuric
587,9q7uA,2016/07/18 11:37:50,56,CZtEOzk,intraparenchymatous hypalgesia sick clique bejazz Waicuri calyptra unrebuttableness Fin postdiphtheric teacupful restow celluloid connection hazzan burbank clamant phorometry subnormality stiped
546,AiukS,2005/12/14 06:28:10,8,qxoxzLvKRPSgnNfVD,trichinotic orsellic cynicalness Diphyes societist purchase superobedient imposter earthslide lacquerer humic spirithood electrotechnics coxal invidiousness subcandid bloodcurdler nasosubnasal exmeridian circumferentially
605,nQnDf,2009/09/21 19:22:20,58,ASIJMQXmdCgnJ,quinquepedal correlativism perceptional Thomisidae Madrasi monolinguist glottis offgoing lapsable trinkums oneself hairbeard palatize rekindler pleuropodium heliochromy turpentineweed manifestedness anthropophagi absurd
518,z3VlF,2005/02/05 04:01:06,58,YHTvfDriKrlUiUOc,scarping lama unmetrical garbage Hypostomata mountingly orthoclasite capitelliform cavalero presentatively unaccompanying bicorporate engysseismology landing reiteration Nautiloidea organless hemerythrin overmaturity quillwork
96,ONhod,2009/01/23 05:01:23,86,XflBOuPAynlK,phloeoterma uromelus epicnemial isobutyric oxalonitril buccan angiostomy veliform nappy ectophytic naphthylaminesulphonic pregnability rubblework edaphon disinhume accipitral differentness mastigure granulater angina
197,6puVT,2023/08/01 14:49:42,87,Gi,propelment wumble tinnock waveproof Coendidae casekeeper unobtruding technology lobbyman Photostat irremeable desolation spruntly bakie Mougeotiaceae blanketed preternaturally chiviatite Nakula technonomy
849,0uWUz,2000/02/11 17:25:18,49,htWMjiQwyG,italite Tantalic towan huer apocalyptical perturbability roading indebtment vaporographic overprolific snuffly mirthlessly net halt unexhumed bumpy periclinal soberer thorned shantytown
447,YwEaL,2019/02/06 12:47:04,40,GmOMYbfEKmasZ,caxiri countercheck Goniodoris impi isohaline curr ceder subarcuated inyoite featural tropologically mixtion guillemot tuberculatogibbous indigenously cotenancy goddess attestative forthcomer deconcentrator
141,UxGZ3,2001/08/08 23:23:44,16,FzMtddoUHAHVIO,nondisposal Platyhelminthes taenial gemmification erectopatent radialization nuggety crunodal dor pincushiony fatidic palmlike atroscine ablepharon gamy airable allowableness omnisciently tactinvariant Maeandrina
208,uHki5,2014/12/17 10:35:34,68,xIzzqinuZz,Lombard oreotragine unendowed sharpen Angers glycerose autotypography foretime karyogamy Russ uitspan perichaetial redoubling lain semiparalysis harvest celtium microcephalia handset Sevastopol
667,TWzfG,2001/10/01 16:32:34,78,HLRWsoDpmagM,Gallic important spangler antivariolous fascistize manzil miscellaneous atomic whils nonspinning unclassed indecorousness gliomatous cliquish pediculosis sixfoil counterpaled epirrhematic besieging bilsh
306,g7oXB,2007/12/05 02:54:26,68,TOTkAAMGOlRy,rhinoscope extrinsicalness unwarped bailliage bolti explorational Pilularia modulator manscape mixture pleurocele opportunistic sheriat unhumoured phyllospondylous eyeshot hotel pomatorhine asyngamic nostocaceous
303,dyQ3h,2003/11/21 04:13:36,99,bqZmWcKfBQzJHvWN,asylum unironed desinent heapstead anomalistic seven gyrose metaldehyde pyopneumocyst hansa berseem sacrilegiously cerulignone Sanetch circinal jaquima strangerhood kismet unipeltate unpetitioned
727,5Je6K,2014/08/26 16:38:38,52,hfDANrhOTqULicXzwb,heterologous logogrammatic halisteresis identify outgreen puggree overgeneral Sulfasuxidine gossiping tailoring dodding hypokinetic Rymandra Baham pansclerotic trochalopodous spoorer vicine radicle incorruptible
704,twQ1e,2004/06/03 04:44:53,38,CWNtihIHocPvXNbGRb,Kevyn atelets dicrotism moonery formicary Spanish snatch afterbeat Hermione proverb hovel mechanicalization unsophisticatedness preinsulation fanman obliviousness theat hemoglobinometer acracy brucite
202,H58KT,2023/01/27 18:40:39,46,LB,hypothesist Lemurian hexagram parthenogenesis ruddily ringtime duplexity anacardic withamite Exobasidium alphabetizer ownhood Duplicidentata fishlike glutinosity rotundotetragonal accouterment Hartmannia tikker forerehearsed
615,gFvU6,2009/05/17 18:16:42,80,U,dive sistrum townland prebeleve Turnerian nonchalant Boussingaultia piarhemia anapnoic homage plugboard woodbined flaught unprofitable lovemate unrepined distemonous indirection harmattan codeclination
285,iVID8,2020/06/03 01:56:14,93,GOyFd,Tosk moellon Rhizina cousinship dressy thioxene knublet Ommiades hystricine morenosite oscillographic curialist iridocyclitis semicentury vouchment humeral pyroclastic quadrigeminal bilbo Levisticum
82,RnOaP,2015/04/01 14:53:27,92,apVQJWPAcSG,toasty fistify insessor undisrupted spotted submissively Galacaceae denshire fruit superexert vorticel pseudobrookite outbowl hinder prohibitory malapropoism unfold pentasepalous cowbell cogently
869,CSWMZ,2020/07/20 07:35:59,38,zzwtIpeqIRQtHoy,unenterable lagwort astrosphere langsyne pessoner overall biconvex sinusal nulliparous prophylaxy rhymewise rodman Savara leapable percomorphous tresslet Antaeus unreachably freethinker forbear
193,7HGij,2021/12/12 06:54:58,8,bxYhSRxIOEKgE,pontederiaceous frangibility orthron essentialize sarking graspingly alveoloclasia semicurl oilproofing wag yearlong pneumonoconiosis Bogomil tooter evenhandedness humeroscapular scapuloaxillary wroke tymbalon isoemodin
896,Ln2gb,2005/10/08 19:03:16,82,gEuu,silicify intrinsical Syrphidae asbestoid afterswarming Drosophila Pelodytes analgesis nunship uncircularized wailful finickingness sty honeymouthed overcaptiousness rachitogenic unputrefied tubercula Thymallus berrugate
376,OrqT0,2021/07/26 13:27:05,78,eybvDrjMcucrXJyYl,ironheartedness idolatrous marasmus haploperistomous excitory pollinate sodoku shipman anticous enlargement photodissociation Canamary strongyloid biliteralism microlevel gyric implementiferous wheatworm arenaceous acosmistic
545,SqwJA,2022/06/12 00:38:38,16,GPok,alcoholytic unattainment septated Luperci Gomontia pericardiolysis unbind barristress bolivia temporoalar memoried decretum ungloomed frameless typically Manabozho ordeal hemospasia bareca merogonic
41,VTS26,2011/09/18 06:41:13,33,DJNIQpIUiHVh,hocket allograph meagre ununified sexdigitated fluency apiarist prodproof oversharpness besweeten iterate phthoric totalitarianism peery Jacobitely opener perseite miscible jacutinga polyprothetic
227,xb8Pa,2019/06/26 10:43:27,25,KBimcrFwJ,gynandrarchy physiopsychology anomalously consubstantialist arcocentrum ultrabrilliant landgravine oxyrhynchus osteophone ephphatha senatorially katakinetic debris rabbinite barbarize insurance extirpatory thrioboly emplace granza
120,y7ee1,2012/06/09 07:05:34,12,TyUAPjelgygB,germifuge cerotene archfiend ganglioform bheesty wolfsbane spear verbless Acolapissa accolent metaorganism maxixe circumscribable Scotistical balled vesuvian unservicelike Cibola carbazole factionalism
137,eYFSF,2011/12/24 21:29:13,80,Afwuk,Kickapoo pudu hooven brimborium orderless postscapula decast Eremopteris kali affixation undisdaining laurelship humblemouthed mistrain isotonic isochasmic newslessness interventionist clairvoyance pedophilic
108,Sve99,2023/04/12 20:20:14,37,WftJvrfw,inflammable syzygium unthwarted hontous Whistonian flummer theologicohistorical naological perigenesis digenetic Drusedom helminthologic consol suasiveness placement pseudocortex threnodist potomato crepon semisixth
233,b9I4P,2008/01/14 14:25:37,20,VDcXekVOJc,heterostyled gledy hamleteer bablah deckle anticipatable redifferentiation popweed brieflessness impaction loxolophodont quantification lete nonearning indifferentism dumminess whirlblast nonstarting crateral robberproof
395,xOxtK,2014/05/23 13:36:58,9,JFvtDFlCBBxrmP,homologue instrumentalist unmandated bivascular pestilentially oariotomy smoothingly outchamber antehall deflorescence Dravidic vaccinatory maidkin Ateba phenomenalistic salamandroid scupful condensate prosiness autolysis
86,haTfG,2023/08/12 08:12:07,79,XVt,sporostegium Babuma amoeboid Lingulella blimp myopic decasualize tastingly inobnoxious Mev upwheel proudhearted uncirculated epicarid isohydrosorbic inflammableness tarsome defeature unci Phalangidea
921,BFYeD,2019/12/12 08:42:39,22,SBVSHxJA,hijack prederivation spearcast enlivenment mentocondylial holochoanoidal spousal xiphydriid mottlement mesencephalic Nipissing paraphrenic coevally ad bananivorous anodontia Patmian saxpence selsyn posttoxic
613,QocDL,2022/06/20 05:18:29,84,EMMBUFtQlCjsKVVwgW,liberticide arillode postdiastolic ungreen coquito daglock sideromagnetic isoamide Aix bungey coelospermous Apollonistic Popoloco staphylinideous gibelite tendent squirish unimplicate Phanar sightening
77,fY7ks,2020/07/26 01:23:01,24,lgFWslVeetcYS,automatically mucocellulose oblately angelin nephrostomial lectorship criniferous hora zing Tripitaka inquietude aquatint bromaurate wreat tralatitious leftwardly overkeep corked eleoptene coexecutor
521,iWr2K,2023/10/07 23:43:50,8,Pd,rideress oaten disquisition shisham grammatics indaconitine Theopaschitism cheating akalimba pathomania secernment rachioplegia adverseness unfeelingness humboldtine paradidymis crookesite charier Myxococcus mandant
343,YdLLq,2003/02/07 01:14:01,24,aLPgWCqZjZhkkcK,characterism suprascapula Malurinae wavily mundify clericalism Taal supersecular nickelodeon brewer Canaan turbanwise pentacrinite lethally lopstick cacotrophic hange planetist vitaminic gregarious
943,ZCMW7,2010/10/26 13:45:49,99,kCcBYNgcQgOZUBhKRomS,costellate craniometry fineable blunnen pregnancy Ranidae crenula systemist cordies ostensive taslet artlessness apophorometer ebriety undersally earthfast roentgenometer azoeosin balden taccada
796,akABv,2020/03/01 01:02:49,5,yiIWoGnktenWTMlunw,protopoetic malladrite tirelessly Bettina Lecythidaceae Pomaceae nephograph reetam proboulevard coracomandibular circumrenal sanativeness dyce nonrustable isocoumarin pyocele cry this safekeeping fastingly
498,ud4Na,2015/09/06 09:40:29,60,RtomaFrxAKyBrmOeWBk,parorchis issuance polymastism Frenchify tricerium discomfortable nonsporeformer microspherulitic pepsinate quadratus subendymal trivial salpingitis Frontirostria omentitis geomalic Daedalic genipap Cunza strategist
746,ZQPge,2018/09/07 17:48:40,17,QnlcsVpFikGrQ,nonrecommendation membranin tropist harmonizer crust Burgundian hematobium fibromatoid smithite nontidal accorporate undoctrined bipolarity stearate xanthometer normalizer calaverite satyrism sluddery penknife
668,AjNoh,2003/10/17 15:34:39,50,bES,unhidated flabbergast tinctorially taha nonprotein votive coloclysis rescinder meaninglessness allelotropic overcaptious brainache wellaway phenetole argentum reinsist rasure raylessness copei remantle
902,tub02,2014/04/27 14:58:50,53,hnzgwQdphUTGYmJLlBN,ammoniuria undercellar scrouger cadency vexatiously merosystematic oppressor stockrider taigle deputative sufflate tallyman punter ebracteate uptwist pangamously boutade summons Thasian hire
731,jhZvy,2016/11/05 13:35:16,65,gqfayJRq,buckleless representational antislaveryism delectus quintessentially fasciately planosome toeless unexasperated symploce wangateur claithes Pentandria badian Syngenesia hexanitrate breekums Sulpician banner wagonry
889,xmqCx,2002/11/19 21:17:50,90,JHSWgFr,antisubstance Negroize Benson Meccan unvariedly instrumentative previsibly inasmuch visile apicitis silane undoting insnarement Reynard terricoline paraglobulin peridot unjapanned Alonsoa invertebral
435,srnlF,2005/08/10 15:49:53,97,IMmAEgywGdwQ,gentleman indefeasibleness stamp dreamfulness homochrome Tupperish Aspidoganoidei retrench bub Christiad semicroma ultimity unaddicted unerrancy nebbuck finnip interweaver stenograph nonentitize valanche
711,7Iwcy,2005/05/12 15:07:50,20,edlMHdzqEhYEjcZ,testiculated claybrained upblacken windfish greenhead Washo upset shadowy manganotantalite tangram mixtiform kudu eer affreighter sterilization stridhan versionist chondrigenous applot stovepipe
765,fxkgA,2003/01/15 10:27:23,26,tj,anterolaterally polyhedric theopolitics Lophiomyinae unexcogitable semeiotics jambo strategetics buskined subitaneous refundment humorless plushed ramal Servetianism Chlamydozoa orient unfeasted oophoralgia undercovert
607,2IJEj,2007/05/23 16:57:12,68,VgTJHk,sloetree totum aselgeia catstick farmy impostrous manto unsucculent tastelessness choletherapy poetaster quiritarian subpartitioned patrolman scribable eardrop pollinctor subitaneous thimbled workship
347,rtEWm,2009/04/15 13:13:53,37,Ok,aeoline nonpursuit neoterically antanaclasis grandame lawned growthless rodding areng Pomo Judaica employ rant grovy pannam Kronion Phororhacidae kollast Babylonism medal
842,laX6h,2021/01/11 05:17:31,89,XlLmsCif,Asterozoa pennatulaceous metaleptical Seder decliner Conopophagidae undertreat swivet discursativeness microclimatology polysymmetry unfrequentness unably eastwardly pestify unorthodoxly tuart phthisiotherapy tabularly unescapable
243,2Y0eu,2009/07/08 05:10:30,23,qRVARORzld,plumach alcoholicity added pineland Sesbania Bahuma plumier premillennian Thuban idolatry nap male psychogram evocation phenospermic hutholder Piscis pulu Scorpionis bullwort
975,ziyVY,2016/01/28 13:27:43,93,xqoXargeIv,paramine incubative trousered homotonous nonendemic gasiform clearinghouse hamper landloper totyman unearned womenfolks mool protostele horseweed peculiar postform affenspalte tib eyen
818,TeXvw,2019/04/12 01:04:21,45,et,pipless opiniastrety achy splachnaceous gingerberry overboldness undistinct workable frontispiece tritheistical indoloid repandousness Felis semideity semimoron plagal apostle cocircular neomorphism blanching
238,AGZTC,2013/01/15 12:42:06,52,UPvQGmp,Leptodoridae dorsomedian jiltee strophomenid mycteric canted spousal percarbonate relatival awalim prescription donatary stepaunt wherry serrulate outpreen melanocrate testificator nonattention associativeness
756,EKfLZ,2003/09/02 00:18:11,2,Z,Mulcibirian unrancid Collomia Juggernaut unsoundableness witship costmary unpunctually granolite Kanawha Kneippism jane bumwood strainedly matamoro sprier disnaturalization unbelief braggardism Tamulic
574,UkvPo,2014/08/13 13:09:48,54,CVquOcvXmmZp,unkemptness teachership brucina Kafiri smirkingly interquarter mispick hemitone sociably minatorially unnaked Mercury anticathexis Colosseum provedly theotechnist beden overpatriotic trothless spikelike
986,tfPd5,2013/02/09 04:38:11,78,HsEfUEetulrzq,eligibly Dichondraceae thin agamospore fenestra milk ideality unconvened tremblement Philippine refine fishhook pouce Clayoquot indestructible steatosis literarian hemitremor Holocephala Madonnahood
753,CxanX,2019/07/04 20:56:48,11,XWoescSm,multifoliate aerophilous nematologist toolplate cerithioid dioestrus flame tonguelike paternalist clinging sporoduct exasperation epidemically Libby sometime affectible synodalian unpiled reflectibility unamalgamable
430,DHDyG,2009/04/23 21:19:09,2,ZnmYsgfTdChsrVZpayAY,inclip polyparian superaccommodating farraginous plenism anlaut Leucothoe osculatrix depressible idiorrhythmic porter teaching condensational cottonwood orbitonasal paddywatch growthy pronaval ministrable improvident
561,bR2s6,2018/10/21 16:22:02,87,eoUtCCdhMnvQD,cypsela scug propyl microphot systematical arrowstone conceivableness saccharilla Anaspidacea tarpan Drukpa spoonways autoregenerator backbiter melampyritol protoprotestant diuturnal eosinophilous reannouncement untunable
517,wzFQ2,2004/04/17 19:38:36,66,OVHiWaga,noonstead fishpool mubarat Eryops anticonvulsive septangled goutiness cyanoauric sloebush mycetomatous alodially cacoglossia pontificial Postverta banak perradius rhamninose phyllobranchia unsealer thanatoid
705,fylyT,2012/01/14 13:10:56,17,IvRDOkPZatrKGmeb,connector loir activable constitutionality pluricipital poroscopy monopodic Johnsonism inexertion antonomastically enhamper imposturous kalewife aphyllous unapprehensiveness adenoidal smutchin ventrally perigastrula underquote
405,HI7X5,2013/02/24 06:16:22,25,nEmrWp,dodding acrostically surprise Phascogale suclat beveto trapped transientness indue racy foulish plumbate netherwards lumpishness ampulla scalesmith cylindroconoidal ooplasm unlimited proletariatism
148,qVP6O,2022/06/11 04:11:17,56,QOPANTXO,cheeker Motacilla pseudoperidium dicrotous guildry onza contender mimography capparidaceous decarbonator pictorial tracheolaryngotomy dioctahedral mib Meleagridae mull accolated rejoicingly caesaropapacy sinapic
452,4p18z,2003/12/08 11:07:50,2,nJYegHo,negligently headstick overplausible quindecad cognizer tripoline saphie Platyrhina Gill reunition fraud percher racket separatum operatrix shirk origanized typesetting glance uncrediting
997,pC5pF,2004/09/05 12:11:38,80,hiwOiBWTcB,allagite wondercraft eightsome tintinnabulate reeky unphrenological underbraced desulphurate anthracoid byssinosis retransformation positively cuneiform eyeletter Yarborough antilethargic contraponend cerealose plectridium nonuncial
289,ZtYEf,2011/02/26 19:55:22,65,zRlYShpj,dactylography jagless nonarbitrable quindecad vibroscope oligodipsia presagingly vaticide spadonic Palaeotherium hip erythroxylaceous overproficient titleproof tendomucoid atheling symptomatically rebuff Reichslander doocot
312,TVpKR,2009/11/06 21:39:44,41,HF,monochromatic vociferator outgush floatless ornithoscelidan aminize liquable blackcoat undisguisedness unfabricated swirl sottishly Edmund extratensive androphagous nonrotating involucral dartingness trophology futuric
985,KIvI0,2021/05/14 04:50:50,6,NtTOtICntNhRf,squawberry checked overimaginativeness sterve unyieldingness negotiation dissert unicuspid longirostral polyacanthus vorticiform condylion attunement unundertaken cryptoagnostic phalangiid scride foregate pity hydrosulphide
237,tVNBW,2000/12/09 16:50:38,57,kKbWhE,farrier deviationist sicklily ptyalogenic postform perfectness calliphorid mycodermatoid gingham Ratitae nameability reconnection topographics schepel uniglobular adoptionist hypersonic drawhorse naric malaceous
54,auxjm,2010/01/23 12:57:01,29,NbCkJTTTtKrdWA,overcutter grottolike moonwalker anisognathism cephalagra oligandrous imponderabilia Altamira communionist pyxie Cryptocarya expose noniodized pedantess drawspan overirrigation sauriasis naughtiness tights glow
672,lxvCy,2022/02/24 17:52:00,34,LwGxkUaI,laborous thrutch melomane ichor trivialism concubinal ethnicism unpicturesqueness assimilable ectosteally topalgia nit dagaba reprobationer protopectin symmedian dysteleologist predesign virescence Gradgrindism
844,49l87,2009/10/08 11:39:09,34,EePahOSwiYBEp,interset elephantic Metoac unscolded unsinged autohemolytic unfictitious dipterist discerpibleness nebby plateau neutrally uteroventral prorector overjade strictness taise conventicle dyscrasite alula
24,cgH8p,2015/10/06 12:48:37,40,mpH,anarthrosis amuletic marmorean morphon coinfeftment quarterpace baccated fidejussory enterointestinal unparfit unsoggy ward abolla irrisory centrifugence osseocartilaginous thermodynamicist perwitsky allochetite resplit
107,LH6rS,2022/05/05 22:30:42,28,LjiLmZwNUv,stowing undissolvable alexipharmacum nematocystic argentiferous ganglioneural immortability cearin gingernut Hanoverianize predisplace pleader Panhellenic ypsiliform savation spiracle amicron paraphysate phytophysiological wombstone
722,RBlaF,2008/04/11 03:45:56,66,QQ,everybody exceptionally sonoric movelessness mosque binh mate summer alfonso Achillea oversystematically portside ungenerous plesiobiotic succinctory Warden bilithon Fucaceae Stilophora ringmaster
992,RMY1W,2015/08/26 23:02:37,99,oTFTeSDXc,ruelike Rudmasday mogographia Helot anadromous emeraude Palaihnihan viscin voodooistic Blarina Oedemeridae morcellate bolis rhamnite reappreciation lekane econometrician unidentified noncoincidence massiness
741,wiOZH,2018/09/20 01:55:30,22,jCiUDXYilpVv,belemnite anthropophagistic temporaneousness toran learner nonattainment wordster iso Senusian alpenglow debut basophilous playground polychroism lactifuge autopneumatic formulae selenitiferous nonengagement ultrachurchism
71,28PTX,2019/03/07 01:35:20,59,YqPawMQdfsQIyq,chondric hermaphroditism amphidetic variant distomian superdeclamatory Ligusticum Seseli clarifier pleuracanthoid pond unfeeing decadently consequently unhardily craniological sociolatry chouka percentably squamelliferous
464,VkkhR,2001/01/14 07:02:36,5,uPrWqcumYCKbxNezaPp,ankylosis suborbital unluminous earshot twain ectopatagium checkage Hindi injectable Cerianthus overspecialize Chlorophora creosoter nacarat universalness multiphaser tall comicoprosaic borasca electroengrave
275,iRVon,2018/03/13 19:51:21,21,OXEEcrXzVZXWORP,Sergio bichromate Arachnomorphae tamarind aminopropionic polyglot warse Luddism postexistence notabilia Mandaean adiaphoron cryptocrystallization tetradecapod encirclement tracer nonmedullated cerulescent babish unpunctuality
373,PEVqI,2006/05/12 15:34:15,67,aVlyEC,underpeep pyelonephritis baya pleomastic absolutize incompassionate electrodeless sacalait disensure postmasterlike thriller donee kingdomful Triconodonta distributively overknee supersuperabundance Chrobat ommateum phonogramically
274,SKomV,2022/03/24 17:25:16,100,cZ,vendace frigidly initialize registrary pentanedione cinque batter spuriously Forficula laconicum adrenergic paintership florid chyliform impecuniosity retrovaccination venalization prereconciliation excorticate teleotemporal
990,YjSor,2008/03/05 11:21:00,61,eOKmhQmsRAzORnwkmD,andirine galvayning bituberculate relativist chivalrous knockabout undrafted objurgator arrange intubationist uphelm Trudy tilyer nabk paramastigate pterylography auchlet benzol upwind sanctimonial
294,LGNtv,2015/01/01 07:12:18,18,vDndimwPArSkGcKlQT,unspinsterlikeness doctrinaire axes foot widowered declamation prosorus rabbiship adamantean unjarring tuberculotrophic lagomorph nonsystematic Sufi Pholadinea sweeting corbiculum autodiffusion hydraulicon fractionalism
989,HCHon,2016/02/24 21:45:04,26,EfMahuWfDEiPYtyxdKt,brainwash ingenuous Moslemic acardiac brecken thrawcrook defectoscope dobra opiumism fulsomely Janos quatrin gainsome Lemonias Galeorhinidae fantasticality Hydrochelidon overscour semaphorical sartorially
913,gSk82,2013/07/14 01:56:28,90,PZOIxJhIbnLzN,albarco ovoviviparous unstyled nach betrough unwilled pigtail atophan crotaline referendal hydroquinol overhill hetaeria ampelideous yite preinquisition Yeniseian tmesis copaivic misdread
277,3Ibqv,2008/05/23 02:32:40,92,eCdFWOpcTis,antifreeze untilled Calorite anormality pseudogyne pelf fictitiousness hyperconfident paleohistology ultraselect subcortically passulate epidermatic synch peroneal spirobranchiate overlength Ornithomimidae posthysterical devotement
983,4NUZo,2021/09/15 14:25:47,53,YJUOzSpiNQP,solum hypomyotonia kissable lubric transportingly filmiform ghazi sagenite diglottic humiliant pugil ogdoad micraner bescorch erikite Canaanitish tuberculinization brushet niobic drugeteria
304,iHfua,2018/12/19 04:10:32,61,qCHzvINXvZev,lum sundial conjecturality argillite adjustage odontophoral sari clinanthium recti vilification Saccomyidae sacbrood dexterous nankeen ischiadic pillared isocyanic untranquillized suffixal microspectroscopic
66,f67ff,2022/12/07 07:47:36,98,zgdsYGLDTJXzj,relationary twelfthly acyclic pollux liferent contrivancy Taiping Maja Calvinistical osteoscope metathetic ungropeable curtailed knab knobular mongery Epicoela dotage atechnic licorne
42,yqhNl,2007/05/19 17:04:24,100,hMNsJZHZDn,marketwise experimentee coteller burier calvaria liegeful damascener obsceneness undominoed decadary Tayassu ecarinate forehandsel unseized adulterine discommendation palm precriticize dashmaker untaped
933,8BI4k,2003/05/09 23:45:10,21,r,buzane redeploy countersnarl boasting intracellularly Christolatry taxidermist trimstone forwardness Sumitro tritonal humanics Kachin pentacarpellary nonknowledge unwidowed dissyllabification prodrome equidistant unsentimentally
642,48nYs,2004/01/13 07:49:20,71,wEcw,acaulous epileptogenic morong ureterodialysis glaring sterigmata thundersquall scrush zeppelin unstainedness Rollinia trachelate hymnlike leggy yardwand crematorial hairspring fillingness hinderly mastooccipital
908,NlmI6,2022/04/20 14:11:23,25,tk,Essenical demonograph membrana bridgebuilding vicine postpubic abstergent stonyheartedly Vogul preharmoniousness inhumorously anionic arseniasis bag allege alcoholicity monocyclic Shavian eelcatcher borzoi
194,AP8ud,2018/04/19 14:13:25,45,imkYqYMptpu,unhardened taciturnist whitherso proauthor Electra transmundane motorless envelop ginglyform warmedly staab etiolation unpaunched refound metacinnabarite cotarius objectization name chicness podurid
603,xz964,2006/07/24 13:18:12,53,p,auscultatory tubulosaccular polysporic haversine preimpairment Ichthyodectidae interlardment attitudinarian astrologic unburdened lobal nonreality unprosaic mosaist embryocardia zygophyllaceous brawler laughable abrupt spectrometric
