id,owner_id,creation_date,count,name,content
35,V4maD,2011/01/21 08:26:10,79,ZhEkwdOsdMexKOlBhe,bank theoanthropomorphic subcylindric sizarship bivalved behoovefully troubly receivability lubricator vesiculotomy eventual predeparture cointensity sanctionable goblinry sectarian discal geoisotherm auditor spelt
195,eynuz,2023/01/18 02:57:29,80,wFfLKijXwtCdewEqrMJs,caravaneer centralization Pukhtun unempty scallopwise Falconidae sericitic quadrillionth interarboration imitableness foreshank microsmatic cub gramophonical Hydrophyllum monographist vocationally isotherombrose waterloggedness dextrocularity
86,1xrnO,2016/09/27 15:57:34,24,woc,overwhelming diabetometer nonlicking sarracenial unmutated demicylindrical unvanishing evacuator sacrilege apomixis hysterocleisis ultraterrene untossed gaudery hoose subjunctive ovovitellin inclip gatherer blithely
104,lozr5,2021/07/10 14:12:43,13,dLXrxUnFDfYwJbf,ocularly resetter crownlet calculous macromazia Molala spairge befriz tannalbin unpetitioned tuth Tasmanian intrabred septogerm physicochemically Nilot genocide dezincify hame translate
263,GCgfO,2012/07/05 12:23:28,50,kDifyBarkn,booklore sooty vacuolization apathetically outright misbegin Tasian Minoress rebroadcast subclavius peritrichously majorette bethroot pulvinus Diacromyodi unchevroned ail peho affranchise pathobiological
24,elS9o,2006/11/02 15:11:20,20,sYdGCyZTIrpGW,ingenuousness cavilingly bricky coracohyoid brotherhood schoolboyishly irregular Alebion emergently arrowsmith Parthenium teucrin girt prepeduncle Trematodea responsible marconigram disinteresting prehydration orthoscope
134,uQa1Q,2013/03/09 07:20:09,55,WoROmqeQwE,electropathy islandhood predicator reincarnadine marmoset softship maniu polewards codify dulwilly flagrancy radiancy ballup bassoon Muntingia consilient hyperuresis pusillanimously putrescine kipskin
866,UjuRN,2010/02/26 16:04:51,44,v,broon patroller unharmoniousness outhector balmily unaccent skeuomorphic cervine uprightish areolet businesslikeness panostitis queenlet vaccinifer chromotypographic percentile undergrub punctuation Protorosauridae undeformedness
903,bgBUv,2019/10/14 06:00:02,12,AZZQRJhjoHPgDLnZno,Distomatidae superparamount outright nonzonate Idiosepiidae appraisable talar paleolatry inquest serrano overprone recommendability Snowdonian gyp misproportion unevoked oxygenium covariance noncurrency sanguinopoietic
447,iDToF,2006/11/11 00:01:35,29,WJVSL,binucleate uncontrovertedly rememberability plenish spencer immarginate colubriform beetlestone Konrad clericature acousmata plagal isopsephism samadh cenogonous cantorous hobnail distill phenanthridine sinkstone
55,z8IvA,2019/01/05 00:39:24,79,CIZvXtIjCI,bacillosis subjectile Eustathian remigrate defrauder Petaurista spender scroo superexcellency paraplegic anglehook preassume omnisignificant anguishful leaker nephrotyphus spillet sedimentary perpetually ringwalk
953,QgKIa,2004/02/26 10:09:03,52,OpcrUpPF,digram headreach phagolysis peewee hyperconscious ureterostenoma autoradiography grafter oilway nominally hydriform hey nontangential withdrawingness inobtrusive frumenty calathiscus nonvocal disenthralment nonextracted
602,C9gay,2015/11/18 07:42:32,15,hyix,ripperman antimephitic flawy chester temporizer usefully torotoro pleuronectoid unsuspecting poligarship prediscount remagnification Methuselah oilfish belute goldwater cornubianite skilpot affiancer filioque
331,6RoRS,2000/10/10 01:29:18,19,VNEVfqkeZxS,unexplicitly foreseer occipitomastoid maidlike unsurfeiting cardiotherapy backet excrementitial microcrystal brieflessly ecclesiologic isanemone refledge nidifugous bosomed bifer evelong Osirification evanescent psychophysical
15,1uDck,2018/11/16 01:17:16,5,wSGTSYJFgBfizse,birth isognathous agglutinize Pteraspis underwave pantomorphia symphyllous crozzly unexpanding Gib bed Taculli Guayaqui Hohe crewelist arachidonic harnesser chemis copunctal forebridge
684,InrxA,2010/12/07 01:55:43,92,GEDZNhI,niddick phantasmagorical warrantably planful Myzodendron unconnived benzoquinoxaline undistrained themselves thyreoidectomy Liverpudlian flume boathead quaff muddyheaded straw dishorn skylarker halberdman unweetingly
330,UQfWR,2012/09/12 02:19:28,7,TaUaSn,prescriptibility unrioting lickerish dysphotic dermatoid zonulet joseite cryoscopic toiletted Odontophorus acrology overlinked semantology postmeiotic photopia Jicaquean glassworking Ric radiodermatitis deputy
818,VQt0f,2012/02/17 12:22:45,45,e,procure onfall stereocamera posttrapezoid hirable sensillum pennyroyal trillet unordinate shipwrightery unhull exuvial addability houndshark attitudinal Cilioflagellata Mohrodendron coronadite noncorroborative cyanogen
181,EWE7j,2013/08/08 22:56:31,99,VObxzU,pharmacomaniacal imperfective n Senones Kyphosidae pneumolithiasis limitableness gruffiness forb Spirochaetaceae posing littling dyspeptic needlewoman Cliff redoubtableness nonculture unavailing ember countersynod
706,A6JTu,2012/12/16 20:03:24,19,NyYGlNBtgAurWNB,stouten outquestion pruinose unmeddle bingey ethereality overspend bilinguar Batrachidae unsustained Trepostomata overrepletion agrostological unfeued olenellidian unforceable cumberless transnature Dodonaeaceae serflike
584,Dgiyw,2010/06/17 04:03:40,40,mXAdRkwnrj,pachyphyllous shun drover tariff orangeroot dictator pentameroid lengthsomeness commutative obstetrist pasan unsuppurative without unopposedly Eimeria torosity tagger discodactyl phyllopode counterchanged
462,ETgeM,2016/07/19 19:06:52,69,sYB,commonsensical superrational eccentricity distaste quisby diolefin hopperdozer urethrotomy lutaceous trabucho unrejoiced prochurch schistocyte chloropal niffer pshaw Adoniad mesognathism hamrongite dolldom
71,tspo5,2014/10/09 11:51:26,77,OHQp,cunctatury vernally ensurer equilibrious waterman hyposulphite upspear microplakite skirmishingly unveiling overofficious barile bilamellate jewelless phytogeographic entrapper preconsider Tsuga balinghasay seamstress
639,T5hdn,2023/06/13 12:47:34,79,tgWpRzYurhaFqIEy,spoil ohm Outagami sheriffalty kukupa Falange leafwork wiremaking haversine geophysics spinosodentate pylorocleisis epiploce imphee Myrmeleon Christhood Actinomycetales timer sandspit purple
520,6zr2R,2022/06/09 07:20:04,84,xyuxtKbpk,ordonnance reconviction Circaea Selinuntine euphoniousness ctenoidian distensible unagitation antiusurious zinnwaldite antirheumatic arna meromorphic unilobar chasteness molecula index Net rimate landship
392,Ez8yE,2015/12/13 03:31:52,10,cNUgtyxbRi,seropuriform untrafficked Zyzzogeton osmidrosis ceresin Adhara anta flabelliform semicontradiction huse quinzieme arithmocracy downhanging unfretful Ramanan unsolvableness forecastingly undramatically prosingly culture
229,NRU5s,2015/04/18 22:03:33,18,fOUGoZyDSvqcikNe,tickicide Varronia overdoor leakance orthosemidine shock Micrampelis isotonic sarcoglia witan yutu lentitude reflectingly strikingly Wongara unfruitfully seigniority damiana dern boatowner
309,eRbEU,2009/07/05 03:25:02,18,OhArSbTWbOsVblINgSFm,tellurite escritoire paraenesis transcribe galliard counterprove orchestrater backhooker ungarbed unstippled reinsanity explosive connoisseur myoporad dynamite bockeret pantheum pseudocorneous methylator incompetency
453,wZiUd,2019/04/07 10:55:28,40,xseaUWSoz,desulphurization tramphood Amoebobacterieae lusher leadenpated rhizotomi gastrocolostomy stackman scolding tringine wanderingly rooty rascallike northbound hypermoral unresultive tomboyish extratabular exoneural tinety
626,OORzX,2007/09/10 00:58:11,31,NVJouBtDFPulTq,ignitibility Swamy Tetragonia Agudist prestable bordage regeneracy overprice liparite narine contextured incommunicative sericin unelectric Ronsardize lora overpour jutty skilly unsesquipedalian
115,B9sST,2001/05/22 12:47:15,44,WlJbZAKaZMbWjMGacf,subelliptical floccular sporangia tetrahedrite Xylina parascenium temporalty sublunary Filicales interact Spaniol ankylotomy jocundly toymaker boring reprofane daresay cantoner pinworm haggler
348,YZpHD,2004/07/16 08:52:04,99,hXl,procommercial scrutinizingly hallecret strook prespinal hypoglycemic rhizotomi unsanctifiedness yowley Phractamphibia lateritious blasty eccaleobion sarcine hatchetfish Prunellidae brassidic Lucanidae polyphagia phare
615,Ou4zr,2007/01/10 10:08:37,94,vvvzMQwkyAsQEgBU,squush Gilles semiconversion unmetaphorical sourtop Floscularia Mayacaceae Adib progressor animalian luter lechery vocular dotty fulmicotton subluxation untallied observational walker aphrasia
31,svWze,2020/10/15 12:22:01,21,P,excaudate connectival Pedaliaceae sporuliferous foolish enterocoelous nonpopular gelatinate patina hypaethros glibly neurodermatosis orthogneiss beachmaster Simeon harebrain regrip goalless stepuncle pleuropericardial
353,i6q75,2001/02/08 07:21:20,86,KTalLqpWkDGe,trichiurid ambulatory untraceably thermic equilibratory vociferize unlame genuflect extortionist ebullate myriagramme cratchens primitivism allele seropus heterogenetic phorology Eusthenopteron misbecome Bisharin
524,85IT8,2016/04/19 14:08:44,36,TQE,abstemiously lowder preconcur pleurolith presurgery partly nopinene grank rhipidion unwarranted nutrice ferriprussic stenocephalous praenarial stourness clamworm heteronymously disconsider suppositional reabolish
143,CbEDc,2006/05/23 11:16:58,51,fR,winrace pseudocellus argo unoared termine channelwards muletress highly metamorphopsia traditional aclastic equidistribution amidoguaiacol palaeocyclic bombazet parenthood haskness dumontite amphibolic polycotyledonary
764,gJHiE,2023/03/27 00:06:59,34,LMLENqCACDiuOu,semicontinent fetishism karyomere optimistical spireme moroncy bestab reconstructed aviatorial bacterioagglutinin carceration uncommunicativeness unaldermanly unattaint distributed Ectotrophi Cucumis twinfold pyrites sponginess
269,1GvCY,2015/11/22 10:25:42,24,kPhCWcfztU,dotiness tarakihi monoecian appropriable leprologist Pangasinan varicella rooky demonist convocationist repressed aute lafayette Lepidosauria opercle edifier interpervade miscolor subpentagonal Cobleskill
745,1kEpJ,2003/10/24 01:00:28,75,JnVfkDBwuMPlgMzugD,steeplebush rounder trophospore Salomonic akee fairm autoeducation semilogarithmic afterbeat comet millionist nebular ekaha anteflexed dissipate Estonian wigan crosse superplausible polyphonical
352,kwbq7,2016/10/10 04:52:51,85,tDPUr,shay antrotympanitis overrudeness unbejuggled preominate precooler Manto doctress unapprehensive ticklishness appreciatory dieback Hemerobiidae helbeh protoliturgic ovariole undeserver patrizate prefator irresonant
206,sg9nJ,2002/09/02 21:26:42,53,LnYqmLNQeKzK,lautarite unburial probatory undermist anteorbital applegrower fitchew Cauqui Winfred spoofery cutidure melampyritol galravage dactylioglyphtic Heliopora Sorbonic snoring Bougainvilliidae tightly consuetudinal
49,72Mfo,2003/10/11 06:10:07,9,JzQvBDiBN,supplantation annullable unappalled macrodactyly whipcord nondeclarant sensibilisin heterozetesis Dannie unfellowed coachfellow priestship labilization asperuloside Luian stercobilin nomadic mutterer quis hairless
959,IUE6c,2016/03/16 08:21:20,14,KeTrCGfSbVJBSHd,knopper lactifuge sermonoid hematogen fasciculus aquatint Palliyan forbore subsultus sweepforward shooter refall unapropos cakebread totipotential mux scrab aubrite loftsman basisphenoidal
958,w9wdc,2018/01/26 10:09:25,74,IRRSX,osmose sepulchrally muckment Sillery antiascetic securifer Federal Probosciger myotomic noseburn unbloodily morg anthracitious planeted tubular Patuxent doucely suprachoroidea cardipaludism hymenogeny
75,GBWgw,2010/02/05 06:47:08,45,FDmDs,duraplasty varied petrie electrophysiologist nobbut anabolism lue hesperornithid severally keelivine ophthalmomyositis coastal heavies kou phacitis photopic icosasemic polyphemous fettle oneiroscopy
820,tqahz,2014/03/01 16:48:37,29,dSSxyiYXrrCLDvNaxbFY,supertower bent mandolin malconvenance dentatosinuate alk reaminess redeliberation bazaar gemmiparously grudgery interstadial tetradynamious Auriculariales apprize starver serpentinic photochromography colane noncausation
792,rX72B,2009/09/12 12:06:36,10,IolAiXIppyGhL,samaj Cestodaria thyrogenic thoughtful ballist overstudy ingate schoolmastering counterend tribesmanship Elatinaceae rarefactive moulinet funori forefinger scyllioid crunodal mantlet avenue palter
804,flM9z,2002/06/19 16:06:11,62,upgJEdtsiejKM,oestruation henotheism nomarchy gosh suberect greffier encephalous henotheism unlocked weathery whangee Serapis mountable Limax fog rattlesnake washable hydroxamic archhead polytheistic
687,MxVZX,2010/03/03 18:10:00,65,pLRlfJhTeEvL,oculopupillary porpitoid thenceward basketware Eulamellibranchia bunchflower oreophasine dispensatory trumpery betony kaisership mammonist exteriorness otology ophthalmometer ultrafrivolous Gandharva tristylous stretti che
338,yYoqq,2022/08/08 21:57:22,95,EqI,phosphoreted unaggravating gutturotetany unoutraged coleslaw alkalinity Mainstreeter polyamide periosteotome isoxazine interdistrict tetanomotor proanimistic semiagricultural vinegrower bibliopolistic unworkableness lovely Comecrudo antepast
559,u5pRZ,2009/10/19 01:18:40,95,Zlyfkp,wineskin provincialism havercake sulphoamide inexpiate scrimply trihemimeris catechumen dowily ampherotokous scaled companionway sooloos Brosimum opisthographical hingeflower perfumy autoplast lacquerist puboischiac
653,sCHpC,2019/04/25 12:56:42,57,BrlLqIsYj,homeopathist lordlike mottler fluotitanic unamazed readable ilmenite yobi unmasterable swash strangership phonogram hairiness rotal saturant carpometacarpus acatallactic overholy cohune gauleiter
719,dCAvA,2013/09/02 19:57:12,6,CMUHmZdNzuFCtRf,subquadrate carcajou exploitative osteoscope tikitiki lipopexia janitorial filterableness tompiper xanthoderma khanda thermomotive saddleback Curtana honorarium Spilanthes canful sweetening pappy evisite
656,MElLv,2002/04/25 08:23:52,91,SCW,anhydrous freesilverite herbage cilioflagellate rhodoplast bodiless toymaking lyricist inelegance expostulate eximious mucedinous Rowleyan unnegotiable samshu tower surrejoinder bionomist myriagramme postdicrotic
70,uVivh,2010/10/22 06:02:54,92,sgXvzXmyp,bacteriolyze disedification nephrotome subdivider fertilize helenin conformator unlive obedientiary trummel podesterate unwaiting aerographical Toskish Rhizostomae Wessexman wyle Hepialidae sloopman platymeria
308,j7PnD,2016/08/09 15:06:23,21,xBgDDsPc,gouty manacle semideity mesologic pustulatous microbiological sacrolumbal Educabilia Zygadenus archconfraternity nondismissal roentgen bumpkin unarresting Placodermi moistish anomalously ramdohrite copperytailed placental
573,VXGCX,2005/10/12 03:52:52,34,lkBWJlldRcaThEcpL,barbigerous industrialist giveable prosacral Teco underpassion sycophancy blindfold tortuose holorhinal lusky potation projectrix untroublable cannelured dissolving twiggen thank burry quinquepetaloid
183,5Fn65,2022/09/15 04:21:56,18,XyTlSQLjJL,planetoid unimbittered Australopithecus topectomy bacteric colonic Melaniidae groaning flagging Beatrice adverbialize acutely pannel scytonematous instant dimness husbandland reassimilation isohel niblick
952,hipxj,2019/09/14 22:27:28,94,JjGyez,porosimeter spookist Pataria phytometry Armado unsheltered nonprelatical belah fid gavelkinder collaterality Gasan Aeolis leiodermia adjuration arenae deglaciation unimodal oarweed gubbertush
634,TWUzg,2022/09/15 17:23:53,19,kvt,subconsul tralatition done masque boughpot fainaiguer blowtorch coset Pinkerton cheapish ecosystem vaudevillist laconicalness bioral mother arciferous chilalgia sotnik couchancy desulphurize
948,P6Jk3,2002/03/19 22:16:40,41,xNEsLeK,diatom operativity Phoenicopteriformes felucca earthy hick Cordaitales highman thenceafter icework affluence owrehip Blankit imperil pneumonolith Zygopteris proruption cognomination flowingness overanxiety
972,GkmwH,2020/10/13 14:58:25,14,zwhxDrEuJg,reminiscentially oblivion osteotrophic punctated flagellant lacunaria zermahbub loweringly diphthongally unwagged neanic interoptic interradium Bellacoola progenity fulcrate unknittable poussette orleways calced
717,MpLpL,2002/02/18 07:50:33,39,yLVuyklJUs,frize outwardly knobbiness turgent dishevelment bipinnatisected liparomphalus ophiomorphous butterfingers nonclearance aisled personnel textman premedievalism Puccinia adventurous cassock ketting stolae unhex
36,kjKGM,2019/08/05 02:30:17,34,CwYTgBHwrMfYhhUBAV,gabelleman assentation Pennaria lentibulariaceous imprescriptible Cerberic uninvestigating uncontrovertableness outskip polycormic granivorous crescive eremitish oxyphilic edestan ergatogyny microtypal miscommand glycerize czarist
718,jnPOI,2013/01/03 04:43:27,30,YDTyVVgoui,Anthocerotales unannihilable twinkle leeches pleuritical amphibichnite uniambic paraaminobenzoic osteoplastic cranioclasis rootwise quicksilvery cutweed cranked observation undenizened taillight unarithmetically bondar titillatory
390,JAzL0,2001/05/11 10:23:21,57,KccbACnUcsvHzG,homoplast vicoite aquaplane nettlebird tenonitis untipt coequated Opulaster proboscidian acutangular predepart escalate overreachingly potometer viscera ungorgeous Anemonella reabandon navalism scutigerous
388,UP6O9,2009/03/02 01:58:36,90,ni,roub deme replier reconsecration prob exendospermous hemp acholia idiotcy wastelbread inconsistence allelic nonsynchronous Ommastrephidae proeconomy argenteous decorator importantly Lai pardalote
874,vFuLF,2003/07/09 23:10:26,85,bEBqDyrAOH,razorbill overgenerally roperipe reflected union uncropt Calcarea tacksman unapprehensible kharaj Jenson servaline beshear salicylidene predilection imbecile protect chorisis Shan undesire
514,SuQon,2003/10/12 23:38:51,47,rBrawiufVowxq,scenario hayward remap sifted coon postrectal paroarium shadkan scribblemania deicer pinnigrade Rabelaism knurled dragonhead olacaceous No readily nonextradition shoebinding tonicostimulant
581,lA3aK,2004/07/15 18:03:28,79,kfQzfOobW,runic imprecatorily crewelwork perseity Lepidoptera clank unomnipotent galah aeolipile picrorhiza barkingly ouachitite thymegol Rareyfy snakiness transilluminator gorse youthsome plauditor Gail
945,pz8XZ,2014/01/12 07:03:21,75,o,clinkstone Mycosphaerellaceae pandowdy cackerel stigmeology germon hopscotcher anticoagulant oilcan taky wintergreen pucherite unremediable mancipleship wolfkin itoubou hopingly crackjaw keratometer legantine
899,ZC9cP,2022/07/08 10:10:29,57,DDuZYYATfQ,cavernal eyer reflexiveness zoologist nonrhythmic reconcilableness beartongue dobbed talocalcaneal graved retropulsive granddaughter tooth Episcopalianize wondering pachometer unupright sneezeless anachronism detentive
793,KAEKg,2013/09/23 20:28:55,72,tebfEeFtCRE,gracile capitan cubbyhole photologic stationery thunderingly heliostatic recounsel monetization iodometrical deadhead outwish strongylosis preregistration asterion mitapsis nickelization precursive reedition grenadiership
244,3KMkM,2007/08/25 19:59:09,78,kpwSgfPLVQcnETy,Volcanus counterbrand Bianca edental priestlet arithmetization striolet pilidium huzza unbrotherliness irregulate beglide Anabaptistically liableness kudu cristiform sparring undiscernedly zoneless puma
655,ss26f,2002/11/12 02:55:17,60,DACQFHVYarfSJuBbLg,Coropo conviction carceag antiquatedness ionizer lazily curatrix dominance crounotherapy inscenation veritable pedometrical pulmonal ganging monotreme widowman zealotism idioglottic trimacer bootblack
411,XjXWe,2023/10/27 01:40:49,89,EKzE,coacher rimrock portitor bunnymouth flushingly nonattention stotter barratrously autoserum concuss rabitic astrograph codicil antiparliament cylindroconical psykter orology avariciousness melatope wase
913,Rgi8G,2001/06/11 00:08:30,86,XxwdWRjowutYnVTs,quinolinic Engraulis slotter predomination brainwash alme otodynia anomaliflorous unpassionateness inyoke arrhizal inaudibility clinohumite titule sophisticalness transvasation insidiousness hypogene prosubstitution prepsychology
96,Awgkv,2008/11/04 10:58:43,74,ZSeoq,cardinalitian Sassanidae Arctomys uncapper flake thaumatography paroemia feis gastropneumatic interworks inrush Nematelmia theologicomilitary adage serdab extensive Umpqua cleistocarp Chuvash capturer
321,q2rNm,2019/07/12 02:04:54,53,ucnDhisWLqjh,Silene papain deplumated stoutheartedly antinomianism intraglandular glycolipine bronchitis reversis electroanesthesia psilophyte demodectic copulative bairn epicyesis riverbush pseudomucin inexpediently quinquesect blastostyle
841,gpfGR,2011/04/20 21:52:25,86,iPIgwFilyusMoo,ashraf palaeobotanically Renaissancist groundsel synagogal pronephric tintype Bartsia Rugbeian spaniellike circumspectively Parietales winesop shy republican garden ocydromine oxbow antipyrotic odylize
671,IleSD,2009/10/05 13:23:20,14,wbThPsaAFDLFSczBa,frog siltation omegoid interlock abrasive refrigeration metaldehyde virginally outflourish emendandum poised hazel Duessa fermail Dargo gruesomely Sherramoor epidemiologist glacis towngate
147,PwTHM,2000/02/07 02:21:16,10,EKrZzfigGriRPvXnmjN,amorphousness eviscerate dentine preabsorbent infallibility lace bradycinesia nuque physiologically butterbox refractile lecidioid kerosene spiflicate modesty puppeteer Cervidae preimport untrainable sledder
703,2YZNw,2000/08/05 20:58:53,58,PCIotXQHBvkrKIShQt,Tuberaceae underman epigraphical mountainside flick owner rompingly hushfully mermithization basically Moore diplarthrous futhorc Derbend reinfluence vixenishly Anglicanly ovorhomboid gymnospermic sclerification
950,fIJE9,2010/02/23 19:17:28,87,ukZbdrPB,recramp yolkless saturant dochmiac bellwaver sexly dossil referent octoreme Avarian Balan tahr shipworm Asarum homaroid inobtainable hotspurred lampas Megarhyssa pentylidene
425,AnCsp,2021/10/12 21:42:49,76,uWOwiL,Uloboridae Amyridaceae telegenic thermanesthesia armil arillate pregenerously semitropic Gethsemane fustanella whitely reekingly afforestable tyrosine yoretime misdeal archididascalos smooth juxtaposit tweedledum
315,DrXvl,2023/07/13 01:39:46,58,VjrcJF,coony recurse guardroom ecphrasis sunproof anthophore kraurosis archdeaconry terremotive fire vogue nonappellate deference underthrob quinse emmarble grimful wheeziness lazyboots opal
127,wroMY,2007/07/17 07:53:09,22,ROpzKIoHi,Zabism vaporizable sphaerosome unmetric uncramped doodad papulose repressibly soliform Skittaget enwood semiconcrete overcheaply uniquity niccolic leucaugite dolomitization photoinactivation prerespectability merchantry
669,qGxun,2002/08/25 16:14:20,43,v,epigram Machiavellistic viscidly squalidity unobjectional upstage collier pulverant nonopening laurdalite stuboy anazoturia pappox porpitoid duress fragrantly spectroheliographic veto uninnocently porus
50,l4roH,2006/08/14 08:32:10,95,XDKqIcDTdUAOxKMmGFje,reamage perikronion undiscernedly flutist uncrystallizability civetlike circumflexion Tichodroma lorgnette follicle preafflict instrumentalism redepend storge axofugal allowedly unlace beatinest epencephalon patroonry
303,mebVA,2000/03/19 09:24:43,26,iiVLwqbLOJQxcsQXlt,queue naik carpeting autophytic bibliotic unsmilingly hederin pudent over Dimorphotheca apolaustic entocone lunarist inosite uliginose flotage unwhisperable reimpatriate stibnite nonregulation
271,weTLv,2009/06/14 04:39:20,75,hswC,disposure reaccess psaltress Pisidium swathy Tema pyramidellid pachychymia uncreatedness otherist quercivorous politicophobia imbue memorandist Marsupialia assumer curricle sixhynde Mantispa phalarica
325,8QRmv,2008/12/24 20:03:51,47,eZObRHDHRLlEyvMNHeC,unbesmeared Monel hysterotraumatism abidance bedewoman smegma Walach snowfowl nonaccretion osteomanty ureometry latticing iodiferous measurer balita murrnong courtierly homopetalous colostomy succent
787,IVDXR,2000/01/11 07:26:29,17,PgiptDQWkcbrJai,shapeful droughtiness dechemicalization amphicribral bawbee unbrowned spindler dentinoma Lisbon sinistrogyrate inverisimilitude chrysochlorous laggar unreluctantly pseudohydrophobia oversleep barghest padfoot postparturient peptidase
163,YGKWP,2020/04/10 01:05:13,30,KnGRdyNwOxrQYRhtse,animalculum Eclectics pondok exundation composition backspace umangite fernbird beholden certosina dipteral hyperplatyrrhine Pythonidae misexpend Platonicalness predefective Venkata calyptrimorphous antenniferous speculatory
420,pmjcS,2017/12/01 21:58:35,9,guoyrNbVV,Stuartia misprovide unreconstructed javali lingonberry perennation dermoskeleton unactivity neostriatum gnawingly undithyrambic carpeting autochthonal gramp unstretched enactory underjanitor deconsideration uncontaminable gonoblast
553,tuz7W,2003/11/09 13:24:14,57,tdTjpawJoKhQ,purveyoress pyrryl complete inverse confidentiary Latirostres Kedushshah Sambo misobedience biacuru Griffith quinqueliteral rigol monosyllabism hyperpnoea outstair archoverseer unprince heraldical stipes
223,PddVt,2004/03/22 10:29:21,45,uurVIuz,lumbago acronically radiolocation hemophagocytosis mishap subsextuple myometritis intoxation plastidule Therevidae sparkless radiotelegram conceitedness masticic vesiculous spiritualism manciple foraminose neopaganism immanental
889,uI7aT,2013/12/26 01:26:19,84,zywAgFsnRAWaDqfl,overreachingness Bhima collie arrogative tiny quadricarinate tinwald pennyrot floricin takamaka lamella quicken flioma glovemaker unthinned salicylous disengirdle sinkhead charitable fusiform
176,kmHQn,2003/11/10 06:46:17,65,HAIqGBX,unbethought juvenescence vesicate spinulosodenticulate heterakid tindered Quiinaceae Ichthyotomi unextricated chump geomorphist slutter erogeny hangnail yojana Jacaltec synkatathesis outscold paraphrasist pavemental
637,AHWYq,2023/01/17 18:37:52,89,tYnMW,overmasteringly Pleurosaurus unconveniently anamnestically pinpoint unencounterable Gothicness presaging coconqueror diazoma forecasting i Tabasco floodlike rot superaerial songish backdoor reluctancy thermostat
7,G64gH,2003/02/09 01:37:05,70,hFpaTKFZTvEALLue,rebroadcast euripus irrigation Elasmosaurus supersedable antidumping stagnancy graphotype vorticellid Lettice Pleurodira Missouri pseudepigrapha underschool incommodement Kafa inglenook Rodolph interlunation conducer
