id,owner_id,creation_date,count,name,content
980,G2AkI,2021/01/03 00:29:12,56,m,revolant urinology commemorative berylate disfranchiser surdity noncollectable predreadnought whaup burbankian Climatius galatea financialist cueman strigillose genial hashish unturf unpainstaking practicalist
523,Ph6Lg,2001/12/21 13:47:57,50,TOvlWspM,bolis nymphaeaceous rynt nonretraceable Cryptococcus platosammine viscerate phoo philocathartic intermissive destruction potentiality pentecontoglossal Desmodium unrefracted febrifacient pericardiopleural chapatty perissodactylous unsatiably
550,Hxywe,2005/09/28 19:34:46,67,VoCliWJIE,Bedford debordment Dora basifixed ileac Castanea physicochemistry irrefusable Tractite unsupplied abrader stelography bridesmaiding ammiaceous redeal ceroplastics urediniosporic overdiversity rheotome tea
400,pDPVO,2020/04/22 12:25:39,69,kfGwoXvJjcfoI,pelterer alignment boho relievable plemochoe demount uxoriousness cinchonamine tumbak accruement flatworm appellatory fornicate recklessness refusing gutlike unkinglike bobization pharyngopalatine injudicious
215,uDaqZ,2014/04/02 05:08:59,96,yKftzHL,erythrophleine anisochromia usucapion icequake letdown viatometer diplocardiac jargonal ethnogenic mapwise coauditor plod alkide dulse ortalidian Eopaleozoic orvietan colitis endochorionic sarangousty
568,QOQKA,2008/06/02 08:25:03,87,oT,ptilopaedic exportation unrove agoing ruthenium tachysystole vorticel tridentate coheretic egad Cordylanthus bromoketone preregister stosh bayoneteer Hemophilus desirableness glycolytically postulant infected
425,0yEwP,2014/02/13 18:03:42,33,PB,theurgist heavyhandedness withstand counterplea Sagittarius deliveress endorachis dentaphone afterwash curtal moorstone Maimonidean wearing Vasudeva rewayle temptatious tuarn tricoccose jimp psychoneurotic
763,B4YGR,2002/02/21 14:15:50,94,mzCR,feculency agiotage mustily phenomenalistic glomerate touched ventroinguinal unawared substratosphere Clamatores drained resemble ingross lyery overcertify swimy fairing poeticize incide ophiomorph
23,HB2xd,2005/10/08 02:46:27,28,NoApKrfxGCvlmtfvXjPK,castellated scatophagid superdural meminna fleshful hauld streptosepticemia entertainer electrodentistry microsmatism Glareolidae wrongless fluidization aquarium subheadquarters quadrangularness Albyn uncynically impressive mysteriously
948,TsMlo,2013/06/20 14:56:17,41,hp,microphthalmia athodyd inwards sight untempestuous ichnological amidoacetal varicelloid sportly airwards tracheidal leftwardly corallum transilluminator promercantile ancillary tanstuff Apatornis capitalizable rueful
964,bjt76,2011/09/03 07:21:46,60,eqovydDfnAAJLZTy,noncompoundable nonportable horsehair irritancy vairy debellator peignoir Adullam fusht Puritanism integralize koniology epitritic hasten acyanoblepsia Araquaju Ogpu pentaptych incalculability percipience
581,xDGtl,2009/11/05 00:28:32,12,XmKKTezoBmlUOnL,uteroperitoneal phose intercross indagator ill Jute Appalachian unhopedness exaugurate autobahn saliniferous monotrochous muruxi mineragraphy propugnacled circumgenital antimere anthracnose contermine trumpetweed
828,5VNuh,2009/05/04 04:35:49,17,gDhBY,squatinoid ameliorate sadhearted gersum milkily Phytomonadina organismal ichthyophagy marchantiaceous unseparableness asper sulphophthalein sozzle bitypic nonconnection nondeclarant pteropodial neurotomize mediumship acephalist
379,8bGd1,2008/06/10 19:38:06,25,VnxmxDiUXz,nonprotein eruditional tractional publicheartedness Honeywood pickleman microlux badgeman undaub endopoditic unrepentable quatrocento crystalline Corybantian riprap faraway escheatable photocollography pua friendless
754,2ifqO,2012/02/14 13:30:38,64,qkJqqaQiYdprtzSmBMlf,chiseler Patwin clocher brandish sternothere nonenteric incudomalleal hierographic disinfecter crooknosed begarlanded tachygraphy Afrikanderdom declinograph malrotation Ierne brehonship appointer theophagy unhusbanded
196,eBAxl,2003/07/22 19:51:16,71,kqe,popeholy colauxe puraque autoschediasm runkly deflocculation angioneoplasm corpse accentually equisonance Michelia trajectitious recriminatory antianthropocentric nepionic bobo apposiopestic thiasos viciosity engender
429,LrQVU,2010/07/15 12:06:00,7,OSQGUxaiYIsig,antidote filtrate keno swordfisherman mediator Mondayishness perukier ampelideous bilander pelomedusid oenin Juvenalian antitropic flanked jamlike staringly precompress physiographically patronizer entirely
926,l08xp,2010/05/16 08:21:41,78,DnIYsEaggRBHpUkVB,cosmorama Hindi galvanism overboldly darkness overgild Elysiidae misanthrope consilience prismy retransference organolead acronymic Smithsonian hypersophisticated coglorify beetrave unreferred areolate Sipunculida
35,g9RPt,2013/09/19 15:21:36,48,mUrSgmYVLnIVuUI,perigenital radicated postulator toggel bromomethane shodden eminently deferrable accusatival kawaka antilysis denticular physiologist willyard Hibbertia unlisted ingressive pitiless traumatically leptodermous
925,NS9uK,2000/03/10 22:57:58,12,GLETKPMwQNwNKgOkO,tetartosymmetry hart bundobust fussify buckeen laryngorrhea oxyesthesia balneographer intranscalent calciobiotite papaphobist bukshi microsporosis odontogeny Gellert uncompensated bummalo chenopod Washo bonder
515,sQp0y,2009/09/18 11:37:51,57,jkibE,eelware outlengthen Spy tallegalane beveled befreeze Poseidon purveyable ideogrammic Karyolysidae Ophichthyidae zoocoenocyte Galei splinterd primitivism swigger vitellus Cyprinodontidae Hemigalus Zeus
181,Itmli,2015/12/04 12:52:55,29,FWJwszycLhCLTiP,Amblyomma apocalypt pseudocyst nonpaternal off tonsillitic projection acetylenyl goff azo tonalamatl cryptorchis gesticulatively Chozar psilosis Katabanian buglewort attemptable trawler Cynthius
161,lIUOe,2012/08/14 18:14:52,71,T,falsework theodolite Cinderella synascidian ceratotheca joylessness biogen deifier bidigitate superpower gephyrocercal heterokaryosis molluscoidean taurokathapsia epanaphora rumgumption uranoschism oxyethyl vasoganglion Belleek
172,DrzRS,2020/05/08 08:05:47,73,cFvwnerBIRdIJFx,Gliriformia hemoclasis Pilobolus modulative Regalecus unannex annunciatory capman spathic paster miscognizant dorsoposteriad otoconite unchurched Palaeothentes epilogical asteer cogitabundly incontracted Socinianism
323,F31a0,2020/04/11 12:42:42,18,dDIKYdxeZvtGRAjipBh,reunitedly Euglena accelerator ginney metrostaxis wogiet unreceipted meditant Kuneste salal Stegomus theorist Capernaism cupressineous tetragenous broadthroat democracy overcrow scrubwood unrecondite
298,bc0si,2022/10/17 06:59:10,76,MAUURLqElH,apneumonous worth aspidiaria Utricularia thriftiness gyron premultiply predivinable backfilling metagenetic intrapetiolar propagability alloplastic nitrogenate folkmoter eliminative unadmirable interprismatic spaik bibliographer
83,eApt6,2016/06/11 12:37:42,75,PzLGjFLBATZnpwZG,acnode enjeopard uplook zootechny thou impersonization buskined fungibility traheen benefactor unmotivatedly hexacorallan bactericidin gossiping photographer petroglyphy rainbound refulge Calothrix peculiar
352,7O8kH,2015/02/08 15:09:42,90,cbpRcaWCnRyXFLWWtLE,inalienableness hyperthyroidize bausond metronomic controversionalism succinyl ligulated hoaxproof topazite Asterozoa dispensational aldazine Canchi scyphi equipollency retrocognitive airwards aureous Thoracostei Dail
43,UQmcH,2019/04/12 16:47:15,84,iKDVjdksQOEpNtho,wildfire ananym saurischian tenderhearted estradiot guiltlessly salute aerose ataxaphasia freshmanic impropriety verbally hemihydrated anticancer oppugnacy saucy Phersephatta oversimple dilemmatic phosgenite
658,UriFI,2020/07/16 12:20:40,28,zhnuTZRkEi,subcompensation nanomelous autokinetic mannoheptose oftness entocyst Veadar algesthesis knotberry unisomeric unhot unforeign pith sharer gratewise Cheiroptera propaedeutics phytogeographical illucidative excuseful
936,85elO,2017/05/09 09:47:23,58,nlNfUUaydgzc,infratracheal unabatedly albify cauliflory moonily philosophuncule catechistical defilingly valvulate unmiraculous naumk peck outsided pitchiness craterous donated chiastic inspectability reluctance Tumboa
560,Yv1my,2003/07/02 16:19:08,15,smWaQaLhjYXxKmL,colossean mislocate priss procombat calciphile mangrate palingenic performative Cyrtandraceae aloisiite sleuthful Catalaunian causidical probouleutic adelopod reactionism supportful labyrinthodontid immorally allotriodontia
291,EgKK0,2010/07/12 02:20:02,82,MMkqmyeSauCIrc,conductorship witenagemot dyschromatopsia waistcoated intermammillary implicitly Galloman overdeal unproductively jungly digestible impalsy subterpose staringly cementation showily preornamental Cincinnatia horsify admedial
87,44VnX,2005/05/07 22:14:36,15,YtfRvf,wincey glooming curdy perruthenic invigorant microblepharia demography laevorotation Capsian palated scurfer predestine rotuliform seclusion Thalian grottowork unburnt dicrotal cleaver stockingless
527,GjhwI,2006/10/13 14:29:35,34,oFXOPJslQtBJKTzBb,sporogone Malemute koromika anachronic potbelly Supai untwister graffito street abortus bibliophilic thoroughfare outwater Jacobitiana solleret nonagency alkylate cadetship imitatress telestich
431,JzPPZ,2009/06/07 05:38:40,69,XCujqhBSHMCRoUkLAuQ,Brabantine mutarotate Algol checkerwork precomplicate matadero fantasticism hopbine Bardolph unaudibleness Eugenia ependymitis scotoma aculeolus crissum Cestrum contingently questionee mordication moudie
319,N2MSF,2011/11/24 02:09:28,5,zWzPqrAoTAzOAzK,unloose anacamptics arsenophagy shelterlessness Wapato unperceived footganger adverse taborer cope unscratchingly aftermast cardiarctia deduct pyrroyl aquo bobcoat misprize equinumerally tarras
782,DGZAz,2017/06/09 00:59:50,43,mIOxOdX,amidoacetic valuator Mithraicist interconal Aureocasidium nongreasy guaiaconic Ortrud unwarily Tchwi taintlessly bisectrices coercibleness equipoise rackboard eleonorite mythologically Bihai coelenteron spitpoison
98,lpJSe,2016/12/01 00:53:49,93,JIgHIjNFCGWOFfZ,concelebrate amateurishly hepatic Cilicism Essenis unmanurable bolson Staphylinidae untalked unenthroned horsepower amylan min traducing catwort grapelike abominably lanameter ammonoidean priestery
814,L2gmy,2000/01/07 07:02:20,46,qslzYrgDOOFvgji,contratabular Minervan pantofle gaudful saltee overproportion speedingly stealthily inkstain axon metastibnite Cassicus faintheartedness tilemaking vouchsafe goggled gibberose aerogeology nontransgression unintoned
557,p87vQ,2006/05/01 20:19:08,52,hzsBbolkrOiY,harmfulness Haliserites almeidina thwarteous huskwort reamputation prechildhood Brosimum counterstream Alpinist petrification pervulgation overward hypermetaphysical lardiform ascigerous avowant nonpoetic ruined immunogenetics
750,cgfP9,2005/09/08 12:40:32,78,iHLNglYnFQYmRJsGwLyM,Leucothea flowerlessness leucaemic translater vibracularium lad soldierwood stringent circumvent pithecanthropid meditator purveyancer avera saltfoot unaffrighted recongest dhyal coop equalize inwoven
755,SM1bL,2014/11/04 19:07:17,65,kU,saltary noneclectic ariegite were alcoholdom Eduardo cham arsenhemol overgreasy subterminal princess transfixion scatophagy millipoise scaffery steeper Khartoumer Haeckelism floriferousness florent
375,zzQUL,2008/05/18 05:48:51,32,U,retroclavicular omninescience theologically livery aerographics taliped densen unregainable welding precooker quadrate flotation sleuth glaziery thermoluminescent appraisal numismatology unspeculating undirk stadic
62,cwbYG,2018/03/04 03:13:21,67,bk,bronchoaspergillosis teamless hubble acetaldehydrase millinery unburn seen guadalcazarite chorioidal unigenital violety predefective Marianic renerve flindosa antidetonating careful forefoot leucotactic eternalness
790,0bpNa,2018/07/02 03:27:27,87,AI,unsplayed employed Pherephatta gelable ileocolitis desmodont Corylus blading isodiazotate apse gesticulatory xylene reconciling methanate unsappy overhatted hydrospire distinction monomastigate Allan
655,1i1y2,2013/12/09 14:16:25,50,EuSyLvm,plessimeter unsmirking predative acquirement atinkle myxofibroma starchman waterproofer orthogenetic uneliminated Juneflower diadochokinesia transpeciate cryptococcus gunyah whacking morigerate pointlessly perigastrular ameed
317,9um3s,2020/02/26 23:36:45,20,wKeLSkAMzNpdQec,translucently whilere Ramoosii redbird Sudra Otomitlan Benin downwith Caesarize whereof introductively pyramid etiogenic presuperfluously forebodingness Serendib domesticize handkerchiefful enjoyably lapsing
541,l6Pvh,2005/07/28 18:32:13,13,QKZKQeFoawNCnrlo,otterhound benzil splatterer suboesophageal Saturnia eunuchoidism maxillofacial Ribston bemud escritorial calentural Javanese unendued professorate tarnish nounless Wagogo reinthrone latex fundungi
624,JFcRY,2021/02/28 04:57:46,66,RPiVyveHqsYeaIU,outbreed hangwoman praenomen innative reconnoitrer puzzledom Anzac malison adiathermal breadseller Cabiritic guaiasanol veratralbine feeblebrained allosyndetic tomentose chondroadenoma nitrogenize nonastronomical hydrogenic
867,Hn0X5,2000/10/28 15:45:03,36,TowEXEoiFWXlRj,diastaltic reversify unspeakably revertive Italicanist logeum Jungermannia automobilistic milliphot sauropsidan tuchun strongish subtrapezoidal calden eluate phosphamidic inexpressively polygonically unomnipotent backstage
715,15iXY,2019/06/26 23:32:03,27,YfMgjqVeyiewpv,portside flosculous Islamistic evoke posological seastroke dermatopathic caressively infelicitousness Elohistic orthopedic spectroheliographic chimpanzee rubeola Dentaria narcoanalysis Fulgoridae anthropomorphical superextreme generosity
88,HYRVu,2009/11/10 12:18:54,44,nScyvrpnzz,nickelodeon featherman avocatory dactylitis indrawing sachet desaturation giantize ottavarima Euryalida vespers unprecipitate valorize autolavage quatrocentist ewe cardiorrheuma unspotlighted eichwaldite reclinate
872,Klw5t,2019/08/25 05:40:25,52,Muzyy,divulgement cornmaster unethylated precritical degree cumbrousness sculpturer intentiveness scholarlike synod breastpiece thermosiphon sciolous polyorama staurology superodorsal schizotrichia tintometry succulently ethmofrontal
34,2MdKg,2012/08/12 00:41:09,35,gzOgkzeRMaIIgE,spidery endome uncropt proscription ame hilariously colyone Pandionidae pledge protoliturgic baff enturret Datism curemaster paintrix cryptovalence ostempyesis prissily Vened quadritubercular
32,WsJxR,2013/09/17 13:18:01,25,BYmVqaZ,auxographic Slavism anticker Hydrocorallinae axiologically butterwort hypercoracoid noncapillarity fling vanillyl marquisotte blately heelband roughtailed coinsurance Echis nondelirious death toponymist simity
305,g1Abd,2018/08/06 23:20:19,77,Oaxdjjc,arsenization cladoptosis pteridological chihfu pentadrachma sphygmoscope lier undeified uranalysis proficient Osteoglossum chalutz suggestivity Rolf trompe levier unsexual divellent tubbeck Mexica
928,Osfz7,2014/10/23 00:32:08,78,Grdd,trubu cedry Sabaeanism cohibit nutriment vaginicolous ungesting garrulously concettist charityless reconcoct formaldoxime daintify secondhandedness oligomery consolute thegither sigillation joinable palladinize
885,yKmbh,2003/09/03 19:25:25,80,pPqmKdUIvlHQI,orangeleaf expurgatory entification evader Apiosoma tetradecyl endamoebic cibarial chelaship archhypocrisy xerocline fibrine cohabit humaniformian map musculointestinal schematograph deducibly petiolated ricochet
3,SVQ95,2023/07/15 11:06:32,1,cE,diazohydroxide triareal lacet blizz Laboulbenia slunken cuckstool dextrorotatary crystallitis endotheliolytic bossship nonplate bushmaker streamlet oncia vanity chuckies Gongoresque fjeld cutitis
4,H1DdF,2001/08/08 02:59:20,30,BdKFzNOrqUGtWfe,essayist postlabial bicamerist aroxyl nabk gremial Hydrachnidae linguloid rist house vamp anisilic readership thermochemist megalocephaly verdurousness beraunite triplopy overtender complotter
972,U9B35,2019/09/06 07:12:27,83,X,postplegic belah borsholder superscientific soldierhearted parasitotropism Munchausenism lecanoscopy garrot isoperimetry fustigate nobbily unwatching dicyclist hatbrim subdemonstrate uninwrapped diremption Taenidia effectuation
657,4keZP,2011/08/26 07:51:09,99,tKpmpP,hemabarometer curtsy Trinovantes bejel intestable millennian boroglycerine dayman toothwort holstered snubbish Libertas holdover unbagged hyperplasia Populus goutiness amazia reckon latheron
682,dwO1I,2002/11/17 04:28:30,80,KkdkiIw,unrevised Hecatean Philepitta podosperm goosewinged pervasiveness fribbleism beprose Blumea multilocation amphophile Hymenoptera brew oratorically hydrothecal balanophorin merriless campanologist limnophilid meadow
878,GFIxo,2021/02/13 07:01:01,60,BuesSOzcNVPuQbEFbLPM,equimultiple graticule rotatodentate Thlinget hydropigenous seamanship nebbuck parachromoparous ungeometric thynnid anterevolutionary fellaheen secesh protozoal unheler muslinet ensilist disshroud Corimelaenidae overbooming
706,9Bjdy,2005/03/03 13:41:24,31,yjAtfEebYEAEWHoUIK,inappropriately spermologer geometroid talari tampala undespising myelin trigonodont chopa commerceless stingily ophiasis indoloid retainability simoleon sulfonation argyrite glosser ushabti interfusion
836,ZQERI,2023/08/03 14:41:21,65,e,kawika halazone Bhadon spithamai ribonuclease plaguily comparableness windfall emphasis hyponychium anatheme hackly grouts stamp atrabilious decimalism mushheaded Sagittariid pointment monody
982,bH7np,2022/09/27 16:23:12,5,dDccOBYVUzz,impressively kapok inveterateness Maia Chernomorish uncharnel pugilist bellicosely witjar skyre pinnulate semirevolute spathaceous arrhizal Hydrocorallinae semilong determinate magnesium discredit ultrapopish
104,DDOrl,2007/01/11 22:28:32,3,VcVfDezkZJVDfVpUL,metrocystosis disencumbrance floscularian heptagynous platitudinal Burhinus Cynara trichopteron Monograptus semiflexure Hemigalus phoronomia dumpcart Leucobryum ceruleum sley grubbiness savior invulnerableness intactile
525,zlg0Z,2006/08/18 18:07:39,71,FnHJTyWgkBajUp,Aepyceros cuss quotably acrolein superrefined vestibular postobituary undisfulfilled wraithlike margination chalcolithic rimbase ultramicroscopic pseudoparesis pythogenous likable liquid artiodactylous repeat bankeress
212,p5Nds,2019/02/28 09:34:12,37,TaqpNLdcorruMwTei,unfortifiable cryptovalency recountenance resection Susanna hexatetrahedron ectodermosis pietas Raiae Andine capsheaf arraign flashtester phenolate encephalomeningitis Ophioglossaceae erineum bedcase urethritis overcap
426,AOUs2,2016/12/19 07:59:24,86,JpfmVl,disproportionation hurricane monergist extispicy plowfoot heteronymic megavolt gynecocratic godly multisect axifugal venomously phenol nongalactic mesatipelvic soleiform snort polyspermy halling kirimon
479,16TdM,2020/10/05 04:00:30,73,yheGNFozYkSkRxrxmgg,phacolith antimerism superpetrosal acclamator gem Olympicly vomer pentacid orchil belie superaccession megadynamics apothecium hemitropism nonenvious Nicol farruca jaggy Eskualdun hydronephrosis
438,ruWWQ,2019/05/17 18:01:06,80,KK,poetic swinging temiak nonassignment xanthopsia cheesecutter Kayastha tripetalous span transhumanation underwatch violina sprat anhydrite vagarisome firesafety Portunalia omnifariously bosher brawny
154,ew8Ac,2010/08/22 07:43:29,73,mjuPGDVbfW,Autosauri boob shadowgraphic dygogram omniformal gonapod Phacidiales absentation unroweled paramorphine predesignation breme Anatifae strudel Phocaena dertrotheca twinkless Sadducism flaunter frustration
946,huHyi,2002/03/27 16:42:29,84,pXVrOteZuELdlwS,overpregnant cysticarpic subprovince insolidity tetracarboxylate transportedness assuasive penthemimeris velatura unconsulted spiration lithotritist decreasingly donnot premankind nobility nomogeny priggess Sion unblemishable
204,9e4V8,2008/07/09 08:19:42,39,AcRI,callidity heritable overornamented microporphyritic nerviduct gamogony titleproof epicure Nuba consignificate inostensibly pipery epicanthus evangelically ringcraft compulsoriness piecen upcurl wordily idoneousness
97,q8wHg,2010/02/03 09:34:39,78,o,compulsatorily corona subscript ismy vulpinite proneness midsentence poind Fletcherism ancoral pollical pastry Marianolatrist uninhumed resty Achaemenidae Cynopithecidae ungyved euploidy dumpoke
355,LBtOa,2002/07/23 15:24:53,6,liEpT,exemplariness centenionalis Scorpius ephidrosis deorsumvergence abrotine Theligonum nonresuscitation strandless subrebellion bandaite yom blench metallorganic Herophile reflexological drunk tera subpericardial sheriff
497,p0lc4,2017/10/23 07:13:37,10,SjORWQIR,pantherish Whitsunday daphnioid zoa untreasonable scandalousness representational emporeutic road crapulously semiserious dolichocnemic shug Wishram gelatinify suspectable pachydermal seak oryctognostically Squalodon
169,GI9a6,2002/04/02 16:53:14,16,yV,triplefold blotched overnoise perambulant nonsharing amyloidosis caracal sarcastical finite gamostele yowlring unremorsefully jure triphase graphically armadilla Chaldaic malaccident Fundulus dikkop
11,YgBk7,2002/06/10 15:22:36,95,z,Catesbaea corroborative plainness jabbering cheiragra Intertype untwilled funambulo swallowable refel dicyemid imbonity oysterous subtitle intercooling coaming disserviceably runout Placus phonogramic
366,kyPho,2001/09/07 05:08:39,77,grs,unstablished titleproof extrasensuous shelfpiece byssolite triglid mudden inexplicitly hymenogeny tripleback pendeloque cognitum overheavy thaumaturgia salification pantograph orography enflagellate bayard slipshoddiness
608,9gkWN,2007/08/14 07:40:56,73,UqBRdlEcvt,polyarchist inglenook arsedine rescribe sulcalization revolutionize anaerobium antieyestrain unbound epitonic Mo maladjusted essentiality sextile parentless magaziner demonetization drawhead restaurateur Aleurodidae
399,l15UH,2008/12/25 09:57:32,62,d,mawbound checkrope trihydrated dorsoventrally ingrow thysanurian destress behest aghastness Clunist noncollusion reformistic barrico boathead polyarthric sixsome inconclusive wreckage knickers squaremouth
729,jLLz2,2003/05/28 14:26:29,89,zcrPDjFKAocCZsYU,bidenticulate unrealized humerus uncia Cymbium Galloway chapelmaster alumish granitoid fell Styx twinge bocaccio hepatostomy unincorporatedly Vampyrellidae Acridium Rhagodia trisection octodactylous
494,FbOax,2014/02/26 08:27:58,72,LaKLSEgnCeN,unbenight megatype reflush postpagan Amphioxides cuscohygrine libidinous superfinish piscine gallop fishman Cacara xiphosure Autobasidiomycetes unlabialize transumpt chorook hemolysin llano unhospitableness
412,UalST,2008/05/28 08:18:45,81,ZhhRvVHwRReARA,crackless filialness unluck Jezebelish interdictory typhotoxine fossiform dissert styptical platyrrhiny academism cosmopolis woodmancraft polyphyllous reimburse archipallial gorgeable rescriptively tutwork lagging
408,pHAEb,2013/01/18 19:44:36,27,YexEjeN,exposal costiform sethead tamboura teleprinter afford Budukha precompensate polystome Eurypteroidea textiferous Mussulwoman yarringle inveteracy dynamitical supercombing sinfonia uncouched uranographic repostpone
611,WH8lT,2003/12/27 21:51:50,99,aMkWutXhNBfVqSpCdNhh,macrophotography pittosporaceous protomeristem oligoprothesy Philohela pluriparous hereditist sublieutenant streep salpingitic stradlings agrology pumicate demiflouncing differentially ethmosphenoidal noun crystallochemistry ophthalmalgic postface
390,BbYY2,2004/06/05 12:35:09,47,GGnpjokdbsJJrXJE,carcoon fizzle galvanocauterization featherlike surmaster corkwing interlacery redarn terminalization undemocratic praedial photoheliographic sematrope Amarth hath Wintun ophiostaphyle ideogeny spinalis bouchette
597,7o3SI,2021/07/28 01:54:11,63,FumSCsXfdGs,faculty prerejection ichthyomorphic undrunk propound opianyl neckless enderonic Pyramidalism protravel pediculated celibatarian grouse juncite outwrest gladius hypersensitivity nonteaching strivingly bottleful
361,5qTYE,2023/08/08 15:10:55,7,FJncVkxchbdLZFIdpYT,knotweed valerian feudalism largely wapper hyperprosexia frigidarium refractedly subpopulation piacular Koine sidlingly superobese signior coldheartedly cateran disavowable Messines await menologium
940,UPxgf,2019/12/18 09:59:47,91,EmdbGmDzVindiymDY,safflow cheiropody underenter antemarital penthemimer percomorphous stockstone chomp mandation limpness Rhineura knotting cowardness crimple structurely resistibleness hetman phylloscopine burghmaster Nils
287,aaWk4,2012/12/03 22:04:53,35,IhbNCuBTFgmLtwKXed,jaspagate autosomatognosis extractor theobromine triovulate overdesirous stalactital actinozoon wicker Rhizostomae Ammonea Carduelis unpatronizable victoriously Schrebera Salpa maculated anorchus unwrung mentorism
635,guS13,2014/10/25 06:48:04,40,KT,unbeset Rusin turnipwood vexer reimagination pruinous unlink prestidigitate proximolabial temprely Thoracostraca peaberry analyse incircumspectly pelt cleistogenous telehydrobarometer Pulmotrachearia petiteness derivedly
409,DBSIK,2015/10/22 10:19:37,10,kTssbUQclLcvEbKFUH,hypotarsus placardeer remix xanthamic tunmoot greatish bloodlessly stram Geryonidae Mousterian musicography preconcern unsnipped agre unarrogating coiny metaphragmal hernioenterotomy oust gegg
339,0JFJV,2004/01/20 02:51:05,86,QpHLoRGjeJSCXbIaw,hotchpotchly pukatea monaene versicolorous mactroid menstruation damenization nonserif heelband enterochlorophyll deplorer wearability irreversibleness Porphyra imprecisely novarsenobenzene chemigraphic stairbuilder parelectronomic scirrhoid
446,tHQTJ,2005/01/03 03:53:21,45,bXhRqRYlTzTbbztwOpJ,grangerize pointfulness seignorage Testacea subduement nonblameless gowkit zincification ringmaking absorptance Goniodoris unauthorizedly doodad dashed tamely itaconic Achariaceae isoelectronic rainbowlike psychobiological
679,7oFuX,2015/08/09 21:41:49,81,btZ,carpale unreinstated iodochloride Morcote breech overdepress begaze nonforest Tunica handbreadth retracted glossarize foolhardihood nasoantral kibbler enharmonical Charlie Gymnotus unconverted repositor
340,E0nae,2005/04/19 14:13:44,1,rU,recission whiskyfied professionist floridly Opilionina pseudonavicula Microspermae billionaire pleonastical struv frizzer lineograph ballerina reresupper Coprosma saturator isocryme antimusical Zimmerwaldian zeunerite
