id,owner_id,creation_date,count,name,content
454,O9R7z,2000/02/23 19:26:22,77,iPmNEJytZskaJpMwQLD,bismite bepaw shattering astatically nonrevival id serrulate epanorthosis warranter repiningly balneatory proliferate rewardless perscrutate underfurrow nematology venerate unopportunely lippiness plaudite
192,QKhg3,2006/08/14 02:16:10,56,GsIibpJONw,Solenopsis refer unsulliedly Cabirian redwing Fianna uncement restorableness tensibly sphyraenid humbler Christlike Doradidae flebile Shrove apomictic steampipe unprocrastinated Gyrodactylidae lansdowne
210,fJArc,2000/05/15 22:11:09,68,xYkYAt,pasticheur perpetuable floor relishsome lysogenic exeresis smolder inventer spiff wearproof flamelet edaphic petitgrain branchiosaurian Chumawi subclerk flayer unduteous darnation real
376,w5wG4,2014/02/16 05:04:10,67,nzKvT,unprepossessingness flunkeyish conspecific nonsacred sophistress mutely stilet alisphenoid pansideman unstentorian metasilicate ebonite twist polleten Christianopaganism hypomorph bicyclist oneiroscopist Septemberer procourt
52,XKbmU,2019/06/15 18:47:18,36,IJ,reassimilate octospore Takelma ensellure whorishly maledict noncoercive chaetognathous consentaneously cyath overfaint shallu episcopolatry Pythagorically assignment intradivisional bulla mantology hagship graciousness
320,7Tvma,2014/05/02 08:50:04,42,iyYPqT,noncontributory extratarsal epilemma infestivity Ashir illeck gastradenitis cibory rhapsodism taberna Nestorianizer wallflower agglutinogenic dislocability acetylate bushcraft typhomania spilitic nibbana masterfully
282,F2joU,2016/06/18 17:41:33,95,BREZbdhe,fliting margining ankylotomy plotter ephetae alec alehoof intermitter side aircraftsman overblessed fissileness campane Chianti trawler spearhead atrocious insectivorous antivaccinator myrmecobine
670,kKjns,2014/07/01 06:06:28,6,vLKxxO,blandishment Xenarthra reindulge amende precentory hemiacetal slangish latrant grammaticalness sirree Leicester pinetum dethronable changer neuroparalysis heterogeny unfounded ingemination spotlike Curtise
179,AuJnP,2017/11/11 04:20:51,63,AuGz,polyhedroid reargue pellety boiled sai orderliness callo Aloadae undancing aortoclasia antiscion uncorner pseudocarp reading Polycodium pugnaciousness aguirage naphthaleneacetic helioscopy palaestrian
819,S8M0a,2018/05/06 02:45:18,46,WfLBmIK,Brutus Vasundhara froom penguin releaser unseamed unfrizzy copped maidenlike unsiccated gypsophily lanseh euploid slingstone bacteriophagy stereometry sacramentary unsubversive semiorbicular interpretership
355,otdex,2013/10/13 17:16:55,8,OdZwGVrBDoT,Chondromyces phoneme whitherto driftland rhizophagous stiped disamenity decarbonizer amidosuccinamic waiterhood infrangibly tripaleolate foremention Teleostomi pellmell Graafian marconigraph steamboat superengrave calcareosulphurous
699,w609k,2014/02/23 00:51:09,58,GlOrLyRLjIrhLv,Sudani abditive apocalyptism noncredibility Petricolidae pseudopatriotic amirship Triumfetta casquetel boysenberry albugo endoenteritis gaus playgoing befitting locally intragastric underpinning Vipera antipapacy
739,U31vD,2015/01/24 01:24:48,78,XmSZkAkicgREcSAOy,grandfatherhood perquisitor flocculency pseudaconine sacropubic Avshar obliquitous luteal shawneewood motivate excursional anaemia langued enslavedness sciomancy sporocarp showmanism whap newsman unserved
105,pUFE7,2011/01/12 16:26:24,2,dOz,secretaryship photoactivation cancrinite Lamarckia Gaypoo hyracotherian Aphis Graham snoozer supercultivated proinquiry tomentum weekday biconvex conchiolin Euclidean abyssolith archicarp havenage decadist
766,X3ljd,2000/10/23 17:35:18,15,XvTRUmKT,Awshar unconvicting bromalbumin disprivilege pamphletize frontooccipital hexagyn prayful remaintain petrolic humblingly stionic Beltane podophyllotoxin preconsider endolabyrinthitis cobourg demilune adzooks latirostral
772,cHVXA,2010/12/09 09:16:45,65,PvxsAqv,haunchy oscillatoriaceous drumline seem trance pregreet railless dustyfoot foretopman lariat shagtail recoilment scup bewilderedness physiographically dendrobe Piarist suprachorioid diagrammatize cohusband
81,T0pjq,2014/09/04 07:24:09,81,oWbgsq,stuffing Pareiasaurus guaniferous palaeognathic superglacial myringodectomy nondynastic calamitean antilyssic monoculous befume Takao potpie kob woosh pangamous instealing Bantu leucorrhea poltroonery
310,Tzws9,2012/12/26 19:04:49,88,teSGzKg,befuddlement azophenylene exacerbate Xenophontean Cuculiformes monastically Taylorite vivid Raphidoidea allotriomorphic overcivil jackdaw workmanship gratuitously ann pseudotribal exode prosodiac heaper gastroparalysis
493,NzC4b,2008/10/12 04:30:13,30,DpeYjwKdTuHVMecRmuKD,foreconsider plumbojarosite hypotactic Tyranninae befavor pinnated oligochete interminglement hydrotachymeter Cutleriales chummage reperceive lazarly peltated furunculous glady cyprinoidean reticuled acculturate minable
594,gQOt4,2014/08/01 21:45:16,33,nPFjdGfHCvjftjWKVR,tumblebug moonsail mesem mumpishness digestibleness undeistical dearthfu zygite finochio autobiographically Murat oversentimentally mislocate adolescent unwillingly ronquil tickseed extollingly landslide entreatment
526,sYpjN,2018/08/03 15:18:54,78,L,imply coadjutorship pachnolite jauntiness oystershell holozoic trioeciously pinnitentaculate disingenuously imperviability Vice fastidium gritrock formy Cheremissian devilbird habitate essential unspeakability adjuration
775,q2R5E,2005/05/19 03:24:03,6,QcrdLBWgsOBjTvbQ,lowermost traceable Anisostichus pygopodous recursive maharani Rodney Dardistan reckoner polygonous thelytonic Provencial meated reina macroergate funereally newspaperwoman trichloromethane whand Saccharomycetales
161,XWjhB,2001/02/02 19:25:17,23,RLXU,nirmanakaya manliness carrying disownment bumpkinish antithenar illusion unfelted blanketed Unjewish precedented nontextual portentously internee ankylopoietic crinkleroot tactility Phylloscopus obsequious scraplet
6,oZQTL,2010/11/23 22:35:42,63,hDlnTNd,cacocnemia idiomology talus unhindered vesiculation apport Kamchatkan nondedication orthotolidin fringy abristle oligometochia hydrogenize taxonomic brunet unbehoving reasonably resubjection Keith deflorate
463,wJ4ek,2000/10/04 11:22:12,98,GGROgwIwjFAT,monastically Whitefieldian grift electropneumatically charmingness recant Heliogabalize nullisomic reticency upwhir mongrelization sombrero publicanism auklet sheaved disappropriate acetaldehydase uncradled angiofibroma aciform
365,ojSwZ,2002/03/14 09:49:33,40,TwIIMJK,Bopyrus cancroid roll precept glaciaria satyric Papilionaceae ureterostegnosis overcultured lore cinematical reticule palustrian hizz scuppaug overfertility dinnerly perineoplasty contrarational bejant
27,n8sKz,2009/07/24 05:59:01,74,swydQkOzNJ,saltorel mappy watermark counterpractice aquiform unclubby caseinate Bahamian perchloroethane quantitive leprosis alexipharmacum triskelion bronchoesophagoscopy electrophysiologist micropegmatitic arshine Avignonese globulysis typhlotomy
926,huZ49,2022/02/28 19:17:50,89,SBjZah,unstainable varicolorous resistance Palladian Stephanokontae monopolistic photodensitometer arrow amy emplastration gracileness Trifolium sacrilegiousness pervertible unclustered summital obtusely hypospadiac legislator archplayer
529,iRd94,2015/02/18 11:59:45,13,GREfiTiKmeEKTQ,brachysm Edriophthalma unformulable cloudy bradycauma Andropogon chumpish desultorious bodenbenderite peragrate nonpacific leviable Hydrocharis lyraway zygomaticoauricular counterposition spiced protoplast duodrama staylace
305,eaci2,2017/03/20 09:32:17,24,UGoGzfpSvtds,fuggy prognathous Meroitic anythingarian preacceptance marengo wedging capman prandially sprink style unioned plantership procommunist sovietdom basically syllabi pensiveness quotum iliopsoas
113,PIl7z,2014/01/17 19:06:57,7,evQdudDQAiSe,tumbler exterminator cholterheaded idiotcy hunkies Sothic nonmalarious unconspicuous uniserrate troubleproof ontologic horsefettler Octavius alike laparosalpingectomy trochiscation ironmongering rikk privation extramarginal
974,kvU9k,2005/06/07 20:47:10,1,DjkaoAEmMwbNLbCbWU,micrographic Physophorae sequin presumably fardel subdivision unlizardlike indentee eelcake brunneous diazotizability polycyclic lofty stricken unexpedient prothalamion allegorical tete Stillwater hexacid
876,t6PXh,2000/05/14 06:25:01,19,iXONb,thunderstorm reconjoin paragglutination Carlylism nonspottable dumfounderment encapsulate uninweaved endothecium caneology cauma enricher letup strenth largeheartedness tussle subaural sabicu conflagrative fray
660,7J3hY,2001/10/26 11:15:45,39,oIBtwgmHdwyDPsuqX,undistrained Myrmeleon jell swack cheerer intercessive Botryopteriaceae Euryalae perryman pointage Hysterocarpus gloating Marattiaceae chirpily wowserish saim glycosuria pretravel Vaticanize paletiology
117,riYAf,2003/12/26 18:55:24,48,jbvXOdqXaWKzLjoYUmF,genitorial unsearched doubleness Alexas implastic liana Carmelite bicapitate kukri hypostomous ametaboly proteopexy lustrative misreprint Philanthidae heptagon belash sulphamate neurocity mildew
650,cM8qn,2012/05/19 07:33:17,10,CoCEcxUiDCdWqZ,droll kishen sarraf nonpersonal worldliness astriction conjunctivitis Somniosus Orthoceratidae mootstead becompass incitingly unwattled plethysmograph remonstratively romancical dermatonosus outoven conqueress elocutionary
877,oyp8o,2002/01/13 20:12:19,74,GzkNnDtwem,tripeman Agrauleum homosexual sternofacial freakishly midland abiosis emporeutic semianatropal mac noncalcareous dermography owing Ulvales scyllaroid nourishingly nonmomentary consoling hastiness contemplative
307,GA12W,2012/09/10 13:46:08,19,MTV,Natalia furring unreversed paratonically nightmary bardcraft unprofessed Blasia typhlosolar iliococcygian brat anthropophobia murderment unhastiness apozema archaeography cakewalk macrostructural pattern cervid
121,auXPE,2023/06/10 09:08:51,14,LXfLVofHfdhTJF,theatrics advocate noncorpuscular gridiron bewildered tuition zoogonous exportable oxynaphtoquinone insuppressibly haft reincarnadine Mahometry remaintain traceableness supermoisten Gulo tarman phalloplasty insidiosity
471,DuwOG,2012/09/05 08:09:59,60,WacuSkgBRdrNylCM,tympany musculopallial cyclonal telethermogram trophogenesis cultellus macroprism paganishly underpresser agallop Ovaherero anorexy pearlet counterargue yeomanette troopwise sold eudiometrical hyenic phyma
288,2WC8h,2002/04/05 11:20:06,62,cfEtntqMGDjrLeB,spearfish lochage atlatl whereon Hephaesteum orometric unwriggled bobcat carnosine Pinales Gongorist dashing psiloceratid sursumduction clemently Sicilianism gastrohypertonic goyle cantatory trifurcation
448,KUBn9,2011/06/21 04:30:54,56,QJVvkdVKzbFmB,semivitreous dyemaker jurisprudentialist extoller Ricinus pale superstitiousness anker pule girasole sirenlike sclerenchyme remand geomyid ambicoloration nodical unconvert coyan pelean unwhisperable
80,GyRNz,2022/10/09 11:27:57,41,tZvUcizzh,glossmeter phenosafranine blazoner ovatoquadrangular macromolecule collegian calamariaceous shraf disroost sighthole Walapai purification pharmacoendocrinology phosphoresce entapophysis discussionism pansied hierographic intransmissible dissuade
696,JRQnV,2023/11/25 06:31:46,46,TBfJiBXLQHvDdgANxb,Melolonthidae mesethmoidal bulkish angustifolious singillatim quarry areotectonics Cactales diacranterian egomaniacal aristocracy gigantomachy endophytous Shelleyan ilesite platinammine sericulturist photoanamorphosis stonewort infandous
413,v5RCB,2017/07/02 08:14:09,54,GxiLBaqczPHMlxfjexz,ovoelliptic psychophysiologist polygynist baitylos landwire fluting interradiation protorthopteran picador nonhumus merse neurocanal inferofrontal outwale Luigi ichthyotoxism amicableness phytozoan ceraunomancy Dyotheletical
302,K95b1,2023/06/10 00:26:23,45,RnjVNbsUDxFG,telelectroscope terribly typhomalaria unportable pharyngoscleroma impel Lavinia metapsychology undaily inspan gaultherase Tarai truantly binode subindividual crisic palladosammine coeducate catalepsy unfar
500,BGgMH,2022/04/14 20:47:59,22,uVvD,Zabism Zelkova Aoife fiscalize bevomit gypsophila antiphonary nonabstention rededicate restimulate capernoited cancelment Zionite ravelment vinculate pyrogallol caber puppify unbolstered tautology
505,fJRHG,2006/08/05 03:48:16,27,YLsQHIxi,zooperal Telfairia unriffled radioactivity rouelle lightish tetrabromoethane axometry warmer shooldarry anarchy stiffen arsenophagy hymenopterological dactylion organosodium Gonolobus imitator chypre proximolabial
87,kEJXA,2012/12/14 11:31:53,20,VykuzKTbwpYsrVQm,voluntariate amphibolitic Erithacus monomethyl bettering amyl exopodite Caribisi Heteropia spallation palliopedal testudineous Phaseolus epicondylic draggly diallagite monoverticillate colyone squatwise cremor
165,0Sx8E,2000/09/23 10:32:40,67,alAdGJVVkC,tarsi ungreatness blastodisk Galbulinae tigger broommaker diphyzooid densimetrically solicitous stichically goggled modal kinetoplast stomatoscopy interminable suppositionless yoy euxanthic cloyingness superugly
107,wcjSf,2021/01/28 14:51:32,39,TAVY,nonteetotaler Biblicopsychological upgrade overpowerful megaseismic flusher namaz Phegopteris absumption unresolve dynamoelectric milkeress aftercome reaffiliation causal ballistics readaptable fetish suitoress Zolaism
191,uvLuG,2020/11/26 00:57:23,17,QFeOPhBYaWo,preinsulation myalgic tricosyl unsatiated noncriminal bourdon graduate dilatative creosol bournless preidea brosy dingo outbolting parastatic tranky fanlike chloral Clavariaceae branchery
112,cFSAU,2009/06/02 23:38:15,35,WAsN,ahum sirih pattener pelorization sluggard superagency megaphyllous triforial intercommon kraurite steatocele semiatheist Sangraal shelterlessness caroler eschalot adultery pollinarium unendurable Petroselinum
901,NRmGe,2005/12/26 19:47:09,8,ZHSctjfbJ,emerited parageusia celebrator cloudscape dreggish craggedness upstick eupyrchroite unhelped antipapistical acutangular ridgy pyopneumocholecystitis unsuiting columbo differentiate folklorish inaccurately holla ressala
593,ZEbL5,2019/06/18 06:18:12,9,qJWLDNTJRhx,Claosaurus gastrodiaphanoscopy porkless periblastic outfence pyromellitic Babylon Miek cecilite galactan hexadactylism earthkin confident disseat unpremeditated spadille Manettia gemlike familiarity migrainous
542,y2jHY,2009/06/07 20:09:36,45,pInipDUcrjUa,stellate quarrelingly saltary trophochromatin ultrarefined paetrick nonepicurean neif nonchokable jolty amphicondylous characteristicness te barricader landwaiter croy kuttab cystoproctostomy unhabitually extramatrical
535,iAW9R,2010/08/03 02:32:44,26,UVQOBudGmRUnwHX,melt strappable gnostic excrementitious induna squirage stade bicollateral bogglebo unsmoothly sanability unwished unappreciating Briggsian Oedicnemus saporous vermiculate bobbinwork emancipation subtercelestial
849,mU6QZ,2014/07/08 22:05:46,4,ZwtJe,tossily sleekly serphoid phosphoprotein skeletonic wig subglumaceous inodorousness substitution squeamish sarcocyte begonia brombenzamide Mohammedan uncompassable dirten parcelwise hewt barkhan hydranth
170,2sl6N,2000/10/10 17:32:01,28,itAKVuJLDqCP,desmon dissent epichoristic endogamy quercetagetin saint perisarcal ginkgo solidifiability bushelwoman ambiopia uncoatedness ultraviolet Basilian classificational leucaemic startly perjury woolsorting beworm
426,igfgy,2007/06/09 07:40:33,1,SvdyIYinRlVZ,pitwood underteacher reimkennar Trochili verrucoseness extrabureau prealcohol neossoptile posologic impetiginous phrenomesmerism disclaimer bezoar Lonchocarpus batsmanship discoverer undisturbance throatroot supermediocre gillflirt
341,S72ER,2002/05/04 21:36:39,3,FsC,appositionally gnathal choloidic rowdydowdy intertessellation coarrange provenient unmodern authorling Orotinan protargin framesmith Neotropic Diabrotica overfrail surcrue abdest tavernwards sledlike Hurf
323,Nsqho,2018/10/19 05:12:34,89,uVVoUVcdNogSWOBb,unpenitently calamitous bagpipe owertaen sacrodorsal curly moorishly asparagine Euthycomi shipbreaking conservator cell everduring proconservation overmild Bram unaccented mazic prophasis nutritiveness
685,7EkwK,2002/01/16 19:51:50,9,AAGUNXAx,unresty serovaccine monoganglionic hogsty phlebostrepsis pollutingly misapprehensively picotee dark croupy oecumenic handreader normocyte nonassented abranchial spoiling unsymptomatic ultracrepidarian halmalille tricurvate
443,1bTeY,2001/12/24 07:42:04,70,K,reperception antecedence encephalophyma Hienz protistan tuck ravined genep wheatworm pyeloscopy Phytomonadida everyman spatulate revery neuropodium humoralism sodomitess introspectivism myolipoma tradeful
278,4DS5P,2009/02/25 11:16:12,62,INArobiOAsVrIJi,augurate retrojugular beseechingness tintometric buccan recanvas birthstone causally neurectasis nonfamous amical Triangula zacate metatypic auxetically fozy quartet Brontotherium dunghilly dimps
954,PfkHH,2006/09/05 17:29:30,54,Cv,phlebolithic zemimdari phrenic boppist metachlamydeous beatitude bigamous prohibit cynocephalus Gothlander adaw cinderman mussy undeservedly interfering incensation untumbled resorb hoisting inarguably
603,HbwGC,2013/12/28 12:15:29,71,KTUBqMD,coryza leden disaffectionate meconium declamatoriness thimblemaker fontal hartshorn anthranone Transjordanian gonochorismus sycophancy lithoscope southern adstipulate relock sistle vegetationless opiner unrefunding
941,A1IFd,2014/12/09 07:14:39,15,ZZKdpRaNEfvecuos,cystomatous Samsonian atelocardia nizam semiconformist taller spiriferous bely infravaginal oxozonide Kyklops unjokingly fierce wadset fogger omnicausality taxlessness rootstock controverter mnemonism
516,9YdqK,2003/02/04 10:29:55,22,ZzxbRJKeYVJhZIXvLS,outbreaking reciprocal spieler proarctic fisheye ornithodelphic predictability uningenuity Wormian jibby nucleal Perisporiales pleniloquence spreadingly encash chattable worsen trichinosed intrapsychically bituberculate
558,g4wts,2003/06/23 11:01:40,28,TJMDatPVULDbVKVOV,nematogenic melanophore dedicative eavesdrop specifiable Jule dianisidine unpranked twoness unvalidly pussytoe unbutcherlike propylitic phytotopographical gush glossolaryngeal hydrotaxis santonin truff prison
611,24ZkO,2020/01/06 07:03:38,99,RxnWWudcAWXsSCjwKA,recission sphincterectomy backswordman bestuck skippingly uncouthness cantabank gillstoup unubiquitous astrophysicist podophyllous slitheroo porr unapprehended periomphalic dionise servidor disconula kitchen cynipidous
567,68xU1,2004/12/18 17:16:41,83,ntcvDufQFNbpFgyAqcbn,hiatus uninterlaced fizzer acclamatory unturgid tabulator elucidative allgood Shakespearean Ovambo unprincipledness papalist strawen reasseverate impermeability revitalization provisionality despotically teras alsinaceous
902,fckMQ,2018/08/14 05:57:30,17,JRjPEilwbnYSvAarNREI,drafter paravane overspeed Talcher turtlebloom koombar unstudious Madagascan sententiously archprophet sweepstake fickle meekling sanopurulent unwish Ceratiidae decalvation crioceratitic sebiferous miasmatic
675,AfzkG,2006/03/03 07:22:42,92,dbc,Russ ratify steepletop pharmacite archrogue bombiccite inversely secretagogue gateage stunty esthesiophysiology Rhodymeniaceae knightage vindication conched postfurcal coleopterous rattly Canaanitish khedival
629,a9pbz,2009/01/16 14:07:45,47,BTD,antiprelate prorailroad Hansardization harrower womanproof upways coccidiosis flossification antagonist sensation chore gutturalize isinglass pilocarpidine beerpull inscribe warriorship Monticulipora millionary pseudolinguistic
283,wAmCU,2009/03/17 15:12:22,91,jCSNHJVtBRDM,Arenig calcicosis thyreohyoid unheaven Branchiopulmonata microgamy palminervate Erwinia conversable Lasiocampa mistrustingly silver diglot eared starlet superstitiously anabohitsite raptness osier nutritiveness
917,hUgjq,2013/04/19 20:19:03,69,VCiavZLvgXFyX,yarner moonscape bewall petioled fibrillated abandoned display bogeyman dote Lentibulariaceae archiepiscopally evanescently pimplo feracity execration unilabiate icework trotter siberite repiningly
512,x6mAf,2000/04/08 04:45:05,49,OYnQDIC,spillet fascis unornamentalness interclavicle pignoration superinfusion naphthylene disgarland pleuronectid tenaillon splendiferousness compages basaltine noncorrespondent traitorism somnambulic titubant meadowsweet temporariness dratchell
485,DLXgd,2002/11/07 03:10:24,9,tqb,labiate despiteful eyeleteer schizonemertine Ashkenazim ruelike mutilative antecessor interlucation demented craniognomy acrobatically Limnocnida trochiscation Boxerism urogaster racemocarbonic litchi cobeliever granulitic
327,mdngR,2014/09/14 22:33:23,5,MCSvFQouAjcW,jaculatorial Zygophyceae scrutatory motyka orchilla Thalassinidea glancer succotash abrogable longeval kor permissible clavicle rampike pyrolatry ochlesis feisty paltrily sacktime unleared
989,ilUvl,2013/09/25 14:20:20,10,wuOak,antedorsal feddan Agudist polyglossary shed noodledom unbetrothed cheating acetoacetate prefervid coralliform unpillowed amphistylar cadi physicophilosophy ectocarpic baboonish controllability Gegenschein resolutioner
227,5lsrP,2013/02/18 01:03:39,73,Jlh,Italianize disburden coinherent bumptious dissert fount Falangism laryngendoscope book semiconscious extrapolator nuisancer Baku reticulated tyrotoxicon hypercoagulable metaphenomenon unbeing knife submember
69,sPcmM,2022/03/20 19:16:34,37,ZngZKOFQPxBENlqkMaO,anapterygote consolidator mutation Achatinidae geggee trackscout maral retractive heal yesterday gabgab dilatorily Connie crustate extramodal sallowish tompiper treatyist planation Holostei
216,Sv9sw,2022/12/22 08:10:28,38,mudcXUBx,otocystic incurvate sloven Anatole cumbu Ancylus dapperly precorrection gercrow Epacris philhellenism expective unsingableness disingenuity fe gramashes psychoclinicist bebar suant Scots
507,Hy4hB,2023/11/11 13:42:22,96,vkKwhxApIes,depilous uncongregational Madia pertinency autoeciously pineal interlamination decanal crudely supersilent remagnify disenable hydrometrid Celticism dairymaid monody diethylamine compulsion rehale shaftsman
39,yIYws,2008/12/15 14:54:54,7,JlGaMQmXygYwF,phaneric Xanthorrhiza untwisted Ollie monostrophe abscess fi mustelid marteline goetia osteochondroma apostrophus odorousness quadrantes Cuzceno unruptured sparada Heterotricha keraunographic undoweled
760,U3kyr,2013/11/10 04:40:23,52,fM,archwag trimuscular superindustry bemartyr amplificative aristolochin lippen Paulian untraded bustler indelibility derange nonapplication unhealthful lithotomy larviposition helicoidal phosgenic umbolateral unrectangular
943,dOZsD,2014/05/24 19:10:29,22,GLcceMpIBtuSCL,lection chabazite cinchotine wheresoever prefulfillment septempartite gumby Ochna luciferin unpartook zootypic rugose intransparency threadfin cadus jewellike dismount vicissitudinary exclude bunyip
728,R7tcr,2013/08/16 15:21:43,51,PxrZDSneVHtnswvyQ,trend diipenates uncommunicated faradizer struthioid achroodextrin irradiative Himyarite fumarolic commercialization undaughter uncluttered Scandian pancosmic heortologion streite cocoonery troparia modalistic overoffensive
406,rTwix,2016/07/13 04:38:22,85,KHlQS,fantast physiopsychic Metridium yeasting snouted visitation chuckhole lunchroom habenar stearoptene brompicrin equidivision elaborative morainic overstridently octoploidic upborne intrusion barajillo heptameride
937,3oZQz,2018/07/12 23:21:55,43,pnKsNcXX,idolomancy carbodynamite kana Saintpaulia cytolytic bathythermograph hurtless sauty epiguanine tautog visit unempirical strumous uncaptured monimiaceous barilla gastrolater unharked Saturnine troparion
145,cRLNC,2000/07/06 00:12:35,68,dYKDxnuQrqqOJio,unmatched misjudgment whitehawse bassie locellate niggerish pistillaceous charlatan riddle calicate imitate entempest biovular megalophonic Xenarchi Nardus rambutan archostenosis townsboy unreplaceable
293,G24x2,2010/04/27 02:10:08,27,SOAg,randannite unflourishing caduciary incoherentific nothingless Eurylaimus thinbrained nonempirical benzophenanthroline feelinglessly tactic iteratively aerological spiranthic Ceratophyta worsening unimmergible tinning anisogynous hexadecane
918,qeBn1,2002/07/13 05:39:23,5,eEcFKRfAOTTWzoJzGeZ,reconvert merorganization morbid Lamaite coyly sway lacewoman metapsychosis phenolization syncraniate colportage outwaste hyperelliptic mucusin intoleration bipeltate alternatively abthainry paleodendrological harbour
613,8mqEQ,2014/05/17 11:00:39,68,VrufnPwh,starry precentral enamorment stinkingly paucity pigmental subturriculated betrunk faceman amenorrheal dungeoner Cleridae incongeniality thoral helmeted pelorus personifiable nutting maintainor crackdown
878,FogZP,2014/04/26 23:22:53,66,lBrxffQXUzn,caffeine brickwise springly Appomatox characteristic acholic choroidoretinitis aliferous heteromallous deputational pharisaicalness pseudodox Sabbatarian aftermast monosporous palankeen detestation arefact profundity chipper
683,1tB5M,2007/08/09 00:57:12,56,iktWAiTUNsza,circumlocutionist unalignable piscatology pitching climacterically forestless uncollatedness Guiana lysogenesis inconfirm dribbler arriswise infecundity Sudan osteogen collocate barbule vestrification contractor hyalotekite
511,qAGpi,2008/01/03 01:43:16,4,CanUlPsEKLLFG,constitutionalism scoot cultriform imparisyllabic torcel dessertspoon biogeographical semiprofane levulose Nearctic amove hepaticogastrostomy protorthopteran technolithic extroversive Balmarcodes outspurt porto evanescent validity
560,DW04s,2003/07/26 21:17:58,36,rsqnJKULR,heelprint recrowd raband raftiness magistrality lichenize esthesiogen sebaceous florist audacity preinaugurate hypocleidian knubbly cyclonoscope patte antialdoxime alantolactone thorianite instance Brachiata
429,stcuj,2018/12/02 07:36:53,23,wJiJjHtnDWqTEaYu,fakement branchstand takt preceptor gustful etiology ultraprudent retreater synechiological paraboloidal contentable repandodentate sebolith unpercipient untrotted depression dankly sidewiper cururo shoji
322,oud3W,2018/06/08 07:30:48,88,pYzVdOQsAZiVnxQOYHwY,cresolin planer Scotsman halleflintoid humanness binate oxaluria turnable overblaze colyumist maycock podarthral recompletion theophylline Malacoscolicine uninfinite revive Vepse overembroider proacquittal
