id,owner_id,creation_date,count,name,content
224,0dvMK,2007/09/09 08:34:43,62,vlCGVXlGfU,boiler unbelief validatory metamorphosable puddler theological Koran iodoethane exorableness jailhouse nonreprehensible polymathist Swinburnesque serous stegosaurian overstudied precaria bayoneteer pistolwise theurgic
556,t3SXs,2006/03/01 06:18:23,35,tN,foliiform maternally centralization nonrational anapneic suprapedal Protococcales zoosporous exam lamentful cosmic empire Hippodamia unthwacked Gallicolae handed Shintoist acetophenine discussive secretaryship
284,UX9P4,2011/12/02 09:58:34,22,WFZzyGplwztWjmIcmd,rectilinearism Holognatha cyanephidrosis bicorporeal unbaffled Demophon Cismontane icy abator cauliform pentaspermous giffgaff Anthophora anility transincorporation lantaca tasted dehumidifier orthograph bingo
434,24lUf,2021/03/19 19:46:26,13,UdfzcSaHbejRiHtiGZcH,macilency fiendly top unblamably zygophyte tater reconvict nonrepresentational Cardiidae monochlorinated pseudochina keraunoscopia unperformed polyandrious uptear pantelegraphy amherstite betainogen machinoclast eustomatous
861,4jsAm,2023/10/02 21:31:39,87,xBYghreJspQVRsKVO,unenterprise sinnet setal classed dugway phallephoric undodged Buddhist calcareosulphurous morcellate bandcase waggishness palmilobate zuisin Cycas kitcat severize pinnatilobate dividableness patronization
67,y71dL,2012/05/25 08:02:07,71,qYbeZH,alterably jab pretreat demipronation draughtmanship wheerikins fleshhood melanuric baggy leptocephalid ochrea invultuation nevel synchondrosis cropweed inuloid snakefish princehood presuggestive Sylviinae
619,jhSby,2000/03/06 09:49:17,36,FQT,wandery quizzical molybdous antiprelatic isochronally turbescency rightmost fourcher despondent ethylsulphuric plagioliparite unhistrionic clarinetist attemptable ligation nonpatentable hermaean horreum dehumidify matchbox
221,Mmw6R,2001/03/09 05:41:09,98,ldIgoAC,essayist prairieweed slighted bejuggle Carry trackwork outvigil strouthocamelian Babua prionodesmaceous uncountermanded onycha reinsist mastodon aslantwise hospitage fust Calycocarpum overbranch deambulation
194,g7h19,2021/06/25 00:27:06,6,sKjfJzggOFKZ,subchela jarry Manasquan counterdike defeater renounceable sure fogginess Canavalia pyrosulphuric nonoverlapping snail micropyle tamein soliloquist unconceded quality singlings takingly archbeadle
166,cT08d,2007/11/19 20:08:50,47,qfFNThlXYaNBOLLgYYK,tressilation supercarbonization possessed Jacques pelycosaur sasin ovoviviparously scote platinichloride chokidar soldan abulic ohm Tionontates ough sanctified mountingly conundrum aqueous hospitious
2,Ni9Fn,2006/12/19 10:38:09,28,uShAoulmfnGFvZkP,Tennysonianism Reduvius marrano Uta phantasist bryologist souser devoice dancingly Tulalip tangent Guttiferae lymphosarcoma undisorganized recesslike contratabular intradistrict chemicoastrological wreakless trinomialism
537,Hc850,2019/10/27 12:12:35,59,aaUMTNNnANDrDWpGVUv,antecedent porchless sheaf whirrey reductant bleeder unprecious Moabitess Micromastictora pancratical pathologically spasmolytic unsatisfying Cointreau profligateness preappoint Niobe ledging jillflirt ingrown
257,eTu4S,2015/11/16 06:25:19,87,tSPEbGnRqjDkZNClf,revengefully surrogation discalced archangelship insensibly interlocation inwoven meatoscopy whitewards siping Geissoloma preinvocation hoppity subproduct reattachment balei heart Euphyllopoda resend seraphical
110,sVqGc,2021/11/02 10:44:49,57,iqNmHSkll,Szekler swartness carnifex tonsor retrocognition kittysol trimerization Nyctereutes laterocaudal phragmocone bragging lapidescent extrinsic inconglomerate hyphal leep fossicker epicranial venosal schoolmasterish
457,ENcdT,2008/05/18 09:15:54,36,SHGrRftUkhXGTOHYC,anthranyl Elaeocarpaceae refractivity jargoner motor microgram niter antifogmatic whitehawse asearch summarize polysensuousness fuchsinophilous Gristhorbia objurgator splay notoriously pseudodiagnosis subdivision ocotillo
610,zNVUR,2018/12/27 05:38:34,29,yIvGkhUakkxgMj,pseudocelian polymorphy trochiscus stof ureterolysis Matawan chamal unmutated roentgenograph presentationist plantular physiognomist traditionalistic unwaverable angulosplenial maltolte twittering planiform possessingly hackbolt
624,VaTHq,2004/03/15 05:09:09,57,jWQxXokWWV,sparth Dyotheletism hyperinsulinize commendation Sisley unpardoned eponymize unbitten recreant wuddie bellicose coriariaceous vegetalcule leukotic begrease chafer rebroach vowmaker windfallen undergarment
534,ZX4xb,2021/09/03 15:23:11,18,bjMqKuNufpiEkYs,unown prewhip byrewards menorrhagic Marsdenia humeroradial endopleurite fittily pavan minge Scenopinidae Nopalea Scotticism compulsatorily habitability radiable deucedly pantameter indecorously derangement
296,hLAnX,2018/05/06 01:59:31,22,MkUxXqkJjKDbFvWKsk,allergen Sam nonpartner abbotship nondeliberate ciconiid Johnnie externation seropus euphuistically evaporate bunsenite linsey ecostate hypnotization subserviate tracheoplasty unprudence aedile beseemingly
697,RexPK,2020/11/20 02:49:06,62,Uua,remedial conoscope northbound grainways helicoidally aquarter lakish skeeg mumbling gametogenous Lemnaceae incandent hysterocatalepsy Serendib pouringly Corybantine prefertilize precollector Zipper spaciously
562,lZSV0,2003/10/14 06:27:49,68,atSJry,degenerescence arsenite rampage mandarin resacrifice pseudoscopy shown plotlessness fluidal crackable vulsellum angiocholitis ethylenimine parasitically immobility trepidity Dinoflagellata Ko pathomimesis hearthpenny
37,151n5,2023/02/07 22:03:22,42,hcCNxHlZSVYbgjWUo,diluvian enhearten pure matchmark outplod thickbrained hypural innuendo illiquid photofloodlamp muse Pagurus labioglossal sonar supplicat unfluttered idolatrous excitomotor member Maimonist
931,SZwXt,2010/03/24 01:39:47,42,aAvJga,language suggestion contractedly hotch Vistulian scabbler marmot somatopleural plastisol elasticize celiectomy skinflintiness incommunicableness anthropomancy reallow obesity Vedist auxiliator necropsy Tunicata
102,Lu9JO,2007/02/05 17:28:15,4,ZBLcjOlh,doggerelism matchmark inexhaustibly coapt immorigerousness primerole pyroglutamic hyenanchin oxane slider unhastiness asterospondylous Arundinaria ruffin narras milleress unbed thwartways semipervious dejection
452,Bp53x,2000/12/08 08:41:21,28,NsRgcOFOZTQdGlZ,despecification bredi unnitrogenized homesteader smithwork pauciloquently antistrophize overconquer elongated duller defluxion Ottomite continuous Zygnemataceae orthopteron sexto impedimenta unpaled moderatist unwatery
964,CWk9a,2008/02/27 00:26:28,40,wsYRECY,pricer fin thirl undersphere kelter tilde Cantabrian homolography Chordeiles secundus transpersonal sicula Allosaurus surdeline dendraxon stalactic radioscopic rect condor whisperingly
538,cSTF3,2002/07/21 12:54:42,86,APSMLhWcPZgNFzL,tocometer disgown Katsuwonidae demicanton suspensoid assort waltzlike overpass mystifier Christmas chloridation belonoid northwester unapplicableness inachoid fibrofatty creeshie bonitary lipomatous departure
585,HxIaf,2023/04/06 17:49:20,4,QaxvVQDX,dottiness reaccustom concamerated overbrilliantly apriority vasquine hematodystrophy tributyrin primitial asparagic arche labdacismus kuba sotnia enrapturer rag cystenchymatous tribunitiary curlew musquash
487,FNGwZ,2022/05/07 15:42:16,98,OGkkDZJ,Wochua rotundity sending noncapsizable pentanolide geldable exteriorness noop cho unmistakedly alameda venthole sulphamide oikoplast oncological Sunil carbonyl trigonid bejan brocked
272,gl2fQ,2017/03/19 13:36:43,91,GhLp,auriculotemporal interpolable safeblowing ranging fraxinella reinvigorate Guillermo overcontribution nonthinking merriless hyposynergia Shoshonean antepredicament jug jargonish ungratefully meadsman bluefish tagwerk unkemptness
256,xyVxd,2022/07/13 03:26:23,47,kTlxaIRZjGGQlxiMF,embank lobelin thyreotomy occurrent acta unite befortune parentheticality semology summercastle postjugular Russniak twinemaking spasmodicalness iridescently stercoremia silverback macrocephaly soco unburstableness
141,lypfP,2002/12/05 12:47:28,77,fxJZrt,plethysmography unstunned wren boroglycerate clupeid pseudepigrapha deodorant lunular invalidness fluctisonous liquescency gradualist hypermorph dermatorrhagia considering humanitymonger pregranite nowy afterglow Sarcocolla
130,9qZlB,2004/02/16 19:23:01,68,EcPkRhoDThSPaUF,dotation nonfaculty shellflower antiparagraphic auxochromism hebdomad mitigatedly inconsequential wit bilirubinic kipage hymeneal tweeded laryngic articulability oligotrophy mediatorship Scutum antichretic uncalendered
281,MsGbJ,2018/07/26 08:30:31,57,spX,gastrin consenting Bacillaceae unreprievable hepatotomy zirconian campanistic cluck frosty meddlesomely brunetness tobaccoweed behung seastroke herbicolous extracurricular smoketight cacothesis nonabsentation deferable
922,NvF7N,2016/11/04 11:27:11,96,NaBKkjQCCwskfonS,photobathic wheetle terracette lout bronzewing primevally xeromorphy gringophobia endbrain nonspecificity broguery superspiritual peripetia unarchdeacon toe inalimental eating chid misarrangement saprine
41,6DAzL,2003/05/18 23:46:45,73,ehBmJI,pylorectomy skunkweed unwinter Germanism countersignature fearsomely scheme myoblastic tampoon vyingly Plymouth loggia Lophornis toxogenesis unnebulous unordained unhaste glossary Zend absolvitor
749,70dId,2001/03/02 19:44:19,50,PjqYekLXLNp,globosity superintendency natter rhetoric nonrelease vasculomotor lipomorph lamentful tricephal Asterozoa thrasonical presuperintendence unequilibrated unsuperfluous amusingness semihyaline gossard samaroid lapsability unguidableness
649,neA8a,2008/01/25 00:41:40,42,NeKcUMeCebm,pleuropterygian unarguably prosenchyma timbrophilist wore valet plagiostomatous pluteiform mataeologue nonsecrecy unket foldage parrotism yellowseed disbenchment hormist monkish flagrance Panathenaean encephalosclerosis
277,XolmM,2007/10/14 09:29:18,47,IUyoLSmylTMLeW,eastmost cookout impanator autolyzate teleotrocha regrettableness gobernadora shavester papyrographic transpeciation botella guidable Kalekah alviducous predivider sphragistic safflower quarriable pensionably Ghassanid
589,fdsER,2017/05/05 14:38:59,96,bjb,parthenocarpically Bantam niccoliferous connotative asshead upcity fistulatous ineludible hexameric inveigle unnipped imband protopatrician gemitorial mesenteron bountree cardiac aviatrices scalene electrographic
596,DTsvs,2006/07/15 16:35:07,65,bMRiudAqiTxKlkB,ruelle podophyllic instantly Sabbatization aquacade blaver suffruticose railroad spoken overlisten wirespun uncarnate unforgettableness overcast cutlips bathythermograph parabiotic pedagoguism neurosyphilis vixenishness
351,9CdpW,2013/01/07 21:04:15,45,HSZhBudodXXphAJYkQmd,comfort partyless shambrier Malaclypse Tephillah lurid Hieracium behooves satrap kleeneboc excitingly disseizee invincibly verse grammaticism precolorable chorization alveole potion armozeen
42,ilfTq,2022/08/15 06:27:45,21,PAsvJImCXUPYE,dally manganophyllite mathes gastrulate loggat diodont victimizable sigmoidoscope Pythonomorpha formatively flyable vampiric conarium bushwhacker Gasserian pleadingly rotang picul digastric refutability
90,uRxwP,2005/09/10 04:25:25,57,PDQeXpvlfNBtEbq,monochromy monodactyle Homoousianism censorious cockneian apomictical intoxicate theodolite rompish powerlessly intermetameric depersonalization sloshily angelique bourn saffron horologe bepastured dolomite rhesus
456,W3WHL,2010/02/27 07:42:59,27,BSZDBCBnav,bellflower unmistaken rimu sicarious wilder correctress amphodarch cystoepithelioma Carida incomprehended biliverdic hyperprophetical reciprocity graphomania jerboa progresser kakidrosis trithionic purplescent geneticism
304,7u06k,2002/07/18 23:56:40,15,HRNzjkXnWWYOve,statesmanese overofficious accommodatingly dotterel jugglery outspeaker wheresoever rattlesnake minniebush wapacut decennially Somaschian crown keck stend adjacent Wedgwood boobily bergalith adulteration
890,fXBWr,2018/08/04 04:50:07,71,rkYdKFQrPojkBuxnXW,prediluvial thickener holdover ossuary neoterically euphonetic rote agricolite renumber apothesis semifoaming assemblable Scleroderma chirognomically goldbeating hectorism objurgative Cynoidea bedrowse thoroughgrowth
382,eAel9,2003/06/04 15:33:42,26,HhAkLqdPd,pemmican tyrannicly awber alquifou rolled bienly addlins Jiri orignal intermeasurable nicotic Phocinae undoubtful Sibbaldus fruitlessly incompressibility dotage hystricomorphous volipresence jerk
960,jERl4,2013/08/19 04:56:42,75,W,opinioned semicroma Acmaeidae safen unfolder revisableness apellous offhand inken urbic goosegirl geomorphology intrapsychic atterminement tuberculoma foppishness Conjugales frontispiece polyemia basiventral
138,FF37j,2008/10/16 21:19:17,21,HqVpNXxcb,atrophoderma undercarved reachieve bobsleigh oarage Peripatopsis Billbergia subcashier scissile trigger Verbesina Parotia ambrotype undesponding heptastylar contented paleoclimatologist enfacement uncomprehensive tubage
661,QMAYL,2007/10/18 14:45:37,28,qw,cauliflorous teewhaap attrited quadriparous tusche amphicarpous undersward hypophyllium tarantass spiritize unperpetuated worral Eozoic structure inextinguishable heartwood dukedom bedstock quinoxaline unnation
983,G91ax,2008/03/16 18:16:51,41,KvUTNjZhkynW,interreligious irreconciliably blesser frieze destructional Hibernic Ponera Cezannesque pancreatorrhagia unblighted anisanilide endoscopic abscondedly benightmare Migonitis genuflector linenman somewhence macrophotography leaf
743,sFseT,2000/12/15 20:02:44,100,yVTfr,mystifically dollop crater perisinuous gonitis Heterogyna overstatement neocyanine Schistosoma maya ovalish callisteia forsooth dier mucronulate duryl Kerry septatoarticulate pregust arrayal
949,zgZrY,2010/11/25 12:09:57,50,mWhGNrQWvahXZiOba,overlain interpolable Haeckelism scruft semioccasional nonfermentative spellcraft dibs besugar trackhound vasopressor disshroud pathosocial entarthrotic unpreventable forefront uneffete unwitty forayer strix
432,G6rip,2001/05/02 12:08:48,99,djSDyhIHXxuVFAF,archgod enthymeme nagger unmagnanimous unduly undeterminable unretractable ischium chastise knotlike him cochief derationalization palberry alliable soakage sniffly paronymous impletion sottishly
627,nWMCA,2022/03/16 08:40:43,42,KxIFgv,Artemision serfism cavitation Shasta prevertebral superillustration inanga consignment daydream superhearty unauspicious perineoplasty hyphenation Tamul brachyure phototelegraph bulletwood anomalotrophy mormaor malappropriation
201,ItvjR,2023/02/14 16:21:01,39,ogrTFolTuc,astraddle cottaged chaffweed shelly Lemovices Filipino noninternational recage wearisomeness plecopteran interferingness oneirology predecisive earlike Heterodon dromos household maam Eurypygidae dynamometric
854,DyXK2,2008/12/11 06:52:31,15,k,avifaunal counselful mumphead scampish inapproachably tetraedrum urostealith syconarian putridity dain hemibenthonic ultraphotomicrograph oidiomycosis unidirected tetrolic unmaimed sourceful chokedamp metaphrast landlock
768,DU69W,2004/01/24 21:02:04,9,wsabHyZwqVuaRQQhV,ctenodont renascible aweather flexuous rebukeful degenerately segregant smudgy marrer supersaturate pulseless disentail atony beira Gadus apitong gambeson diviner rankless breastplate
668,2LU6Q,2018/11/02 03:11:43,58,tuiHH,pinguedinous unmailable staker palaeoglyph millage balsam bloomery truckman luteous inconsolable haplophyte monotellurite tabulare beatitude retroactive pacation science strontian lickspit stalking
93,bCxik,2002/10/06 11:38:48,18,oCjrkxopk,sundra recapitulatory reinflict draughtsman dynamoneure intracutaneous spuriously cyclopia prejudicial cryptesthetic averruncate unregulative exotoxin affination macroscian underbowser cawk reinstatement jasperize unlighted
810,1ZWTg,2007/09/07 11:14:05,85,dfOjYtpdxB,unrewardedly siphorhinian constitute ruckling bridoon sirki louchettes tautomerize paradoxicality Monozoa notandum moonshade colonially lorikeet deurbanize hyaenodontoid fungology midparentage stipendless Caingang
232,Zt0XU,2001/04/01 18:17:58,22,rdhaLGrbiINEXJSAux,isographical unwilted nostalgy benzylpenicillin placoplast pteridoid myelination silhouette typologist uncredibility agglutinogen dielike frameable labyrinthian postique euphemiously skiapodous upboil amyelous urosthenic
280,iTGpY,2011/12/27 09:43:45,66,suTlEa,tenebrousness prenatal excavation fallacy stinkbug Phalangidea sprawl pharmacophobia philothaumaturgic bortz impane ardella besplash anaerobia silica halliblash gleety chuckhole chard entail
274,FpiJk,2009/06/18 08:11:28,52,KMVPZXjQqfEfvPMZMK,goosegirl aromatophor clusteringly pyrheliometric unlectured homology dermatoheteroplasty monoacidic togetherhood circumposition messin turbanless equiparation pseudarachnidan tubule caramoussal unbless storyless annuary macrogamete
158,XnTBb,2018/01/27 08:55:01,54,vlSabK,Nisqualli unhardness daubery undestroyed napoleonite apeptic Bernard electee backless alangine obtusifid congressive ominously bonification swordlet aeolotropy taula branchstand stuller canthectomy
883,T3twl,2016/03/09 04:17:23,44,rfwlNvLh,nonmarriage anthodium whitefoot sulphoindigotate accountment protocolary casuistical postcephalic vapidism tasimeter Thersites forewaters steampipe bath alligatored inapplication pyruline interdictory kopeck lateen
490,IHDko,2018/09/01 12:04:33,13,bSCzWOXEflsSIlkcr,sarcastic overfasting stereochromatically coredeem succi connatal mortise tetricous triaxon sidelong unallegorical oxymandelic envision axiolitic Maecenasship joskin bookless degressively unsymbolical noctambulist
880,ZuZXc,2006/07/07 21:41:17,76,VMLBboaxHiPMDElvTwQR,tendance binomial radioteria injudicious quartziferous Gammexane tanchoir malaxable sertum chevrette magnetophonograph suffragistic Graptolitha cacuminous Chilliwack cheiropterygium Cyllenian tryp crystallogenetic gobernadora
208,DhmAw,2011/07/07 11:50:50,19,MJpohk,macrophotograph stampeder Biddelian bescatter stepgrandchild nonadjacent measledness dyester solvolyze vernile leucon hypersomnia Othin flexanimous behoovefulness virial nonstandardized nostomania russia Platyptera
907,6nHN1,2007/07/12 14:59:53,78,xtDlR,lovingly cryptographical anthropodeoxycholic amidogen parsable ureterorectostomy prodespotism slime unnewly masque batikuling schooltime unopposed encinillo Foist Wilton dandling threatfully scrutability testudinated
218,aiSSh,2002/01/18 16:24:05,66,B,neuroepidermal tidiable unwitting Heliaea inaccessibility nonsequacious miltsick unrequital Araua Judaically ownwayish Seaforthia collectedly ambitious epigraphic tarragon connotatively teskere sambuk fayalite
565,Epk5C,2022/01/13 12:38:59,11,NF,forgie Micromastictora unclothed sprinkler giblet dialogist Calchaqui kinesalgia phalloplasty precalculable entach basibranchial matron antiracing undulately dermochrome unherded Acilius lansat aphoristic
698,rnJXH,2011/01/20 18:15:35,97,cjLerT,naphthalenic apocryphalness auripuncture gemmoid biopyribole Leguminosae unstrewed biarticulate highish incipiently undrawn perennial swathable bradyphrenia aryballoid ulvaceous korari saccharomyces sarangi darzee
716,sWPMl,2009/11/03 11:39:29,30,iloFh,Eomecon haptic hypsidolichocephalic palliatory discontented impeccable subsynodical semihardy repronunciation jacobaea cinchotoxine flirtingly alembic leatherer sybarism bullyragger morphotic surmised bardash periosteoalveolar
663,4RLnW,2015/04/03 20:16:20,53,tRu,starosta balut predeliberately counterembowed westernly bloat unfringed unaspiringness stringent chirometer uncontagious symbiot intervalley supernalize chub overtoil perorally unshieldable pachyemia gleed
8,PY1pb,2003/06/25 12:36:50,37,ginixHqoMcegjecPjTV,hymnode Beneventana refreshing prickingly almous stereotypable Maronist unanticipatingly holcodont zygomaticoorbital laccaic potentiality Teleodesmacea sideburns piddling ruberythric counteradvantage applicator conflagration nonfood
539,2uFIA,2007/06/12 11:20:31,20,OsygYLy,runless cyphonism unpertinently antiodontalgic aburabozu garrulousness flet Geordie pentylidene feignedness cordwainer obedientialness polydaemonist homodermy underhandedly uniformalize dayroom salvarsan proatlas Anglogaean
254,3mbaQ,2009/03/11 10:40:25,81,NuCz,redye unorder silurid scintillant slum dot Alcalzar interline myalgia senselessly theomorphism athyreosis keeping stoss lucerne interfemoral farmhold cozily nonintuitive governail
57,oQfoC,2013/03/09 17:48:19,91,xTouimewdzxmz,Cyanea reinvention adopter Ancylodactyla byerlite immanentist venger acylamino apoplex pinbefore hendecasyllabic tricresol Satanistic Nettapus glazier piline philosophedom polysidedness salta Cohen
590,fbnuh,2008/10/18 18:56:19,56,whXVJUVzzmjalvcHaA,physicotherapeutic Sericocarpus seminoma Phacopidae energumen trisome intempestively Kaj ovorhomboid confutator drakestone depascent postscapula brisk commons superoxygenate anthozooid unsententious pulvinate gooselike
988,WFfgi,2002/06/08 04:22:40,80,ebFVNm,clientele comiferous unextended abandonment exceptionableness outbribe unelective hemiplegic intermodillion meson parallelodromous grousewards Peban ungild piperate anthropocentric polymicrian petrosphere histolytic illogic
133,2Qwab,2019/06/10 11:38:24,80,jno,paragraphically rowing culicidal Siryan dwine Tonga karstenite disthrall Pict holometabole obovate fifer Jansenistical theophany paniculitis vaporing omnify fenceful antimaterialistic omnierudite
270,3x2Zi,2018/02/24 10:38:30,66,kod,monobromized ginning dyschromatoptic hydraulist miraclemongering banjore un naivety earthen salinometry antidictionary archly deratization katalysis infibulation mesatiskelic undissemblingly Cyclotella befrocked noncommencement
247,vmOX9,2011/05/11 10:38:13,18,pvCbY,ununitable clavecinist sponsorship superchemical ministerialism limply semipaste belomancy mountainlike innest pyrocondensation Flacourtiaceae prerailway Aculeata sociologism antisplitting retainder indirectly mountant storkwise
250,7YUwV,2002/01/20 16:28:57,38,kIONHAXqIdzLQfnWJGc,badian galewort animotheism anorthic Charontas ventroptosis Akhlame unguinous multichord aroon daft ahaunch frostflower hanging temporooccipital stucco Thurio unrobust ignition insuperableness
774,0nK5P,2008/08/21 21:09:01,2,GPJnGeObWyLbmrqptjxh,multifoliate pharmacophobia milligal picaresque unjesuitical enneacontahedron Fullonian hammerfish unfemale siliquiferous rotative anemological thiamide pimplo panneuritis druggy beknit sprawlingly compasses barricader
765,9cXXh,2020/08/24 20:36:57,20,DSrPUGOtAqF,determinator productibility preacherize Nondeciduata interweaver voltaelectricity lithophytic oxalic teretish apothecal nonaffirmation congressman Perugian Dongolese unimprovised treasonableness Auscultoscope overearnest Ammanite colorectitis
168,t7QOW,2003/11/15 21:19:59,74,iGTxwotia,estate balsamer spermatize unsummed Lissamphibia unconfusably oxphony unbrutize mist chloremia Cellepora Abipon firestone normocytic polyidrosis heckelphone feastful serofluid trichophore voltagraphy
85,OPlTG,2012/05/10 17:30:25,9,XoKJUqHbqoUGaTJYf,intertidal paup overfreight wishmay voguish venial wangler butterbush femaleness mistreatment proctoscopic flop acquisitiveness Cepolidae suppliable mythicism Hermetic lugubriously constructible contranatural
806,Q7mNm,2000/01/03 01:32:53,8,CnPMb,overbrilliancy dehydrant ailantery tremolo geotectonic Mosul thyroidal sworn stylize Aramaicize hyperdicrotous unnuzzled enamelist semidetachment prismoid smoorich Peziza unfabled discharm speedy
643,VbFA7,2022/05/09 03:43:32,95,ZSgehWkmCE,protectingness infamonize partitional originalness precognizant plicater chainlet glomerular renotification paviser antiscion severance Kuki whoreship lontar tidyism pinguin George hemopathology escapable
237,wOAqX,2016/05/28 11:01:40,5,uNqg,Otomitlan nacrine tricyclic pyonephritis artocarpeous Exogyra typy larkishness combwright perilabyrinth aphronia photodromy jointedly galler puppetly extracellularly dilatometer prosyndicalist colonialize homoveratric
601,7ntQr,2023/11/05 17:21:07,76,BrfmdNlXHpOflFj,princessdom atokous beechwood hysteric restiveness offuscate promissory simiousness cephalocentesis gladness implex unattestedness paraenetic superprosperous unfiscal alumic potwaller townfolk aesthetically frumpery
249,RVyde,2014/10/03 13:13:44,56,QlgLuY,chavish palaeornithological underlegate boundedness unshameful interriven impeacher menisciform outprice myoid vasoparesis octoploid heartening borophenylic Arikara brasswork ejecta morigerous obesely outhauler
807,QCbl5,2014/01/03 22:22:11,4,MlQ,mothergate filchery Tabanidae ethylhydrocupreine ceraunomancy fashionably outsettler unglutted prebake overbitten amatively undesiring bobber Adigranth hematospectroscope bimensal stillness cornuated beachlamar sortable
77,NvkmO,2009/12/18 11:11:52,70,sVVeobCCuyxdA,serut uranography Epistylis rhapsodomancy horopter ungeneral Pima Macacus Fulgoridae sizygium ferineness baster crystalligerous unslakable stegosauroid czarowitz vacuolation baconer bister duopod
212,UZfhV,2012/08/04 00:49:04,92,cYcBkjrvajMnSl,biogenetic triplicity coherently neuropteran supranervian graping squareflipper banket flyboat marcello insteam perisinuous peritrich incomplete verbigerate bister Moronidae corbeling pyrographer Socraticism
795,ePyQc,2021/05/19 10:41:38,3,iRtn,mawkish tardy compactedly erbium killadar meadowing extraphysiological masticate acnode tradesperson rest atweel boss nonstretchy infame fogramite appointee nontreated isotony crookbilled
598,tUEjP,2014/06/26 16:23:59,86,nsF,chirper virid septennial anthracolithic naometry shedwise meningococcal basto isolysis cardiographic telegraphoscope buffing clippable podurid kiddier regimen uninfatuated deadening Akra chemolyze
995,mPSJS,2009/05/20 19:43:48,64,EjVyuVgGiiuUJ,huddock postmineral prow geologian nickle dragbar sulphurity prosopopoeial unfumbled spa bubbly Septuagint drawee eelfare choripetalous burrower multiganglionic englacially gymnospermism otolitic
