id,owner_id,creation_date,count,name,content
126,ThBqh,2018/02/07 15:57:35,52,CjThvPfF,phonestheme holohedrism Siletz superalimentation lithemia percent Boeotic malalignment bepray Brauronia lutanist kerchiefed amani Arius rect pomologist unyoking ineconomic sortilegus ecarte
911,3IsJ9,2016/05/16 14:08:40,9,MftKRzeWwwmqGgqEBk,Nordicist prejustification anoetic causer gynander rhynchonelloid unmudded undercircle preirrigation eruc katalytic petrify fullhearted repugnancy stevedorage deducible fulgurantly unshell majagua Xyrichthys
8,1RR8a,2018/09/24 11:25:21,56,rLvCbNEhyQRYUlM,cruise preresolve antenarial educability glove recordist ergatocracy hereunto charitableness Sabbatize thankworthiness bimanous sucuriu unrespirable tribeship exemptive stoichiometry septariate opisthosomal supersmart
786,ps7Rt,2013/11/19 02:33:32,97,rlgpJUaBmbd,pectinatofimbricate klipfish prezonal virgula oxanic apterygotous tractility saut birefracting sector glycolipine arousal grille ageustia g battleground nonannexation arthrodic unformulated nodicorn
616,nMftc,2022/12/14 12:20:11,9,bWtGDCpk,dimerism speciality nonoily Vejovis hillock wagonable asprout acapu parallelogram janitor aperitive Mariolatry unequivalved diabolism quadricipital unlonely pincase Potamogalidae guaba ceps
437,maPeA,2005/08/08 08:51:18,96,cFejlwc,imbricately Coliiformes Pelagothuria packthread diacodion Zachariah dam Phascogale Dromaeognathae graniteware annal malexecution regimentalled Karaitism Phalangides bellicism fifty uxorial aftercause uproariness
942,MPsbt,2018/12/14 14:36:58,78,ThKpJrxpJn,unicameralism skelderdrake chyak bureaucrat Tetragynia unchambered lowly repetitionary deference virtuous stockproof Dominic caudicle apothecaryship quilly archpriest miniaceous Ballhausplatz resolvible stalling
791,4JxX2,2011/03/02 05:01:25,35,ahzkJQJuuBgocHbYqFox,proctocolitis maximize unremovableness layery outrhyme treadboard Quintilis chauffeur hiddenness smeltery portably homodynamy antifouler spongeful revetment crouperbush oblongated leatherwork exacerbescence antronasal
529,47Ok8,2008/09/05 22:33:57,19,SPUl,acervose lancepesade Anopla weirangle carlie repen soli pelvisternal viruscidal moleproof anima isocrymal intercrystallization bronchiole foreflap Aetobatidae Tehuelet sufferableness palaeocyclic predespondent
411,m3yzf,2017/04/06 09:52:55,40,VanUULUIttAokg,cubangle penniless interplay enjamb objectionably tenonectomy Myrmecophaga Chol phlebolite dithionic buran piscator dobby hypnotizability litigator dolichofacial pruner scorifier unoverpowered Rhodymeniaceae
328,m4z5q,2007/09/05 01:56:03,29,I,unstrapped palaeechinoidean lapidist tunicary lyncean remanage unblinking unimitative heroicomic bonhomie zingiberone refreshen paralambdacismus Fany podology Tanitic rededicate Aptenodytes vociferance sistrum
490,ycNcR,2020/08/01 10:37:32,77,XVJySlKzilrg,bielenite subfebrile antiferment crossjack Vicia strengite gonoblast unbehaving tubovaginal joll duumvirate phagolytic classism unsubjugate tripalmitin matriheritage didapper funguslike delusory Lethe
802,AdVFS,2009/07/13 01:22:20,32,UaSfvMOLvc,diphenylguanidine polarizable mollities undertunic unbred enterogram flimp counterweighted uncopyrighted deliquesce brachydomal Conolophus tallero immergence teetertail unequalize underconsumption linguatuloid vanadosilicate ventail
827,8sMeb,2017/11/28 08:43:35,68,IxeIjxwjIB,Ssi gradualness worldliness neelghan mounture intrudingly grillade phytopathogenic necrophilistic pencil unpoached mythification syncopist rubbers Uncaria rhe Eranthemum horismology sporophore shareholder
75,4orqH,2010/09/07 08:17:07,18,oagVnGzzoAazHlMRiIN,hinder ozoniferous Plautine muckrake real undeified Otocyon harmoniphon Howea practicianism forecount unfried semiruin dysgenics hexone consensual crawl Pegasian tigerfoot golliwogg
37,00BiC,2020/01/24 14:57:16,19,HZEnTnxlx,uberant isocrymal refocus nonrotating transcendible fortitudinous ungallantly Saliaric desoxycorticosterone cockfighting shastra spiderling prescriptiveness Masora Lateran lagopode underswamp probosciform tarsalgia cephalocyst
556,JdumS,2023/02/26 00:08:56,35,PhaZHbiMmjM,mumper paga wime blacker inexact goldseed juvenescence Minyadidae chancellor regratress adieux uncapacious Cowichan leverer zag nonvirtuous blowproof sacramentary pagehood contrastment
70,10b3h,2012/07/20 20:36:52,91,pCYvToYkSF,pipecolinic hognut genitor smell lipoxeny captainly Hirneola xarque vitativeness bootholder baniya unthoughtlike splodge esterize nonvictory Seminole uninquisitively largemouth repandodenticulate galvanographic
493,DmXEJ,2014/03/22 01:23:25,23,TdTdPEddAfk,mignonness unrecited dolabriform forceless horoscopical denumerantive bibliographer perspicuous preopercle Slavization Justus subdistinguish foremessenger degelatinize neurotization scary acetomorphine maltodextrin cramberry paralepsis
744,WoMtJ,2015/12/17 02:11:58,52,W,clashy freehand knowingly accumulative Cyclostomes myoidema spiggoty somnambulant cones saberbill Ker chamferer desertedness inculcate sourdeline ampelite startly sylvestral rosin unsewed
522,OtS5k,2015/10/27 19:39:41,81,BgUFkkfIbRzBttvWEZd,tautologic anabiosis thereologist textuary anorth periarthric chroma petrograph photosensitiveness sycophancy blindly proregent fibrinogen unmenacing Arimaspian unformative shadily deossification guileless asthenology
680,Qyuh1,2017/10/18 10:39:31,67,oZF,Ptolemy uniformless unscarb dilettanteish timist mustelinous inflammability subsidiary maline cocciferous campylodrome Serbonian ovinia mannerly absorptively whiteweed gisarme concordial nasopharynx ribboner
576,znAe4,2016/11/11 07:39:30,37,rkYhQYCSul,Deuteromycetes vulturewise pachycephaly serosynovitis uniliteral histotrophy palampore pounder difficileness coadventurer nonobstetrical oho Nematocera Planckian grattoir superagrarian metacismus tungsten milleflorous lividness
33,1f1zX,2003/03/10 12:21:08,40,RFFwipb,unpacifiedness unpremeditatedness rubella pentaptych superscribe postbuccal heroism furcately telluriferous hydrognosy Borak thwackstave femininity arseniasis rerebrace triequal hypnotizable transformation imperceptiveness rioter
109,DlvtO,2016/09/24 10:32:27,54,XYhQwidfTWZ,planktont agathin steam unpardonably cagey sodoku terrestrious scream discordantly terrierlike skelpin lactometer regulatris anticlockwise boronatrocalcite Phyllopteryx adjournal ankle gynecomastism Aggie
254,KMV5p,2013/12/25 08:41:25,33,tQyZTXRm,profanable saddlewise bullwort manifestation decigram wakeel trooper fattrels pseudomantic hoary sportsmanly predoubter overrash generification superstandard glycocin airdrop expectantly flog hypofunction
953,PFi6r,2022/07/10 02:09:44,12,xOfndaOTV,tenability repossess Phrynidae Cynocrambe Spy wheencat unsome pillbox resiccate piking restrainingly pseudepiploic trickingly alternativity competently Phyllocactus screaminess disorganization sawbuck beaconwise
632,t36go,2020/12/05 12:49:09,95,BJbHZDWHdxvzXycORbe,stenobathic Zygnemaceae dirgeful uncompletable microorganism patrologic dishonor endearedly noncollaboration sighten descant habitability paragogical verticomental torulus Kniphofia crumpling protestantism Basongo leptocercal
771,O38zE,2022/05/11 17:14:25,86,rrl,lave pleaser phociform lapon coat continuedly fingerless Melampus epistolet adaptedness spellproof giantship serigraph rapping uncalmly corrosivity curatel ravelly lipogenesis comatoseness
901,MIlCA,2021/10/21 17:48:13,36,ittOfajAjxphMFZAAF,chlorodize rhinology provivisection unnaturalistic influenzal underorb spittlefork quieten nonfeldspathic homoeokinesis algometrical nasoturbinal immensurableness mumpsimus parhelic unrevoked exosporous macrocosmology sawfly pteridospermaphytic
860,CeTRN,2017/12/27 22:39:15,49,clbubb,counterbrace doppelkummel ungentlemanliness cranioscopist Phytophagineae lak hospitious allurement Leisten periuterine ambilian reservationist buildress monodist discanter neoclassic foreshaft Lupercalian cuir Fucales
538,Ags3V,2021/05/19 18:09:16,97,ImPNIRMPQjcysaA,unlaving tahsildar sheepify hyperfunctioning cidarid jostlement Menura palafitte powerlessly protoreligious unthickened isovalerianate stultloquent divestitive nawabship moonery outstunt platystencephalia capitoul unwisely
145,x3QyU,2012/08/20 17:15:47,93,yF,protorthopterous ringlike Carolyn unpossibly incongruent agalaxy urolithiasis scapuloradial spiritless thecoid nebule launderability ceremonialize dama clammyweed poleaxe lichenoid rhomb undowered flaglet
261,MsYHg,2021/06/19 16:16:32,28,EwfZdrvALo,kelchin zimocca Trichomanes vaginule wekeen suspensely kinkhab assuming preordination mulefoot undecatoic eveweed obnoxiety enterpriser calamitean Cicindela mirza archilowe saddlery cantharus
146,PO426,2005/09/25 18:37:42,89,saXhw,bullamacow unmulish sisterless pectinal undercitizen reaspire spermatova alkenyl Mosur spectroscopy Samal peroral rotge gutterwise torpify mecate opacousness mediative rectangularly refinable
362,icQmS,2018/07/24 12:21:49,62,zlysDFgH,scrobiculate vizircraft nematoidean mauveine queen vertebrae metriocephalic unpark brettice toptail unnose suberiform hydrotechny underbush shraf seizer presubiculum sextillion evident beala
245,mlr73,2008/07/22 16:07:27,37,aaWQbnGuNyGymbvsQuw,cohesive upcrawl pluviosity vocabulation spinoid presenced untransient Taeniodontia salading claustrum prostatodynia immoderation antithetics Stilton belsire valedictorily hydrophobic stomachically unchain diluvian
344,W38rj,2017/02/16 21:31:10,89,ZUI,hoarwort antimachine overstoop hemimetamorphic cystotome benzenoid Stomapoda sarkinite panspermatism myriapodan psilosophy fireable brachycephal Dioon hexadecanoic Patuxent subjectedly mittelhand indecipherably changefulness
264,f383n,2003/11/08 13:18:28,27,biHqDwTOuxclmUqriQ,postbulbar pregnant thoracicolumbar guzzler handicraft pearling attic proturan entelam phosphorescently demicivilized deflagrability exorability tapperer Robenhausian subdebutante abscision Colubriformia oestrus sphygmoid
851,wCDnK,2009/10/18 04:59:46,17,jjqiKyxkJoSpVjsONnw,sprucery cyanephidrosis flinter Hattie allmouth wramp unplowed reseize Succisa Cassiduloidea enwiden myofibroma pohickory superlocal franc antanaclasis habronemic wayhouse fossage rechange
804,4xgqW,2012/11/25 08:48:17,100,DPg,quassin clearcole semibifid Zanthoxylaceae quieten descendent stethographic Terrapene tingle defraudment impetration underoxidize sporangite worldling resiniform contrastably Puya instaurator perturbatious semball
631,4P3X0,2003/11/11 01:55:02,96,VkjPkwmpFUxklkHZkn,gnomological annelidian unembezzled prechordal hursinghar epicenter mitrailleuse blennymenitis Tollefsen fouette Huave unrevoked unstablished protariff opinionaire intermenstrual piezometric channelling vikingism blackey
645,lnusM,2004/04/15 07:48:39,16,EsMlZ,apperceptive isogametism activist industrialization statistician protopin arachnidism Elodea korntonde boothite obsolescently fluctuous rutelian oliviform sunglade garmentmaker otomyces felonious skeletonweed flashlike
637,uftXy,2017/05/20 19:08:14,32,eFzWy,conceded underwear distribution craniorhachischisis poolside conarium underwooded thoriferous actuator holostean Bahamian sulfacid ascitical chalazogam diffidently scribatious yajeine unreluctantly Zizyphus bootblack
53,f46n2,2023/09/21 11:41:06,47,yEbo,asclepidoid undiffused unwithheld yukkel reorganizer screw sherifa brooklike Orientalogy journey dipody trachelomastoid microphyllous subcreek bual phthalazine allophylian asparagyl panpharmacon Gruis
417,jlFok,2006/08/15 14:40:23,4,RiXInFjWKqSEr,doorless stib pocosin billiardly washwoman sphacel anerly harlequinism officiation Acherontic anadem prescapular recart volitate reinspire exciter dehydrogenize terma bathymetrical legibly
73,U74hq,2009/01/21 08:01:09,91,VOdcD,pickax perineocele tubboe mesiodistal salaceta Thelyphonus Acipenseroidei asfetida manganotantalite Gabe outtongue physitheism fungicidal linguistically Ella undisastrous unbled Bundahish spar zygodactylism
318,4P8vv,2001/02/05 07:38:26,79,nzYWPnJJSoRb,foredeclare sludge separability crone spermatid prevalescent heartquake unrestorable sprayless goldstone aftershine raininess pericardotomy inequity chulan fructescent quantification endue Nassidae blastogenic
691,1ikMO,2006/10/08 12:19:16,54,IDcIyUMKIQSjKounXYi,rhodic Jackye hyperprosexia ammochryse scena prediscontented backvelder corporeal Parma uranoschisis quincuncially Gladstonianism shacklebone aggravate Bairam proromance midmorn hydrolyze unfalsity honorably
811,sqOUn,2007/01/11 08:18:50,17,kgcxYsIIlvSd,suggestion weisbachite hydremia scrinch squamated magirological toho nondisappearing connaraceous undeceivably somatognosis acetonylacetone Dilemite Liz onymal icequake risibility physeterine celemin thenness
260,TWL8N,2007/09/10 15:49:16,55,rWbPct,unimodality hydroxyanthraquinone aggregative revulsion lactide Sisyphus preparator preconnection diatomin adenometritis mala foodstuff croodle Mithriac daddy proboycott postmamillary everduring Guianese marigraph
589,Uzepv,2020/12/13 13:08:09,17,gZVohHzfFQUY,adrift evection sebacic diathermize corpulence lethargy thrustful radiograph nabobism Templetonia Hilarymas Cantab uncensored excitomotion Sinicize congressional wheerikins foxtailed bedikah Desmoscolex
905,KivAf,2022/01/12 22:07:36,42,cpYOZELV,bearance egality Cluniac cowleeching ragamuffin nosology decastellate celestially topologist agitative pneumocele leep scribism dandiprat episcopolatry Tambookie Napoleonic numismatology Filicites hygeology
971,wZkW5,2020/10/06 18:20:44,25,AuBkfWln,pteropine propagable piacularity oversubscribe glore Boophilus canadine taenifuge appetibility sulfuran corundum ungabled serenify stainer freestone casco jocker unedibly begrease sempiternous
874,hHQ9U,2019/11/15 10:53:48,80,lOKqG,katabolic extractible suggesting axopodia metroptosia roseolar subtermarine unfix bastionet firesider Passeres resonatory arbitrariness nonclearance jharal unrepossessed brusque metatheology penttail Struthionidae
295,5mvPC,2016/09/24 21:17:56,18,WUDimwXIonBaTkYxshG,triptych Alopias nonenergic anisoyl precipitability tenectomy menometastasis manlikely splendorproof pseudoarchaism unhesitatingness pageant sphygmography extrameridian footgeld traitorousness globously iridical unmeetness cryptolite
313,jujY0,2019/03/05 14:25:37,13,yQSSNeFYGm,unfleeting reblossom hypermetaphysical Sanicula undelusively pleb tectorium outlooker spectrophotograph aphetism artillery unvirility bronc bugaboo kailyardism metazoic ganglionate demeanor Clarissa nomothetes
330,IDRP4,2016/12/27 23:47:49,55,gcEfeCojJRTE,Mercian relegable revolutionize husbandless waggable sports outtease borderlander discoverably provoker anywither imperspirability slit patination cormel delight irreplaceably slatternliness philter stinkball
257,xLpGO,2009/01/09 00:28:23,34,Cbl,nomothetical decarchy parasoled asclepidoid Ascella afterplay Striga chafery sphenographic Shardana cronkness interstream leafage lepidophyte polyatomic Kashoubish kitchenful syphilophobic cedarware mealily
558,2rEwX,2002/01/06 14:05:12,73,ywXTpIvhbeZCUoDNRPRj,mutage antisialic zein subconjunctival farmerette rhagades recureless proteroglyphous staveless oxidative serriped knot chemotic Jemima sulphide Kory spankingly indeterminist millioersted upriser
693,aC7vx,2007/05/14 14:45:45,95,XImC,Catharist rigging rane awee prefriendly peppermint whirlpool Mongolioid Luite knowability nonrecurring chandi misinstruct talion chromaturia trimethylstibine polygalic percnosome petrosphere disarmingly
612,99eCy,2009/12/12 08:40:47,16,FKQjvelbJwGdZoK,baldachino gayyou bearess feasance consultory filaceous sereh decemfoliate outliner longe larklike lecithinase cystoflagellate Protohippus keraunion alexipyretic anachronous unretentive sulfohalite phyllotactical
586,b2i2K,2009/12/24 13:29:22,1,QsqQTa,therapeusis therolatry acetosalicylic exhibition royalize flowerless lithotomous mastoncus frontogenesis statehood aryballoid Kolarian openheartedly atrophia Platonian bronchoscopic conjugant waumle homeozoic duplet
548,A7XYg,2003/12/26 17:13:08,51,mD,choleine Hagiographa unbridledly Kerry collophore cyath liquidity overgloominess plasmoptysis includer mythology bronchiloquy hateless rhinalgia Brahmsite careener vikingism unweelness affirmable radioamplifier
217,PmL6Z,2005/10/28 14:46:17,34,yEUkRYdDnACQPuUSkP,indemnifier dialector assuage covariable unilateralism leucoblastic nonappropriation commissionaire patchily Pimpinella radiator trefoillike courb stagnation encephalolith smartingly passionflower proseucha garish underthief
190,231nJ,2012/12/04 00:04:28,10,fB,photosurveying acanthoma scutiferous alypin anthracocide unfestive unmocked authentication putrefy interpretational fagoter tercentenarian cardioblast halliblash subclause unremanded bantling prerighteously shoulder omao
185,l0rIb,2016/04/22 04:28:58,26,tnomxEHJEyqsJKU,columbiferous paravail compotatory poloist chromoplast slanting Effie Fanti expedient corticosterone wardwoman sheepman indistinguishable multifoliolate iconoclast Agudist contaminate Stipa subdrill megalopa
562,d5KAD,2019/02/01 18:06:46,43,TKtXBkRtGLyklyIEZhpx,postepileptic descensionist gurgitation misunderstoodness tenderness runologist palma hyperbolic phiz dialin geneat davidsonite aconin treeiness admixture alinasal armillated succinctly acaulose menacement
665,YHOsL,2003/03/10 19:12:32,75,oSaNaoAwPeipGzaR,phyllody termolecular ctenoidian antimonarchically bulling Petromyzonidae premaking representant nidification incudes unavoidable morphogeny pamphletary cartload discoblastic Iambe semichorus salta Hesychast mockground
235,ayRAB,2006/01/04 22:53:25,83,nujXhuLkvijd,molybdate theatricality Jute splotchiness soldier sedgelike delightedly martyrologium pithiness biogeographic Hyades blowball gelding doc magistral axonal stumbly phalansterism antelucan sewery
165,2PudH,2013/10/04 06:58:31,94,JTBaCzwgiYFtmbqJj,cassino schoolgirlishly ungrained swimmer phacocyst brushland androcratic negate untasting unclericalize panchromatism horologue mezzotinter overweeningness phosis awnless recurse polysporangium militarism gaucherie
915,TnVTQ,2018/04/07 14:18:12,22,qATyqocsdwuCfVOb,dextrorsal zingerone tarrish rachiglossate tetranuclear horseplay Moschus rudderpost semimill Gymnoconia Thunnidae balaenid incommiscible palolo Lithobiidae lycoperdoid predefence Recollet carbamide nub
72,Hd18a,2016/04/01 17:39:28,31,Oz,stoon ingratiating quadrupedation odontosis perle stingtail spade sleever stenosphere culpability grounds schoolyard ollenite preversion bleacher rabblelike animalian armillary Maarten schistaceous
871,3wt8w,2003/03/10 23:40:24,29,IkDUNiRVpvY,vitta vesiculectomy slogger protovestiary quicksilverishness overprecise Aruac snowfowl palaeoethnology toggler fungivorous Karshuni taxor transvaluate bungaloid blarnid sorgo shovelbill dilatory astroscopy
717,qVDyG,2009/06/27 00:28:37,96,uWQcgrtCJa,primogenital proembryonic reposal sheepstealer unethnological unchronological outsparkle unaddicted demiluster pauseless Galbula Shylockism plutonic grow overcull psychoorganic jactitation intrusionism umbelliferone stepgrandfather
26,0DZY8,2021/01/01 02:25:54,92,mI,extratarsal cuspal polyandrist apathic evisite supersubtilized philosopheress perjurous iotacism Biham proportionably subexternal Messianically greenhead sitio otomassage upcoming overcheck ungodly bloom
139,Hcmk3,2000/06/09 00:31:47,58,ICaPw,Helge sacrococcygean bracciale jacoby accumulativ cantharidin kiaugh thoracolysis latewhile enchanter rutic redfinch Achuas parthenogenic exuberant tessella monographical heteronereis appendice eleutheromania
38,mjvPG,2003/09/05 13:17:32,61,YxwdkKEMKziziaJxiQgC,mispart infraradular praefloration lyssophobia hield phosphorograph endurer tensileness nihility gein hypocarpogean elpidite bony lepidophyte pinhole whinnel anaphylactic satura Pittsburgher azelaic
455,Uc9lp,2006/09/01 13:24:22,56,XOK,napper venenific suckless climatal tympanocervical smelled xantholeucophore safari bardo pager villain abstracted Vepsish adderbolt unexemptible bacteriopsonic licorne ortive peafowl paxillus
907,8jQXh,2013/07/10 21:09:10,80,WSETR,bayoneted neutralness meteoristic appositional putredinal zoanthodeme commandery knublet overcasually lucubrator pseudocone affenpinscher savagery engorge salegoer endospore curuba porencephalous lilywort psychotherapeutics
960,OlEcH,2011/03/24 03:57:06,45,krBmOICTWes,calendarer sorehawk slinky filature bacterioscopy homogenetic undiscriminative Luvaridae proprietous istoke exposed depressor bout subtersensual isotrope underclothes pseudocosta Patripassianism reundercut chordomesoderm
696,xwcaG,2022/06/08 15:47:20,66,IUcOeAgBANgcQZo,tenderloin eligibility memoryless stillish Lindleyan encrinic moriform presuperficial unvaluableness bradyacousia quietsome pipewood purvey hypoisotonic trimerite scrollhead cannon mischance alternacy babyishly
800,bkggQ,2005/07/09 09:54:48,10,vvyFpydHEdpx,aplitic collidine Isinai geta Cineraria Roxolani Nazaritic Praxeanist cappadine acraein scolion military chid irretrievability nidget unaidedly slimsy Frenchness calligraphically lawrencite
998,0ZjTC,2014/02/03 21:48:07,33,aWAfnnf,endaortic perennibranch oesophagismus sacrorectal costive towpath perverse bilipyrrhin condylure overlewdness predinner radish pedophilic unengaged xylophilous unsquinting scull stetch remortgage disputer
692,pjqYv,2011/06/05 08:47:35,42,OXNWNTcyirs,megrimish freckle monkeyboard hypersensitization elegiac morphophonemic trabeae cyclograph waterwards reconvalescence waitering miscollocation undergrowl unactive Elamitic pentatomic delightfully extracultural blader Edana
150,yS2kw,2015/11/06 21:47:18,29,eHZqYWLAdULglgUlm,tarweed kinglet notchweed isocytic becher chiliastic enchondrosis smectic depopulator starken prionodont Dada uppoint sacrad jasper burden symphony judiciousness cadgy prejudger
329,h3RAK,2018/07/02 07:35:37,45,xtxoTmVduMTB,criminologic Mytilus karaka donkeyback bowless Arhauaco retransmissive marly rhabdos tagilite nimbused titulary boud gravemaster ventriloquy supersalesman portcrayon propertyship illegible dipsas
485,l6h1c,2010/06/07 05:57:35,49,FRch,algolagnist howardite equipotentiality vertimeter pubic lignivorous Arminianism tylosis satyriasis preoblige conductive ichthyodian chalcon woodshed periodogram predisputation possessionlessness coalitionist regenerate gerontine
174,V2jAW,2017/08/02 03:26:03,86,dcbDplTs,reflectoscope pollinar counterexcitement guerrillaism gastroenterostomy Pinnipedia catechutannic unidirect newlywed opsistype mofette tepidity nonrevolving majuscule captress praecornu fecund plashy Seleucidian bojo
780,ZTLSW,2002/09/18 22:31:21,34,ZbHUjfBYKiCVBxyDUoHN,Heliornithidae gnosticity uncaptioned chieftain Echinodorus telpherman Heliconiinae Climaciaceae thurificati taxodont hypostasis bodiced Aristophanic guide clairaudient mon planet infieldsman wyne semiarc
898,wNKbL,2006/11/19 09:30:00,16,kLBvO,blunk angelographer harmoniphon herbicide craquelure innately campimetrical diapering tawdriness gourde piet nonpenalized maidenhood solvsbergite leverage waistcoat paleohydrography bummler kegler ultraformal
954,PEPEk,2012/12/22 13:49:08,65,PjUQNmEROAAmTcsB,divarication orthic neglectedly hylotheistic pierce Meliponinae growingly manometric rebrew nonpastoral compulsorily unsolder batakan merceress weldment Andromede eyesight osteophyma catostomid subsemifusa
779,7GUXw,2004/11/09 01:08:45,1,OiohDSsBI,manganocolumbite explicatively pantophagist nonelect defunctionalize gnomonics graddan Kuneste Benelux abaxial noncellular antiheroic uncombiningness soloist Sciuromorpha protutory overlaunch autourine Februarius hysterocele
67,vfaFB,2018/01/14 15:10:19,45,yazMQqvFDsNZHL,lithotriptor sophomorical victoryless inoffensively glucoside tibet sedigitated shrag alienate ectobatic saliently alveololingual Stokavski myocardial pasteur pentapetalous gregariously crustate delignification hysteranthous
268,bjZ00,2007/02/03 13:01:56,88,XvXyeCZtm,waggle quadruplex offhandedly butyrochloral Galax Itea stephanotis suckabob tercentennial avichi sucking gasiform baahling unamiably unpleasurably desertlike hydurilate representable offlet hydroparacoumaric
694,ciTQ5,2003/01/28 19:11:25,74,NrGuJTl,larrup hispidity unfettled prefictional khar Herculanian fromwards erotogenetic Elijah fry analects exhaustible buskined joist tobaccofied perfoliation paganical maternally hecatontome consignatory
838,9oXGV,2000/04/19 10:37:58,98,JlfnAUbo,coriaceous tabog plantarium helvell litas disbody disoblige Botaurinae springiness polylobular whorishly potwalling osteomancy psychoanalyze Capella oleaceous pulmobranchia knockout floury Claire
509,UtPUc,2014/11/20 17:14:09,61,PZGe,sclerotia fonduk hermitical treponemiatic Asteroxylon irrefrangibleness phosphorate extracardial antienergistic hexacolic Beroe Mysidae ureteropyelostomy Myxogasteres uninjuring metaparapteron dossman inflammableness unproportioned Eutopian
939,qj5CM,2000/01/04 14:35:56,49,bYPKfGr,whenas reshoulder legumin jumpseed gainlessness unrivaled uncaused seahound unfeared barraclade meddlingly hemodynamic chasmogamic until disedification superointernal pollenproof tournant terebratulid consulary
508,txQiJ,2007/11/09 20:05:25,40,JHnZZAoYhsCzR,narratrix tormen exteriorly Hatty gateado strivingly phyllophyllin papist warmthless suborner unpaper testatorship dissimulative puckishness pyrrophyllin giggish osteodystrophy subconvex postcaval indebt
602,2bUlt,2006/02/08 16:03:32,39,BwUF,rockweed transformationist versine breakdown catechol apoembryony consolableness englut mackereling hemicrane mistranscript Basilics repersuade bacteriosis Hemibranchii crosscurrent Zaklohpakap chieftainess unemolumented approximal
342,vjWLw,2023/01/28 20:18:47,80,ntM,apneustic preobtrusive pack outeye microwave uncombined harmonici designedness Manjeri oxen gang suovetaurilia listerellosis Toft homophonous metaluminic sulfocarbolate unbonny weam faunist
