id,owner_id,creation_date,count,name,content
726,3peRD,2009/10/25 01:07:09,11,nOpljuxBEwqfP,maker epileptic finisher arteriocapillary smugism subsidist Phiroze consecrative blindeyes tickproof trigyn Tetrodontidae chromophorous dimolecular prosiphon Lucernaria shore unsubmission flutter traversing
201,T31zu,2017/09/26 14:24:16,6,EViwn,quinton anapaest gargoyled rebukingly hydrosalt extranuclear Pica gemitorial unpremeditately Statehouse ineffability Eskualdun umptieth spirochetal execution draperess lammy chinky avianize Kutchin
439,6CsN9,2007/04/21 17:36:42,11,dlrxWQQ,Yezdi incongruence superordinary sigher smirkingly gramophonically loulu dipsey nidificant ribandlike manualii intravaginal excreta arthrometry dothienenteritis continuer villainousness acetylurea analgen transdesert
662,d5jLr,2007/04/04 10:50:36,70,iAdGpXekgNgMLRpYGODZ,concealedly Eleutherodactylus Aspergillales unintitled unmesmerize loverly cystoscopic multicipital nascence Rong infiltrate uncontaminable retack cenotaphy superordinary directivity impertinence fructed premenace stockholding
535,eiLYK,2022/11/22 01:08:42,78,lWMRIkWsj,underlinement eisegetical rutherfordite matmaking frowy valentinite respiratored transcendentalist sesquiterpene stewy Toby counterirritate shelteringly champer obclavate patterner autovivisection corny disruptable windfirm
240,0Iljb,2022/06/19 22:01:45,83,AzzWPCTfhqcHQRtDPcP,cucumiform piperonyl anasarca rheumative twigger warp oversteady metatype calomorphic nowed opener glaze proembryo leaseholding extremital cropsickness superfluitance veiledly flutter swimmingness
815,7iHrc,2015/01/21 05:53:10,62,mUBGPAVuBFGildN,daktylon turricle gating perigee Sparganium lemming counterspying tolpatch steckling caecally uncivilness identification Lophiola trichy tenoner wifedom unmanliness sepic hydrargyrate breeze
283,DAeiz,2021/08/11 20:57:50,30,BgLeUTMNrzuNMPIXcgXk,save rejectment Tandy Chin unmortgaged neogrammatical Eparchean stampedable cubdom Swantevit volplane shewa unsymptomatic acetacetic grangerizer lipocele neomedievalism republisher violal awakenment
743,Krh2C,2002/05/10 15:05:38,60,blQamzRGvsG,affectionate precuneate anthocyan imperiously taffarel nonintoxicant slithy Triodontoidea Babi Unio neuromerous overcleanness scenarization supersulphuret aribine controvert heliometrically synoecism paleontology subastragalar
609,sQwKL,2005/01/19 21:03:32,87,vNkBtGX,opaled vitalism myodegeneration Arracacia petrification spherable wheelless noncombustion domn Geisenheimer pseudogenerous rhetorically interjoist entrepot aeronaut allomorphic sheepkeeping characterizer exsanguinous carpetmaker
683,umQ3e,2018/05/06 02:04:26,27,HZdv,trophywort unvantaged cystospastic bummerish chromomere Fenestellidae pygofer stormfully outstunt aside fingerprint unswilled stigmatiform superallowance cardialgia ultrafantastic Pergamene napping redskin Piper
958,OPcl4,2017/05/09 11:22:19,36,RQmfXiRDiCd,arduous emboliform heterometabolic personalization nauseant exonerative sourtop spikelet physicking fertilizable quotability clammish Elephas neorealism predisruption Idotea tribesman unessentialness poultryless parastemon
129,YL84P,2019/03/23 21:22:34,44,IaWOqkFzrL,testicardine raploch fronted paripinnate rimrock inverity susceptive Menziesia myoproteid teleorganic whistle hydrosilicate eulogistical girlish Chaucerism turkeybush unslanderous poppyhead rhinoceroslike underacted
358,1K4Gy,2011/10/27 09:33:03,41,sbPknVMC,sphingomyelin polyspermia artificial prognosticate playwork gastriloquist stremma unrehearsable Malleifera modeless uterotomy swordsman deutoplastic gudgeon delightedly teleoroentgenography slop cerebellar endoenteritis untunefully
685,O774U,2005/12/08 21:31:05,43,kohrIBvSsGueuL,identity precommit threeness paled ventrine scarce megaseismic smartweed autostyly overexpand untenibly gairfish chalazion tiffle nonembryonic bultey recriminatory hanifism terminable tuna
504,FDUlD,2017/09/25 23:15:33,77,QqaXOpFKcHCBnMJ,anisognathous enam Melursus Desmidiaceae peptonic bramble sarmentum startling hilltop rejuvenate similiter trinary unheedy sloppiness scaldberry Glaswegian shibar chouka gunge hypobatholithic
969,GeQK1,2014/09/26 01:47:43,87,TQoaLZWcZbMjAWRaIpEd,beaker snuffiness disaccordance chronist amir prussic Hirneola queak penster ectasis catchpoleship alkane tritomite channeled thermonastic uneffete pursual unconscionably outspue crucily
477,Vlx71,2010/06/18 17:41:46,29,vswU,Zoophaga Amatembu stenotypy mischio unseparable monohybrid meant brennage galingale ringtail gynecocracy protodont sial innovative thoroughness ambrose Rhizobium Anasitch fabling Hyaenarctos
505,e8faW,2010/08/04 17:11:48,32,cS,Branchipus Naviculaceae Chalinidae toitish frivolize guhr urination Smithianism gittith disfranchisement disinterested ipecacuanhic malengine costumic vaporously unequitableness theoremic rumbumptious pampered steerageway
351,GDlkF,2023/01/14 17:07:44,9,CRJWlXSB,pladarosis artist whetter pimgenet bronchiole vehicle scrapping borwort diagrammitically choristoma imponderabilia aquocellolitis pantothenate resultingly somatologist conquerableness zabti zecchino ungrudging unpurchased
162,zouKi,2009/05/12 00:36:38,2,uVfiZnTWpktgbYsCrL,sparse boracous unplotting alveololingual nakoo unexcitability pauperize coalpit hoofless maroquin manginess unpartook associational undeservingness leukosis scrunchy polysyndetic prepossessing pleocrystalline aldermaness
630,hthwB,2009/11/02 02:47:50,92,uzuvIQJmqMuxI,warbler gangrel runnel ecclesiolatry eloquential nationalness superperson desulphurization slinger fusible Cyrillaceae broomwood experientialism rummish mohabat sow emborder electrosherardizing regent Hyotherium
730,RN7cp,2009/05/01 15:31:55,81,jxsHVlmBthaguy,antistrophically nonluminous lustring onionpeel joist Zaparan cooking steerageway dowp Cryptomonadina duo Eriophyidae literality unindustrial Hibitos incarnadine barbarization cremule whirlicane coauditor
650,slFZa,2006/03/08 13:22:27,90,pl,ovately Okapia storekeeping Kodashim probal ptilosis vitrobasalt vacuumize Libellulidae garmentworker unhatchable Ibycus epigonos furzed telephote fuscin bradypodoid pycnidiospore carpetbag adversarious
279,PI33n,2006/12/22 08:08:34,2,AXEcU,cinnamenyl manifested Inachus mosshead haster datil evergreen frampold orrhology purga compend turbid quinquetuberculate paolo vizard aerotonometer narrawood stenocephalous monophagism Roussellian
646,ld8fT,2002/12/03 10:24:47,48,fBTrpGdDCwUgOYeZxXpl,syngenic Secretariat Acheulean confronte transection peptonoid undisplayed exogenous kapp rooibok polyphylety plugman glome refugeeship gali bradycardia pholido cropweed mowie heavenishly
149,k74FP,2012/10/03 02:25:30,99,XORoAheLVfdLljKU,transmaterial ericolin hinddeck Teaguelander Sporozoa frigid depolymerization bivalent derival lingberry tailflower hugeness Gallegan nonparticipant poetly undiscussed technicality yelloch catchwater prestruggle
241,n9oJ7,2014/07/03 15:56:51,21,f,remilitarize fitchew distortional siccant vaccinophobia polybunous cheiropodist consecute fixer Melanthium Moran mesocaecal carvol paleobiology colophonium tapered undernurse theomorphize ayah wauregan
100,aTuc0,2011/06/09 13:47:18,10,QMpoZo,oecumenic runkly birthwort footed sustentator Sciuropterus Hati angiohydrotomy Wenrohronon quadrifoil Abaris Penelopinae subrictal ascertainably precludable deradelphus tour spermatiogenous pegless bleaberry
959,5vF6j,2014/08/20 17:35:12,86,MvaBDZhsQ,tubulipore Ambocoelia emendate lipotropic Myrsiphyllum gelatinizer enameler rounceval pierced batlon gastrostenosis dethronable xanthophyllite Khattish Urian chaff incongenial pseudosematic rackrentable cattleless
825,NzbuN,2013/11/21 11:10:34,49,iupZWzroPofe,unreceding bugaboo recuse antihistamine hippish Thelyphonidae sumpage paynimhood limebush lilyhanded completely contubernal goatroot countersink Domitian niminy emunctory peoplehood syncopation negligibly
113,2dpd8,2010/11/05 09:10:02,46,tSfbFzvUlEBWESMaRMSe,gainable telpherage oversock joining inomyxoma tonguefencer Maghribi urethral pronto byplay hypoptyalism relevate desquamative emotioned Haemosporidium underhatch unexpandable stereomerism quartful scopate
623,sJWWb,2017/10/10 13:11:52,49,UeVyPfUkYW,unadjusted sideway squamatogranulous likableness tuboovarian dismutation cortin oisin stethoscopical Cavicornia noncontributory despairingness indazine uncomplaisance potative polypod overlead saffrontree reduplication villainousness
920,47fWk,2008/06/13 10:09:56,94,YTYaLHMrEzfP,noncollection antiphrastic mediating pregraduation effectuality mayoral unconjugated mud ungrudging indefensibility quakeproof galantine Joubert demipike howff elderly zomotherapy plim antiholiday interpretableness
673,RjWgK,2003/05/04 10:33:41,92,kIVUJFnKwAPVdjopQpq,stimulogenous interlocation nonclerical advancedness romanticity desmography unfortunately piscary beamful fossilize antibacteriolytic linin Choco sentimentless anteportico chalcon ichneumonoid Dungan demiculverin hoarwort
500,9ovaU,2013/04/20 18:06:09,85,k,lazyship Boulangism stellite calcaneocuboid sternomastoid cirripedial Elaps misaccent wampum unrewarding dorsabdominal ecderon resplend metempsychosal sociable avellano hypotonia belay unbush chamecephaly
418,8qunN,2012/02/09 16:34:56,4,vvTVSckhZRkVNUzTbvOS,unbrookably Ordovician Scenedesmus uncolt Berytidae Pandemonian bosomer concher beglic fishergirl molluscoidan moorn upblast juggle scintler huskened Berossos catalyze berapt miltlike
496,SpQyt,2018/11/06 23:24:21,37,wdJMAJtrypAYH,Capriola Chebacco labis meteoritic aeroporotomy semistriated riverlet lighterful armscye unhedge dogcatcher padstone tropicality miscompute metavanadic attentively tychoparthenogenesis value abietinic filmgoer
444,TcuQv,2021/07/09 04:15:26,4,tWeBxZXcqj,amethodically skeg multigap irregeneracy wiremaker prebaptize mesotrochous antirobin repulseproof unaristocratic Cainitic hexachord duty postliminary Snoqualmie cloudlessly chomp flixweed orchestian moleskin
300,QHP18,2011/08/04 14:27:39,2,DCmlPtqWeRmtZLzHr,hyperphalangism expropriable nonexecution chronocinematography unpanoplied tetrapetalous Clotho choraleon rabbin basined spellbinder primipara paleopsychic stormish aurite olefiant metascutum gastrodiaphanoscopy furtiveness unsacrificing
784,2p6HE,2020/10/08 12:30:25,30,TIlHJ,arquerite waltz kiestless unimplored dookit odd thermoplasticity laevotartaric gnathitis kochliarion raylessness crownling snarlingly sutler brachytypous poise extension anconeal undersighted motorcar
391,o8K2k,2014/02/25 05:13:59,60,VG,decimate stay uninsatiable obsecrationary prealcoholic betrousered cavitate hydrolase rampire geranium nonphilosophical earthiness asterism toshnail maritality unrevered verticality peaceless drastically meditativeness
745,CdxeV,2003/08/28 14:00:51,34,aXguraSKrjBZjXJ,felicity supersemination Darwinically imperious resolved satiric Carmela babroot diplotegia Aeolic proverbize subsecretarial stylistics hydracetin holding unmentionableness aeromechanical venturousness mediocrity Monanday
117,e8GMf,2005/10/03 08:29:57,63,QGDpKCLCbwHZfZwdO,sematography merism orchidopexy wecht treponematous zoiatrics nuncupative roistering antidemoniac unit seafare stupulose sausagelike magnecrystallic equidivision ethnopsychic monocarbonic histogenetically proemium reinsman
106,96MaZ,2021/10/02 19:06:06,61,j,limberness pansclerosis unfairylike foralite unwifed antipastic chapiter boghole blunk Juglans alalunga phasmoid oneiric spatiotemporal flawless cryptobranch intervolution unchamfered wrothly ingesta
95,XesB2,2015/04/03 19:15:25,4,RzdQh,microcolumnar outsay unsubdued Benedicta Luscinia unavowably anaudia paginary Macusi gloeocapsoid sots Isaria underconcerned etymon isoplere stauk hypotarsal illuminational effortlessly overcarelessness
445,Jb4Em,2018/06/09 08:48:29,55,dJPztxJyqySBTioMWtW,polymorphonucleate autobasidia porry trichorrhea emiction pericranium Dondia loamily rescan clergyable unrealized axilla Semang Moschidae sucuruju otacousticon reflectance Tentaculites shopster supraseptal
249,jZo2f,2002/07/05 12:38:50,97,GYNhyTAZPKrfRAgRcq,hypermakroskelic surfle Erithacus ruling unmeltedness shoother gainsay banana microtitration externation accendibility Nyctaginaceae quadriplegia pulegol Peul macrochemistry dissimilars unfestive chemiotropic versor
622,J33O6,2003/11/22 18:48:04,96,xepyL,visionist repurchase Johnian knopweed protodonate noisiness fahlunite anthrone unblemishedness assumingly squarrose courtzilite canada afire misterm Isiacal nonpacific paperful counterparole paunch
370,D5Tki,2016/01/26 21:30:14,67,t,singularly hustle azox catlike piscifauna wicopy chiefish solicitor nobilitation cloamen catalepsy anker underclothes Alikuluf cataclysmic uronephrosis Archimedes decemfid tinge unmastered
831,Ltpor,2018/06/20 08:04:50,59,iGlwanQv,misknowledge misthink unknocked charger articulacy nonsitting scullery plausive edifice hammerwort ijma positiveness crummier contravener aponeurorrhaphy begray resuscitant suburbanhood clothesmonger unsweetenedness
994,c3mY1,2004/08/06 18:30:00,79,OWgJhctQwmk,air reintimate unswept archspirit microzone unfatten opinative depositure myoglobulin cononintelligent pyronaphtha befoulment jours bundobust tripalmitate skittler Marssonia duddies factive Eli
575,irIYM,2020/08/23 12:31:43,68,Rxio,clairschach volborthite persecute thelytocia watchwise commassation laticiferous Telopea crepusculum tigger Latirostres inlagation transubstantiatory babeship podagra mowch rebus calcifugous okapi relentlessness
436,Bq5Gk,2000/08/24 03:47:56,98,QNAT,superintellectual contactually dimercurion cymbiform corpuscule puke intrarhachidian malandrous Judaically burin tantalic vulnerative portraiture uptown priestlike reconciliatory unregenerately strengthen antihelix biflex
258,NtV5K,2020/02/13 23:00:49,92,zGcWeAdd,buffoon unsmutted centonical Frankist partlet enteropneust aporobranchian antiopiumite thermotically camarilla hebetation autoerotic parastemonal cotoin Tanya Dytiscidae cantlet Asiarchate companion pulsojet
585,nSEzC,2001/09/03 03:35:43,29,xwjC,scholasticly sneerer predicableness haemorrhoid deindustrialization dissilient ensure acloud swashbucklery trizone hemapophysis geniculately babingtonite pyrrotriazole prohumanistic flytrap withhold nucleoid epitheloid odontocete
187,5p2EK,2014/12/10 22:32:39,75,i,convergency pinnotherian canions splenectomize Italianately hylomorphism hexagrammoid corticating ravinate metonymous rhetorically lymphopoietic waved dalespeople streamy magnetoprinter paralogician theophagous vitreum uterogestation
176,ZNGkm,2014/08/01 17:54:24,59,WEK,lastre shippy hysteroneurasthenia adaptedness Compsognathus outbacker unindebtedness preambition knyaz changar factitial roter syncopated aphicidal moccasin broking nonprophetic proximal earliness passionist
110,RZkEP,2010/02/28 20:09:13,100,MlpeYZz,misclassification uneclipsed manurance unweb pseudostereoscopism multipolar dervishism synsacral jokelet sporidesm overslander courtezanry petty dicranterian unmeasurable apertometer Polesian delomorphic oldland aghastness
179,pDP7V,2022/05/06 13:50:18,6,qHAXwCOxdrAM,paracmasis epibatholithic understring underbeat chargeableness windgall kehoeite laciness barbion Welshness sphragide phallist tripsome lyery snakeproof corycavamine campanular overpainfulness brackish basilisk
354,E6qM1,2023/02/23 02:16:56,45,ADWuEWGvcBFvx,uncreate fruitless theomania Hippoglossus hypersophisticated nosepinch volcanize gasper incoherentific digitated litiscontest aflow shortage daggers octamerous intrachordal satanical worldling underlimit humming
48,6k0yM,2004/09/26 09:40:29,38,siZobBonpGzABDVfUK,axoplasm pachyglossal antiradical inaugurate Cutleriaceae darrein stimy visionariness duplexity tactfulness writ unsympathizability refulgence stalklike centrosphere monstrator backchat celiogastrotomy interpupillary fecundative
219,97zBx,2014/08/11 03:34:07,92,nmbXigksOCkVUMcgTu,internationalization adnexopexy depend Kowagmiut Rhina sagvandite mannoketoheptose oophore motionlessly Anita Smalcaldic atrichia Fullonian jellydom cuspidate whally rickstand quaternal Polemonium money
810,b3X1b,2007/10/28 11:04:45,31,Dphcv,electrical Pedetidae serpentinic attritus southernly mesoscutellum josephinite Waco pappi ditremid transpiratory parasternal chondrodystrophia suaviloquence reobserve activism harsh Centaurea philothaumaturgic primiparity
533,LdeLw,2020/01/14 15:41:32,32,dde,sneap fugaciously Getae zoom orthognathous graith damascenine fluophosphate disheartening secern nodulize kikumon nonanaphthene cointer frigoric assassinator postapoplectic acetoacetic nucleoid orthoepically
629,GhC99,2017/09/07 01:12:55,30,xADUMRGXXxxodklNc,lithoclasty aerial botherment caliver officer analysability stealthiness hylism respectfulness paleopsychological amminolysis cranked cerograph refire bagwyn honorance disguiser shrimp thistled Paussidae
492,Vzpnd,2006/12/02 11:53:40,59,sTyVTIeSBQvpex,lightheartedness doghood upbrought huckstery Carian authorizable ebulus overblown traily ineligibleness justificator portamento schoolteachery collected volost stalactitical welly egophonic unbarricade restep
929,fR8Kz,2018/04/08 21:15:29,48,ZhwxLhE,dispendious coffin damascener urinemia intersociety omniperfect penninervate orarian nonisotropic Sanhita barrelful crumble yon pillaring existability quintet autocarpian aerobium overfamiliarity gadinine
502,nU9lk,2007/07/28 14:56:05,83,ovOMgxqIP,unspottable multitubular gavelock synergidal equable unelect hexaplarian Rachianectes domesticize Skip airwards kasa parapsidal grinny remagnification Philonist Celia logograph Apina stereotelemeter
365,CdvOn,2020/10/18 03:23:46,29,QOiyQthSR,prolificy unorthodoxy Tommy locomotive myrrh fishhouse carbanil step protevangelion Ossianesque seamark Newmanism morigerously courtiership inveracious aflow Antarctogaea palaeoniscid Solomonian xanthate
248,b6PJH,2010/05/19 04:39:07,72,BvLeSmqMzZsnFF,morbify yinst scolog adipocerous weldability carunculated urochord archmarshal nondeterminist sacatra raze overtravel Caladium monrolite titty nonsiccative untwined legitimistic curve blinking
571,wgb9Y,2021/08/11 17:51:54,42,klJKREsEUaNT,uplift tunnellike lauryl picayunishness furrier Microcyprini pharmaceutist bucket whimberry diphenylchloroarsine clientless influent unreplenished pharmacologic nitromuriate morvin fragmentation interminableness replan gastrostenosis
700,cQQXv,2014/10/07 02:04:09,97,keHE,quadrifoliate caffeate hotheadedness subexcite plexiform pedipalpous Honora phytopaleontologic occupative monsterlike imposter reappease unintermittingness unwrapped protectress superexcellence lidder hamule kame angelomachy
721,QFn7j,2012/01/23 18:22:50,2,NQVTSYzwWYmv,jackweed Cushitic benzalazine sarkical epipodium shoddy preinaugural onerary unadaptedly mailer Samgarnebo superannuate stingproof Oxyrrhyncha dreamlike Pneumatomachist idealess prison tical smelly
14,3kz2B,2010/02/12 02:12:32,12,bGnUlvs,buried oleothorax boltuprightness Rhacomitrium acrocephaly unindividual outdoorsman volplane anisognathism polynucleated damourite bearward Fingallian pluckedness overmerciful foodless pinoleum upbear butler midspace
688,XseSR,2007/01/25 22:00:49,76,ZEEQHgfdlDLgJyXmSQ,reflectometry waggy intracostal vocalistic secretmonger nonpyritiferous intratonsillar ichthulin Korean emphatic Treroninae policize quaintly khaki paxillate bang morgan computation foodlessness bipunctal
428,GcNAU,2007/12/01 06:16:27,3,COwAbVUgIehqBrtZ,antrectomy defeature erythroblastosis consolatory saved figworm semiocclusive somnambulator semball appellate Licania romanticistic arthrosporic seethingly Oghuz unhook monocarboxylic smallmouth retrocessive inexact
633,HbwA0,2012/02/27 21:52:51,3,weBKzDCbmhEkngusH,sugan commendador throve artophagous atinkle adenotome ulnoradial greedy Cannabis shimmer innascible breastweed timbrophily accentually dynamitard Adam epithetic unperforate rehonor elbowy
832,MiRkA,2013/07/21 22:17:00,83,VKmyFLTKgTL,forewonted slopmaking loudly election Scombresocidae Sturmian polycotyly entropy Subakhmimic dual cothurnian brazier photophygous diverter Palau menorrhagia bolimba aristogenesis pestful Shaker
105,u0JmL,2010/01/23 18:09:54,2,DWNJzmjw,laborable acetylization nicetish myelomere penaeaceous greenkeeper genialness entoderm assayer forecar infratubal monsoonal chamaeprosopic aquacultural eurythmy lithoidite removedness heterochthon isorrhythmic Phasmatoidea
798,48gOA,2000/11/19 00:53:38,27,mtbyqcUAxwN,Yamel phantasmically quaintly sailorman coeline coparent saucedish rainworm superprobability examinatory platyopic derelictly coatimondie Lamaist conormal enneahedral babish septave tapacolo prankle
28,BU19c,2012/10/13 16:09:52,99,PuNYj,counteravouch tailorly chickenhearted roburite meadowink vyingly Ardeidae petaurist unfletched superaccommodating smother swartly quondamly pentace licensee Limidae xanthyl prophetry overseed saggon
728,QH9Xj,2019/02/12 14:18:31,2,CHCXZvGcXQ,capful doveling Adelochorda dovetailed archdisturber Brahmanical isodactylism ignore carpophyte paraphrastic turret journeycake subterposition romancelet boccaro electropism Monotheletian stria completive synechotomy
617,7ggXt,2021/07/09 02:17:30,25,iU,commentate heritor literature pleuropulmonary pyritization cubdom niggle cipherer armlet obtusifid philobiblian extraenteric synartesis leaven loess mydatoxine tuberculin zealousy understrain anythingarian
554,CQVCg,2005/01/08 10:42:15,97,jtSpcGqFnhhHUxr,avidous imitational rhizomorphoid platformy canon tubicination meetness hemimellitene Sphacelaria intoxicatedly intaxable tufty veterinary hist lugubriosity Rosabella pellucid teallite underparticipation contraclockwise
381,vSpA8,2023/04/11 03:49:08,84,kghbDSruTXTxWPobx,bilabiate Pharyngobranchii paunchily biasteric proudishly extraorganismal nonelemental democratism dingly semiprofessionalized anodyne nematogone avadana immutual immaturely profraternity unimpowered androphagous mouthily complacent
499,eAxk5,2006/12/24 19:03:07,87,KCQaLNKJhfewiIDrBzv,pebbly foundation embole Danewort Saviour glossary Pratincola venture argental bichrome sate magician unlevel malpractioner optician afferent spartacist metronymy wairepo omnivorously
155,46gYh,2006/12/27 14:10:40,77,tReYKDE,cycadaceous hemipyramid Bezaleel pseudocommissure antiturnpikeism fluvioglacial Cupressus animalize pubofemoral reimport coveting isoantibody lobed disembosom Herulian toiletry unbedaubed extraperiosteal rascallike biogeochemistry
488,hCenp,2016/02/23 20:31:32,14,LXHNOLUnnbjzKvMC,sclerosis Pisonia casemated hypophrenosis lifesaving oxter autogenetically unconspicuous Isabelle manganous January minstrelship Kirman praesidium conservable stereogram howso grithman moop rowdiness
29,zXA9w,2017/03/21 22:04:04,35,jJEBcFoFLM,painproof subpartition domite commassation popify Pacht Vulturinae paralipomena anaetiological Lar chiripa Cultrirostres verticillastrate dietrichite peshwa choree blowcock lobulous urbification thwartover
378,PuujT,2014/03/09 21:03:44,14,DSkoJ,diota Landsting equipotentiality chromoparous vireo propurchase cheepily flourishment susurrant northeastwards hypoactivity uningrafted gracefulness preimportant becudgel inversion insofar excision diplospondylism Steinberger
876,ZtOqR,2001/05/24 04:37:46,94,lryXUEqTbic,circumconic protractedly Ramaism zoocecidium frithbot barracouta crookshouldered strawman hebamic refrenation Keith linoleic ovogonium Curtise unmounded simpler preaggravation sniffy small reconstructionist
424,EfSvy,2002/03/09 20:42:22,66,QIQhdp,ungrayed tombless squencher thumb effectualness Circe thermochemically plicatocontorted dispersement necrologist porcelainization adhibit quegh impregnable palatinate remilitarize heroism deltoidal unwieldiness dogshore
625,5OjCY,2015/01/16 08:39:23,36,yItOlUad,schoolmastery whinnel lickerishness scorned plectre ghatwal armpit engastrimyth sulfoxylic cocreatorship Sobranje hemiscotosis Dactylis ungeological undecayed marlinespike pteropegum gurl photoinactivation pilastered
805,uIplN,2012/11/14 21:21:29,6,RmjpTORjvlvQAQfd,uncentrality reproclamation rheumatic monostrophics Attalid fightingly acetonitrile serjeant Abelite addebted Shawnee heterokinetic lineate phacella Chinaman unclipper propiolaldehyde institutionary sharer retinaculate
453,kbHIh,2005/04/25 20:04:59,84,NYNrseLl,forbit reliever nonparent synorthographic fullery aiguille polydomous interpretatively postotic ataxiagraph Cyanea perisplenic Wagener corticoafferent ensignhood engagingness amylaceous pomeridian nitric faithlessness
64,qIr4v,2010/04/28 00:34:49,80,rNa,periosteoma Cephalocereus orientization semitranslucent loxoclase becolme oakenshaw overlavishly pseudamphora fess malnourished curst preoffensiveness archliar euploidy urnlike seragli verminousness shamanic curmudgeonly
912,H7OZy,2020/02/11 04:02:52,79,hf,since unscared nerine unhumored godmotherhood nonviolation uranium whipsawyer calciphile pacificate lod reminder unsubverted slanderously scratchcat overgentle goniometric pseudoracemism siderosis treasonableness
65,aC77a,2014/05/11 08:19:17,93,fBFRZMnVMbdQYL,pick amatrice autoriser eclair scheming phoronomically paunch bowknot dolichocnemic tremelloid splasher Helderbergian tauntingly inexistency Helianthoidea vallevarite sympathetical antiquarianly furfural chinned
720,OefWI,2000/02/13 03:01:27,89,dqt,nowhereness androtauric saddlestead blepharorrhaphy pantalets monospermous amylopsin staged natability humlie nemophilous hyperconscious bridal weeded underspore Eunomianism undenominationalize floccipend dudley estreat
839,uR6kD,2019/02/28 07:30:47,1,zXyweObxFYJb,Omaha monophagous antroscopy theological revolutionally Tommy gilt evangelary unsubjectable implanter tide emptor coelector subpeltated workways visuosensory foreassign nongaseous thoracectomy rhabdophane
